# name: test/sql/copy/csv/test_ignore_errors.test
# description: IGNORE_ERRORS test
# group: [csv]

statement ok
CREATE TABLE integers(i INTEGER, j INTEGER);

statement ok
COPY integers FROM 'test/sql/copy/csv/data/test/error_too_little.csv' (HEADER, IGNORE_ERRORS)

# not enough columns provided
query II
SELECT * FROM integers AS too_little_columns
----
1	1
2	2
3	3
4	4
5	5

statement ok
DELETE FROM integers;

statement ok
COPY integers FROM 'test/sql/copy/csv/data/test/error_too_many.csv' (HEADER, IGNORE_ERRORS)

# too many columns provided
query II
SELECT * FROM integers AS too_many_columns
----
1	1
2	2
3	3
4	4
5	5
