# name: test/sql/copy/csv/test_copy_null.test
# description: Test NULL option of copy statement
# group: [csv]

# generate CSV file with default delimiter
# create a table
statement ok
CREATE TABLE test_null_option (col_a INTEGER, col_b VARCHAR(10), col_c VARCHAR(10), col_d VARCHAR(10));

# test COPY ... FROM ...
# implicitly using default NULL value
query I
COPY test_null_option FROM 'test/sql/copy/csv/data/test/test_null_option.csv';
----
3

query ITTT
SELECT * FROM test_null_option ORDER BY 1 LIMIT 3;
----
0	NULL	test	null
1	NULL	test	null
2	NULL	test	null

statement ok
DELETE FROM test_null_option;

# explicitly using default NULL value
query I
COPY test_null_option FROM 'test/sql/copy/csv/data/test/test_null_option.csv' (NULL '');
----
3

query ITTT
SELECT * FROM test_null_option ORDER BY 1 LIMIT 3;
----
0	NULL	test	null
1	NULL	test	null
2	NULL	test	null

statement ok
DELETE FROM test_null_option;

# make sure a quoted null string is interpreted as a null value
query I
COPY test_null_option FROM 'test/sql/copy/csv/data/test/test_null_option.csv' (NULL 'test');
----
3

query ITTT
SELECT * FROM test_null_option ORDER BY 1 LIMIT 3;
----
0	(empty)	NULL	null
1	(empty)	NULL	null
2	(empty)	NULL	null

statement ok
DELETE FROM test_null_option;

# setting specific NULL value
query I
COPY test_null_option FROM 'test/sql/copy/csv/data/test/test_null_option.csv' (NULL 'null');
----
3

query ITTT
SELECT * FROM test_null_option ORDER BY 1 LIMIT 3;
----
0	(empty)	test	NULL
1	(empty)	test	NULL
2	(empty)	test	NULL

# invalid parameter type
statement error
COPY test_null_option FROM 'test/sql/copy/csv/data/test/test_null_option.csv' (NULL null);

# delimiter must not appear in the NULL specification
statement error
COPY test_null_option FROM 'test/sql/copy/csv/data/test/test_null_option.csv' (NULL 'null,');

statement error
COPY test_null_option FROM 'test/sql/copy/csv/data/test/test_null_option.csv' (DELIMITER 'null', NULL 'null');

statement error
COPY test_null_option FROM 'test/sql/copy/csv/data/test/test_null_option.csv' (DELIMITER 'null', NULL 'nu');

# no parameter type
statement error
COPY test_null_option FROM 'test/sql/copy/csv/data/test/test_null_option.csv' (NULL);

# empty integer column with non-default NULL string
statement ok
CREATE TABLE test_null_option_2 (col_a INTEGER, col_b INTEGER, col_c VARCHAR(10), col_d VARCHAR(10));

statement error
COPY test_null_option_2 FROM 'test/sql/copy/csv/data/test/test_null_option.csv' (NULL 'null');

# test COPY ... TO ...
# implicitly using default NULL value
query I
COPY test_null_option TO '__TEST_DIR__/test_null_option_2.csv';
----
3

statement ok
DELETE FROM test_null_option;

query I
COPY test_null_option FROM '__TEST_DIR__/test_null_option_2.csv';
----
3

query ITTT
SELECT * FROM test_null_option ORDER BY 1 LIMIT 3;
----
0	NULL	test	NULL
1	NULL	test	NULL
2	NULL	test	NULL

# explicitly using default NULL value
query I
COPY test_null_option TO '__TEST_DIR__/test_null_option_3.csv' (NULL '');
----
3

statement ok
DELETE FROM test_null_option;

query I
COPY test_null_option FROM '__TEST_DIR__/test_null_option_3.csv' (NULL '');
----
3

query ITTT
SELECT * FROM test_null_option ORDER BY 1 LIMIT 3;
----
0	NULL	test	NULL
1	NULL	test	NULL
2	NULL	test	NULL

# setting specific NULL value
query I
COPY test_null_option TO '__TEST_DIR__/test_null_option_4.csv' (NULL 'null');
----
3

statement ok
DELETE FROM test_null_option;

query I
COPY test_null_option FROM '__TEST_DIR__/test_null_option_4.csv' (NULL 'null');
----
3

query ITTT
SELECT * FROM test_null_option ORDER BY 1 LIMIT 3;
----
0	NULL	test	NULL
1	NULL	test	NULL
2	NULL	test	NULL

