# name: test/sql/copy/csv/test_copy_null.test
# description: Test NULL option of copy statement
# group: [csv]

statement ok
PRAGMA enable_verification


# generate CSV file with default delimiter
# create a table
statement ok
CREATE TABLE test_null_option (col_a INTEGER, col_b VARCHAR(10), col_c VARCHAR(10), col_d VARCHAR(10), col_e VARCHAR);

# test COPY ... FROM ...
# implicitly using default NULL value
query I
COPY test_null_option FROM '{DATA_DIR}/csv/test/test_null_option.csv' (NULL 'NULL');
----
3

query ITTTT
SELECT * FROM test_null_option ORDER BY 1 LIMIT 3;
----
0	(empty)	test	null	NULL
1	(empty)	test	null	NULL
2	(empty)	test	null	NULL

statement ok
DELETE FROM test_null_option;

# explicitly using default NULL value
query I
COPY test_null_option FROM '{DATA_DIR}/csv/test/test_null_option.csv' (NULL '');
----
3

query ITTTT
SELECT * FROM test_null_option ORDER BY 1 LIMIT 3;
----
0	NULL	test	null	NULL
1	NULL	test	null	NULL
2	NULL	test	null	NULL

statement ok
DELETE FROM test_null_option;

# make sure a quoted null string is not interpreted as a null value
query I
COPY test_null_option FROM '{DATA_DIR}/csv/test/test_null_option.csv' (NULL 'test');
----
3

query ITTTT
SELECT * FROM test_null_option ORDER BY 1 LIMIT 3;
----
0	(empty)	NULL	null	NULL
1	(empty)	NULL	null	NULL
2	(empty)	NULL	null	NULL

statement ok
DELETE FROM test_null_option;

# setting specific NULL value
query I
COPY test_null_option FROM '{DATA_DIR}/csv/test/test_null_option.csv' (NULL 'null');
----
3

query ITTTT
SELECT * FROM test_null_option ORDER BY 1 LIMIT 3;
----
0	(empty)	test	NULL	NULL
1	(empty)	test	NULL	NULL
2	(empty)	test	NULL	NULL

# invalid parameter type
statement error
COPY test_null_option FROM '{DATA_DIR}/csv/test/test_null_option.csv' (NULL null);
----
NULL is not supported

# delimiter must not appear in the NULL specification
statement error
COPY test_null_option FROM '{DATA_DIR}/csv/test/test_null_option.csv' (NULL 'null,', DELIMITER ',');
----
DELIMITER must not appear in the NULL specification and vice versa

statement error
COPY test_null_option FROM '{DATA_DIR}/csv/test/test_null_option.csv' (DELIMITER 'null', NULL 'null');
----
It was not possible to automatically detect the CSV parsing dialect

statement error
COPY test_null_option FROM '{DATA_DIR}/csv/test/test_null_option.csv' (DELIMITER 'null', NULL 'nu');
----
It was not possible to automatically detect the CSV parsing dialect

# no parameter type
statement error
COPY test_null_option FROM '{DATA_DIR}/csv/test/test_null_option.csv' (NULL);
----
CSV Reader function option null requires a non-empty list of possible null strings (varchar) as input

# empty integer column with non-default NULL string
statement ok
CREATE TABLE test_null_option_2 (col_a INTEGER, col_b INTEGER, col_c VARCHAR(10), col_d VARCHAR(10));

statement error
COPY test_null_option_2 FROM '{DATA_DIR}/csv/test/test_null_option.csv' (NULL 'null');
----
It was not possible to automatically detect the CSV parsing dialect

# test COPY ... TO ...
# implicitly using default NULL value
query I
COPY test_null_option TO '{TEMP_DIR}/test_null_option_2.csv';
----
3

statement ok
DELETE FROM test_null_option;

query I
COPY test_null_option FROM '{TEMP_DIR}/test_null_option_2.csv';
----
3

query ITTTT
SELECT * FROM test_null_option ORDER BY 1 LIMIT 3;
----
0	NULL	test	NULL	NULL
1	NULL	test	NULL	NULL
2	NULL	test	NULL	NULL

# explicitly using default NULL value
query I
COPY test_null_option TO '{TEMP_DIR}/test_null_option_3.csv' (NULL '');
----
3

statement ok
DELETE FROM test_null_option;

query I
COPY test_null_option FROM '{TEMP_DIR}/test_null_option_3.csv' (NULL '');
----
3

query ITTTT
SELECT * FROM test_null_option ORDER BY 1 LIMIT 3;
----
0	NULL	test	NULL	NULL
1	NULL	test	NULL	NULL
2	NULL	test	NULL	NULL

# setting specific NULL value
query I
COPY test_null_option TO '{TEMP_DIR}/test_null_option_4.csv' (NULL 'null');
----
3

statement ok
DELETE FROM test_null_option;

query I
COPY test_null_option FROM '{TEMP_DIR}/test_null_option_4.csv' (NULL 'null');
----
3

query ITTTT
SELECT * FROM test_null_option ORDER BY 1 LIMIT 3;
----
0	NULL	test	NULL	NULL
1	NULL	test	NULL	NULL
2	NULL	test	NULL	NULL

