# name: test/sql/copy/csv/test_blob.test
# description: Test BLOB with COPY INTO
# group: [csv]

# CSV file with almost ALL ASCII chars
# ASCII chars from 1 to 255, skipping '
# COPY INTO
statement ok
CREATE TABLE blobs (b BYTEA);

query I
COPY blobs FROM 'test/sql/copy/csv/data/test/blob.csv';
----
1

# test if the system correctly loads/stores the bytes
query T
SELECT b FROM blobs
----
\x0102030405060708090B0C0E0F101112131415161718191B1C1D1E1F202122232425262728292A2B2D2E2F303132333435363738393A3B3C3D3E3F404142434445464748494A4B4C4D4E4F505152535455565758595A5B5C5D5E5F606162636465666768696A6B6C6D6E6F707172737475767778797A7B7C7D7E7F808182838485868788898A8B8C8D8E8F909192939495969798999A9B9C9D9E9FA0A1A2A3A4A5A6A7A8A9AAABACADAEAFB0B1B2B3B4B5B6B7B8B9BABBBCBDBEBFC0C1C2C3C4C5C6C7C8C9CACBCCCDCECFD0D1D2D3D4D5D6D7D8D9DADBDCDDDEDFE0E1E2E3E4E5E6E7E8E9EAEBECEDEEEFF0F1F2F3F4F5F6F7F8F9FAFBFCFDFEBE

# testing copying to a file and copying them back in
query I
COPY blobs TO '__TEST_DIR__/blob.csv';
----
1

statement ok
DELETE FROM blobs

query I
COPY blobs FROM '__TEST_DIR__/blob.csv';
----
1

query T
SELECT b FROM blobs
----
\x0102030405060708090B0C0E0F101112131415161718191B1C1D1E1F202122232425262728292A2B2D2E2F303132333435363738393A3B3C3D3E3F404142434445464748494A4B4C4D4E4F505152535455565758595A5B5C5D5E5F606162636465666768696A6B6C6D6E6F707172737475767778797A7B7C7D7E7F808182838485868788898A8B8C8D8E8F909192939495969798999A9B9C9D9E9FA0A1A2A3A4A5A6A7A8A9AAABACADAEAFB0B1B2B3B4B5B6B7B8B9BABBBCBDBEBFC0C1C2C3C4C5C6C7C8C9CACBCCCDCECFD0D1D2D3D4D5D6D7D8D9DADBDCDDDEDFE0E1E2E3E4E5E6E7E8E9EAEBECEDEEEFF0F1F2F3F4F5F6F7F8F9FAFBFCFDFEBE

# now test it with a delimiter that occurs IN the blob
query I
COPY blobs TO '__TEST_DIR__/blob.csv' DELIMITER 'A' QUOTE 'B' ESCAPE 'C';
----
1

statement ok
DELETE FROM blobs

query I
COPY blobs FROM '__TEST_DIR__/blob.csv' DELIMITER 'A' QUOTE 'B' ESCAPE 'C';
----
1

query T
SELECT b FROM blobs
----
\x0102030405060708090B0C0E0F101112131415161718191B1C1D1E1F202122232425262728292A2B2D2E2F303132333435363738393A3B3C3D3E3F404142434445464748494A4B4C4D4E4F505152535455565758595A5B5C5D5E5F606162636465666768696A6B6C6D6E6F707172737475767778797A7B7C7D7E7F808182838485868788898A8B8C8D8E8F909192939495969798999A9B9C9D9E9FA0A1A2A3A4A5A6A7A8A9AAABACADAEAFB0B1B2B3B4B5B6B7B8B9BABBBCBDBEBFC0C1C2C3C4C5C6C7C8C9CACBCCCDCECFD0D1D2D3D4D5D6D7D8D9DADBDCDDDEDFE0E1E2E3E4E5E6E7E8E9EAEBECEDEEEFF0F1F2F3F4F5F6F7F8F9FAFBFCFDFEBE

