# name: test/sql/storage/rowid_gaps/indexed_no_merge_across_gap.test
# description: stable-rowid vacuum does not merge fully-live row groups across a rowid gap
# group: [rowid_gaps]

# Fully-live row groups may be merged while rowids must remain stable, but only
# if they already form a dense rowid interval. If a dropped row group leaves a
# gap between them, merging would collapse the gap and remap later rowids.

statement ok
ATTACH '{TEST_DIR}/rowid_gap_no_merge_across_gap.db' AS rowid_gap_no_merge (STORAGE_VERSION 'latest', ROW_GROUP_SIZE 4096);

statement ok
PRAGMA force_checkpoint;

statement ok
SET max_vacuum_tasks = 0;

statement ok
CREATE TABLE rowid_gap_no_merge.t(i INTEGER);

statement ok
INSERT INTO rowid_gap_no_merge.t SELECT i FROM range(1000) tbl(i);

statement ok
CHECKPOINT rowid_gap_no_merge;

statement ok
INSERT INTO rowid_gap_no_merge.t SELECT i FROM range(1000, 2000) tbl(i);

statement ok
CHECKPOINT rowid_gap_no_merge;

statement ok
INSERT INTO rowid_gap_no_merge.t SELECT i FROM range(2000, 3000) tbl(i);

statement ok
CHECKPOINT rowid_gap_no_merge;

query I
SELECT COUNT(DISTINCT row_group_id) FROM pragma_storage_info('rowid_gap_no_merge.t');
----
3

statement ok
CREATE INDEX t_i_idx ON rowid_gap_no_merge.t(i);

statement ok
DELETE FROM rowid_gap_no_merge.t WHERE i >= 1000 AND i < 2000;

statement ok
SET max_vacuum_tasks = 99;

statement ok
FORCE CHECKPOINT rowid_gap_no_merge;

query I
SELECT COUNT(DISTINCT row_group_id) FROM pragma_storage_info('rowid_gap_no_merge.t');
----
2

query III
SELECT min(rowid), max(rowid), count(*) FROM rowid_gap_no_merge.t;
----
0	2999	2000

query I
SELECT count(*) FROM rowid_gap_no_merge.t WHERE rowid >= 1000 AND rowid < 2000;
----
0

query II
SELECT rowid, i FROM rowid_gap_no_merge.t WHERE i IN (999, 2000) ORDER BY i;
----
999	999
2000	2000
