# name: test/sql/constraints/foreignkey/test_fk_self_referencing.test
# description: Test self referencing foreign key constraint
# group: [foreignkey]

statement ok
PRAGMA enable_verification;

statement error
CREATE TABLE employee(
	id INTEGER PRIMARY KEY,
	managerid INTEGER,
	name VARCHAR,
	FOREIGN KEY(managerid) REFERENCES employee(emp_id));
----
<REGEX>:Binder Error.*does not have a column named.*

statement ok
CREATE TABLE employee(
	id INTEGER PRIMARY KEY,
	managerid INTEGER,
	name VARCHAR,
	FOREIGN KEY(managerid) REFERENCES employee(id));

statement ok
INSERT INTO employee VALUES (1, NULL, 'Smith'), (2, NULL, 'Jhon'), (3, NULL, 'Romeo');

statement error
INSERT INTO employee VALUES (4, 4, 'Mark');
----
<REGEX>:Constraint Error.*Violates foreign key constraint.*

statement ok
INSERT INTO employee VALUES (4, 2, 'Mark');

# The value (4, 2, 'Mark') references employee number 2.
# Thus, we cannot update 2 to 5.
statement error
UPDATE employee SET id = 5 WHERE id = 2;
----
<REGEX>:Constraint Error.*Violates foreign key constraint.*

# The value (4, 2, 'Mark') references employee number 2.
# Thus, we cannot delete 2.
statement error
DELETE FROM employee WHERE id = 2;
----
<REGEX>:Constraint Error.*Violates foreign key constraint.*

statement ok
DELETE FROM employee WHERE id = 4;

query IIT
SELECT * FROM employee ORDER BY ALL;
----
1	NULL	Smith
2	NULL	Jhon
3	NULL	Romeo

statement ok
UPDATE employee SET name = 'Juliet' WHERE id = 3;

query IIT
SELECT * FROM employee ORDER BY ALL;
----
1	NULL	Smith
2	NULL	Jhon
3	NULL	Juliet

# Primary key violation.
statement error
UPDATE employee SET id = 2 WHERE id = 3;
----
<REGEX>:Constraint Error.*violates primary key constraint.*

statement ok
UPDATE employee SET id = 4 WHERE id = 3;

query IIT
SELECT * FROM employee ORDER BY ALL;
----
1	NULL	Smith	
2	NULL	Jhon	
4	NULL	Juliet	

# No manager with id 5.
statement error
UPDATE employee SET managerid = 5 WHERE id = 4;
----
<REGEX>:Constraint Error.*Violates foreign key constraint.*

statement ok
UPDATE employee SET managerid = 2 WHERE id = 4;

query IIT
SELECT * FROM employee ORDER BY ALL;
----
1	NULL	Smith
2	NULL	Jhon
4	2	Juliet

statement ok
UPDATE employee SET id = 5, managerid = 2 WHERE id = 4;

query IIT
SELECT * FROM employee WHERE managerid = 2;
----
5	2	Juliet	

statement error
ALTER TABLE employee RENAME COLUMN managerid TO managerid_new;
----
<REGEX>:Catalog Error.*is involved in the foreign key constraint.*

statement ok
ALTER TABLE employee RENAME COLUMN name TO name_new;

statement error
ALTER TABLE employee ALTER COLUMN id SET DATA TYPE TEXT;
----
<REGEX>:Binder Error.*Cannot change the type of a column that has a UNIQUE or PRIMARY KEY constraint specified.*

statement ok
ALTER TABLE employee ALTER COLUMN name_new SET DATA TYPE TEXT;

statement error
ALTER TABLE employee DROP COLUMN id;
----
<REGEX>:Catalog Error.*there is a UNIQUE constraint that depends on it.*

statement error
ALTER TABLE employee DROP COLUMN managerid;
----
<REGEX>:Catalog Error.*there is a FOREIGN KEY constraint that depends on it.*

statement ok
ALTER TABLE employee DROP COLUMN name_new;

statement ok
DROP TABLE employee;
