# name: test/sql/alter/add_pk/test_add_pk_gaps_in_rowids.test
# description: Test adding a PRIMARY KEY to a table with gaps in its row IDs.
# group: [add_pk]

statement ok
PRAGMA enable_verification

statement ok
CREATE TABLE integers(i integer)

statement ok
INSERT INTO integers SELECT * FROM range(50000);

query I
SELECT i FROM integers WHERE i = 100
----
100

statement ok
DELETE FROM integers WHERE i = 42;

statement ok
ALTER TABLE integers ADD PRIMARY KEY (i);

query I
SELECT i FROM integers WHERE i = 100
----
100