# name: test/sql/merge/merge_multi_match_error.test
# description: MERGE raises a cardinality error when a WHEN MATCHED action would affect a target row twice
# group: [merge]

statement ok
CREATE TABLE target (k INTEGER, v INTEGER);

statement ok
INSERT INTO target VALUES (1, 10);

statement ok
CREATE TABLE source (k INTEGER, v INTEGER);

# two source rows match the single target row
statement ok
INSERT INTO source VALUES (1, 100), (1, 200);

# WHEN MATCHED UPDATE affecting the same target row twice -> cardinality error
statement error
MERGE INTO target USING source ON target.k = source.k
WHEN MATCHED THEN UPDATE SET v = source.v;
----
cannot affect the same target row more than once

# WHEN MATCHED DELETE with the same multi-match -> also an error
statement error
MERGE INTO target USING source ON target.k = source.k
WHEN MATCHED THEN DELETE;
----
cannot affect the same target row more than once

# target unchanged after the failed merges
query II
SELECT k, v FROM target;
----
1	10

# single match succeeds
statement ok
DELETE FROM source WHERE v = 200;

statement ok
MERGE INTO target USING source ON target.k = source.k
WHEN MATCHED THEN UPDATE SET v = source.v;

query II
SELECT k, v FROM target;
----
1	100

# ── conditional WHEN MATCHED: the error tracks actions actually taken, not raw matches ──
statement ok
CREATE TABLE tc (k INTEGER, v INTEGER);

statement ok
INSERT INTO tc VALUES (1, 10);

statement ok
CREATE TABLE sc (k INTEGER, v INTEGER);

statement ok
INSERT INTO sc VALUES (1, 50), (1, 200);

# two sources match k=1, but only one passes the action condition -> one action -> no error (matches PostgreSQL)
statement ok
MERGE INTO tc USING sc ON tc.k = sc.k
WHEN MATCHED AND sc.v > 100 THEN UPDATE SET v = sc.v;

query II
SELECT k, v FROM tc;
----
1	200

# now both sources pass the condition -> two actions on the same row -> error
statement ok
UPDATE sc SET v = 150 WHERE v = 50;

statement error
MERGE INTO tc USING sc ON tc.k = sc.k
WHEN MATCHED AND sc.v > 100 THEN UPDATE SET v = sc.v;
----
cannot affect the same target row more than once

# ── multiple matches but no matched-modifying action: no error ──────────────────
statement ok
CREATE TABLE t_ins (k INTEGER, v INTEGER);

statement ok
INSERT INTO t_ins VALUES (1, 10);

statement ok
CREATE TABLE s_ins (k INTEGER, v INTEGER);

statement ok
INSERT INTO s_ins VALUES (2, 1), (2, 2);

# both source rows are NOT MATCHED (k=2 not in target); INSERT only -> no cardinality check
statement ok
MERGE INTO t_ins USING s_ins ON t_ins.k = s_ins.k
WHEN NOT MATCHED THEN INSERT VALUES (s_ins.k, s_ins.v);

query I
SELECT count(*) FROM t_ins;
----
3

# ── WHEN NOT MATCHED BY SOURCE modifies each target row at most once: no error ───
statement ok
CREATE TABLE t_src (k INTEGER, v INTEGER);

statement ok
INSERT INTO t_src VALUES (1, 10), (2, 20);

statement ok
CREATE TABLE s_src (k INTEGER, v INTEGER);

# two source rows, neither matching the targets
statement ok
INSERT INTO s_src VALUES (9, 1), (9, 2);

statement ok
MERGE INTO t_src USING s_src ON t_src.k = s_src.k
WHEN NOT MATCHED BY SOURCE THEN UPDATE SET v = 0;

query II rowsort
SELECT k, v FROM t_src;
----
1	0
2	0

# ── unique matches over many rows still succeed ─────────────────────────────────
statement ok
CREATE TABLE t_big (k INTEGER, v INTEGER);

statement ok
INSERT INTO t_big SELECT i, 0 FROM range(1, 3000) tbl(i);

statement ok
CREATE TABLE s_big (k INTEGER, v INTEGER);

statement ok
INSERT INTO s_big SELECT i, i FROM range(1, 3000) tbl(i);

statement ok
MERGE INTO t_big USING s_big ON t_big.k = s_big.k
WHEN MATCHED THEN UPDATE SET v = s_big.v;

query I
SELECT count(*) FROM t_big WHERE v = k;
----
2999
