# name: test/sql/optimizer/rewrite_nan_null.test
# description: Expression-rewriter rules must preserve NaN ordering and NULL propagation
# group: [optimizer]

# Both bugs below were found the same way: generate ~1000 <function> <op> <constant> predicates over a
# corpus containing NULL, NaN, -0.0 and the infinities, evaluate each as a PROJECTION (so the third
# truth value is visible - inside a WHERE, NULL and FALSE are indistinguishable), and diff the results
# against the same run with each of the 43 optimizers disabled in turn.
#
# 1. MoveUnaryMinusRule rewrote [-x OP c] to [x FLIPPED_OP -c] and guarded it with AND NOT isnan(x)
#    for every ordered comparison. -NaN is still NaN and DuckDB orders NaN above everything, so
#    [-x > c] and [-x >= c] are TRUE for a NaN input while the flipped [x < -c] / [x <= -c] are FALSE.
#    Those two directions need OR isnan(x); only < and <= need AND NOT isnan(x). Rows were dropped.
#
# 2. DateTruncSimplificationRule folded an unsatisfiable date_trunc comparison to a bare TRUE/FALSE
#    constant. That is right for the NULL-safe IS [NOT] DISTINCT FROM forms, but plain = and <> must
#    still propagate NULL, so a NULL input silently became FALSE (resp. TRUE).

# --- 1. unary minus and NaN ------------------------------------------------------------------------

statement ok
CREATE TABLE neg(id INTEGER, x DOUBLE)

statement ok
INSERT INTO neg VALUES (0, NULL), (1, 0.0), (2, -0.0), (3, 1.0), (4, -1.0),
                       (5, 'nan'::DOUBLE), (6, '-nan'::DOUBLE), (7, 'inf'::DOUBLE), (8, '-inf'::DOUBLE)

foreach opt join_order expression_rewriter statistics_propagation

# join_order is the inert control here: it cannot affect a single-table projection, so that
# iteration is the all-relevant-optimizers-on baseline
statement ok
SET disabled_optimizers='{opt}'

# NaN negates to NaN, which stays the maximum, so > and >= are TRUE for it
query IIIIII
SELECT id,
       coalesce(((-x) >  0)::VARCHAR, 'NIL'),
       coalesce(((-x) >= 0)::VARCHAR, 'NIL'),
       coalesce(((-x) <  0)::VARCHAR, 'NIL'),
       coalesce(((-x) <= 0)::VARCHAR, 'NIL'),
       coalesce(((-x) =  0)::VARCHAR, 'NIL')
FROM neg ORDER BY id
----
0	NIL	NIL	NIL	NIL	NIL
1	false	true	false	true	true
2	false	true	false	true	true
3	false	false	true	true	false
4	true	true	false	false	false
5	true	true	false	false	false
6	true	true	false	false	false
7	false	false	true	true	false
8	true	true	false	false	false

# the filter form must agree with the projection form - this is where rows were being dropped
query IIII
SELECT (SELECT count(*) FROM neg WHERE (-x) > 0),
       (SELECT sum(CASE WHEN (-x) > 0 THEN 1 ELSE 0 END) FROM neg),
       (SELECT count(*) FROM neg WHERE (-x) >= 0),
       (SELECT sum(CASE WHEN (-x) >= 0 THEN 1 ELSE 0 END) FROM neg)
----
4	4	6	6

# a non-zero constant exercises the same rewrite with an actual negation of the constant
query II
SELECT (SELECT count(*) FROM neg WHERE (-x) > 1),
       (SELECT count(*) FROM neg WHERE (-x) < -1)
----
3	1

# FLOAT takes the same path as DOUBLE
query I
SELECT count(*) FROM (SELECT x::FLOAT AS f FROM neg) WHERE (-f) >= 0
----
6

statement ok
RESET disabled_optimizers

endloop

# --- 2. date_trunc simplification and NULL ------------------------------------------------------------

statement ok
CREATE TABLE dt(id INTEGER, d DATE)

statement ok
INSERT INTO dt VALUES (0, NULL), (1, DATE '2020-06-15'), (2, DATE '2020-06-01'), (3, DATE '2019-01-01')

foreach opt join_order expression_rewriter

statement ok
SET disabled_optimizers='{opt}'

# '2020-06-15' is not a month boundary, so date_trunc('month', d) can never equal it: the comparison
# is unsatisfiable, but a NULL input must still yield NULL rather than FALSE
query IIIII
SELECT id,
       coalesce((date_trunc('month', d) =  DATE '2020-06-15')::VARCHAR, 'NIL'),
       coalesce((date_trunc('month', d) <> DATE '2020-06-15')::VARCHAR, 'NIL'),
       coalesce((date_trunc('month', d) IS NOT DISTINCT FROM DATE '2020-06-15')::VARCHAR, 'NIL'),
       coalesce((date_trunc('month', d) IS DISTINCT FROM DATE '2020-06-15')::VARCHAR, 'NIL')
FROM dt ORDER BY id
----
0	NIL	NIL	false	true
1	false	true	false	true
2	false	true	false	true
3	false	true	false	true

# a constant that IS on the boundary keeps the normal range rewrite, NULL still propagates
query III
SELECT id,
       coalesce((date_trunc('month', d) =  DATE '2020-06-01')::VARCHAR, 'NIL'),
       coalesce((date_trunc('month', d) <> DATE '2020-06-01')::VARCHAR, 'NIL')
FROM dt ORDER BY id
----
0	NIL	NIL
1	true	false
2	true	false
3	false	true

# same for a timestamp column and a finer part
statement ok
CREATE OR REPLACE TABLE ts(id INTEGER, t TIMESTAMP)

statement ok
DELETE FROM ts

statement ok
INSERT INTO ts VALUES (0, NULL), (1, TIMESTAMP '2020-06-15 12:34:56'), (2, TIMESTAMP '2020-06-15 00:00:00')

query III
SELECT id,
       coalesce((date_trunc('day', t) =  TIMESTAMP '2020-06-15 12:00:00')::VARCHAR, 'NIL'),
       coalesce((date_trunc('day', t) <> TIMESTAMP '2020-06-15 12:00:00')::VARCHAR, 'NIL')
FROM ts ORDER BY id
----
0	NIL	NIL
1	false	true
2	false	true

statement ok
RESET disabled_optimizers

endloop
