# name: test/optimizer/regex_optimizer.test
# description: Test Like Optimization Rules
# group: [optimizer]

statement ok
CREATE TABLE test(s VARCHAR);

statement ok
PRAGMA explain_output = OPTIMIZED_ONLY;

statement ok
INSERT INTO test VALUES ('aaa');

# contains optimization: /aaa/ -> contains(aaa)
query I nosort regexconstantpattern
EXPLAIN SELECT regexp_matches(s, 'aa') FROM test
----

query I nosort regexconstantpattern
EXPLAIN SELECT contains(s, 'aa') FROM test
----


# contains optimization: /a/ -> contains(aaa)
query I nosort regexconstantsinglechar
EXPLAIN SELECT regexp_matches(s, 'a') FROM test
----

query I nosort regexconstantsinglechar
EXPLAIN SELECT contains(s, 'a') FROM test
----

query I nosort correct_result
SELECT regexp_matches(s, '[a]') FROM test
----

query I nosort correct_result
SELECT regexp_matches(s, 'a') FROM test
----

query I nosort correct_result
SELECT contains(s, 'aaa') FROM test
----


query I nosort correct_result
SELECT regexp_matches(s, '^a') FROM TEST;
----
aaa

query I nosort correct_result
SELECT regexp_matches(s, '^aa') FROM TEST;
----
aaa

statement ok
DELETE FROM test;

statement ok
INSERT INTO test VALUES ('aaa'), ('a.a'), ('baba'), ('abba'), ('a\.a');

query II
explain analyze select regexp_matches(s, 'a.a'), s from test;
----
analyzed_plan	<REGEX>:.*~~\(s, '%a_a%'\).*

query I nosort
select s from test where regexp_matches(s, 'a.a');
----
aaa
a.a
baba

query II
explain analyze SELECT regexp_matches(s, 'a.*a'), s FROM TEST;
----
analyzed_plan	<REGEX>:.*~~\(s, '%a%a%'\).*

query I nosort
SELECT s FROM TEST where regexp_matches(s, 'a.*a');
----
aaa
a.a
baba
abba
a\.a

query II
explain analyze SELECT regexp_matches(s, '^a.*b$'), s FROM TEST;
----
analyzed_plan	<REGEX>:.*~~\(s, 'a%b'\).*

query I
SELECT s FROM TEST where regexp_matches(s, '^a.*b$');
----


query II
explain analyze select regexp_matches(s, 'a\.a'), s from test;
----
analyzed_plan	<REGEX>:.*contains\(s, 'a.a'\).*

query I
select s from test where regexp_matches(s, 'a\.a');
----
a.a

query II
explain analyze SELECT regexp_matches(s, '^a'), s FROM TEST;
----
analyzed_plan	<REGEX>:.*prefix\(s, 'a'\).*

query I nosort
SELECT s FROM TEST where regexp_matches(s, '^a');
----
aaa
a.a
abba
a\.a

query II
explain analyze SELECT regexp_matches(s, 'a$'), s FROM TEST;
----
analyzed_plan	<REGEX>:.*suffix\(s, 'a'\).*

query I nosort
SELECT s FROM TEST where regexp_matches(s, 'a$');
----
aaa
a.a
baba
abba
a\.a

query II
explain analyze select regexp_matches(s, '.*green.*'), s, from test;
----
analyzed_plan	<REGEX>:.*contains\(s, 'green'\).*

query II
explain analyze select regexp_matches(s, '.*special.*requests.*'), s from test;
----
analyzed_plan	<REGEX>:.*~~\(s, '%special%requests%'\).*

statement ok
DELETE from test;
