# name: test/optimizer/regex_optimizer.test
# description: Test Like Optimization Rules
# group: [optimizer]

statement ok
CREATE TABLE test(s VARCHAR);

statement ok
PRAGMA explain_output = OPTIMIZED_ONLY;

statement ok
INSERT INTO test VALUES ('aaa');

# contains optimization: /aaa/ -> contains(aaa)
query I nosort regexconstantpattern
EXPLAIN SELECT regexp_matches(s, 'aa') FROM test
----

query I nosort regexconstantpattern
EXPLAIN SELECT contains(s, 'aa') FROM test
----


# contains optimization: /a/ -> contains(aaa)
query I nosort regexconstantsinglechar
EXPLAIN SELECT regexp_matches(s, 'a') FROM test
----

query I nosort regexconstantsinglechar
EXPLAIN SELECT contains(s, 'a') FROM test
----

query I nosort correct_result
SELECT regexp_matches(s, '[a]') FROM test
----

query I nosort correct_result
SELECT regexp_matches(s, 'a') FROM test
----

query I nosort correct_result
SELECT contains(s, 'aaa') FROM test
----


query I nosort correct_result
SELECT regexp_matches(s, '^a') FROM TEST;
----
aaa

query I nosort correct_result
SELECT regexp_matches(s, '^aa') FROM TEST;
----
aaa

statement ok
DELETE FROM test;

statement ok
INSERT INTO test VALUES ('aaa'), ('a.a'), ('baba'), ('abba'), ('a\.a');

query II
explain analyze select regexp_matches(s, 'a.a'), s from test;
----
analyzed_plan	<REGEX>:.*~~\(s, '%a_a%'\).*

query II
explain analyze SELECT regexp_matches(s, 'a.*a'), s FROM TEST;
----
analyzed_plan	<REGEX>:.*~~\(s, '%a%a%'\).*

query II
explain analyze SELECT regexp_matches(s, '^a.*b$'), s FROM TEST;
----
analyzed_plan	<REGEX>:.*~~\(s, 'a%b'\).*

query II
explain analyze select regexp_matches(s, 'a\.a'), s from test;
----
analyzed_plan	<REGEX>:.*contains\(s, 'a.a'\).*

query II
explain analyze SELECT regexp_matches(s, '^a'), s FROM TEST;
----
analyzed_plan	<REGEX>:.*prefix\(s, 'a'\).*

query II
explain analyze SELECT regexp_matches(s, 'a$'), s FROM TEST;
----
analyzed_plan	<REGEX>:.*suffix\(s, 'a'\).*

query II
explain analyze select regexp_matches(s, '.*green.*'), s, from test;
----
analyzed_plan	<REGEX>:.*contains\(s, 'green'\).*

query II
explain analyze select regexp_matches(s, '.*special.*requests.*'), s from test;
----
analyzed_plan	<REGEX>:.*~~\(s, '%special%requests%'\).*


# write more tests regarding new line characters. "." in regexp should only match characters that aren't new lines
# and yet, I can't seem to trigger that case. 