# name: test/optimizer/row_number_virtual_column.test
# description: Test row_number virtual column
# group: [optimizer]

statement ok
SET profiling_renderer_settings = MAP {'operator_casing': 'upper'};

statement ok
CREATE OR REPLACE TABLE foo AS SELECT range a FROM range(130000);

# Check that row_number is not accessible
statement error
SELECT a, row_number FROM foo;
----
Binder Error: Referenced column "row_number" not found in FROM clause

query I
SELECT a as row_number FROM foo limit 3;
----
0
1
2

query I
select row_number() over() from foo where a < 3;
----
1
2
3

statement ok
delete from foo where a < 5000;

query III
select row_number() over(), a, rowid from foo order by a desc limit 1;
----
125000	129999	129999

query III
select a, rowid, row_number() over() from foo order by a desc limit 1;
----
129999	129999	125000

query II
explain select a,rowid, row_number() over() as x from foo order by a desc limit 1;
----
physical_plan	<!REGEX>:.*WINDOW.*

statement ok
select setseed(0.1);

statement ok
create or replace table test as select (random()*10)::INT a, (random()*5)::INT b  from range(10);

statement ok
create or replace table test2 as select (random()*100)::INT c, (random()*5)::INT b  from range(10);

# Try with a window function and a Join

query II
explain SELECT t.row_num, t.a, t2.c FROM ( SELECT a, b, ROW_NUMBER() OVER () AS row_num FROM test) t JOIN test2 t2 ON t.b = t2.b limit 10;
----
physical_plan	<!REGEX>:.*WINDOW.*


statement ok
create table t1 as select range::FLOAT a, range b, range c, range d from range (3);

query I
SELECT CASE WHEN row_number() OVER () = 2 THEN 2222::BIGINT ELSE 1111::BIGINT END FROM t1;
----
1111
2222
1111

statement ok
CREATE OR REPLACE TABLE numbers AS SELECT range(1, 5) AS num;

query II
SELECT row_number() OVER(), unnest(num) FROM numbers;
----
1	1
1	2
1	3
1	4

query II
SELECT row_number() OVER (), nums FROM (SELECT unnest(num) AS nums from numbers);
----
1	1
2	2
3	3
4	4

# Try with a join on the row_number

statement ok
CREATE OR REPLACE TABLE foo AS SELECT range a from range(3);

statement ok
CREATE OR REPLACE TABLE bar AS SELECT range b from range(2,5);

query II
EXPLAIN SELECT f.row_num AS foo_row, b.row_num AS bar_row, f.a, b.b FROM (SELECT row_number() OVER () AS row_num, a FROM foo) f
JOIN (SELECT row_number() OVER () AS row_num, b FROM bar) b ON f.row_num = b.row_num;
----
physical_plan	<!REGEX>:.*WINDOW.*

# -------------------------------------------------------------------
# Multi-column tables with various types
# -------------------------------------------------------------------

statement ok
CREATE OR REPLACE TABLE multi_types (col1 INT, col2 DATE, col3 VARCHAR);

statement ok
INSERT INTO multi_types VALUES (1, '2024-01-01', 'hello'), (2, '2024-06-15', 'world'), (3, '2024-12-31', 'foo');

query II
SELECT col3, row_number() OVER () FROM multi_types ORDER BY col1;
----
hello	1
world	2
foo	3

query III
SELECT col1, col2, row_number() OVER () FROM multi_types ORDER BY col1;
----
1	2024-01-01	1
2	2024-06-15	2
3	2024-12-31	3

query IIII
SELECT row_number() OVER (), col1, col2, col3 FROM multi_types ORDER BY col1;
----
1	1	2024-01-01	hello
2	2	2024-06-15	world
3	3	2024-12-31	foo

query II
SELECT col2, row_number() OVER () FROM multi_types WHERE col1 > 1 ORDER BY col1;
----
2024-06-15	1
2024-12-31	2

# select only non-rowid columns alongside row_number in a subquery
query III
SELECT rn, col3, col2 FROM (SELECT row_number() OVER () AS rn, col2, col3 FROM multi_types) sub ORDER BY rn;
----
1	hello	2024-01-01
2	world	2024-06-15
3	foo	2024-12-31

# row_number with expressions on other columns
query II
SELECT col1 * 10, row_number() OVER () FROM multi_types ORDER BY col1;
----
10	1
20	2
30	3

# verify the optimization still kicks in with mixed column types
query II
EXPLAIN SELECT col3, row_number() OVER () FROM multi_types;
----
physical_plan	<!REGEX>:.*WINDOW.*

# -------------------------------------------------------------------
# row_number should not be rewritten when there are pushed-down filters
# -------------------------------------------------------------------

statement ok
CREATE OR REPLACE TABLE filter_test (col1 INT, col2 VARCHAR);

statement ok
INSERT INTO filter_test VALUES (1, 'alpha'), (2, 'beta'), (3, 'gamma'), (4, 'delta'), (5, 'epsilon');

# with a WHERE filter the optimization should NOT kick in
query II
EXPLAIN SELECT col2, row_number() OVER () FROM filter_test WHERE col1 > 2;
----
physical_plan	<REGEX>:.*WINDOW.*

query II
SELECT col2, row_number() OVER () FROM filter_test WHERE col1 > 2 ORDER BY col1;
----
gamma	1
delta	2
epsilon	3

# same with transaction-local data and a filter
statement ok
BEGIN;

statement ok
INSERT INTO filter_test VALUES (6, 'zeta');

query II
SELECT col2, row_number() OVER () FROM filter_test WHERE col1 > 3 ORDER BY col1;
----
delta	1
epsilon	2
zeta	3

statement ok
COMMIT;

statement ok
pragma disable_optimizer;

statement ok
create table tbl as select range a from range(3);

statement ok
pragma enable_optimizer;

query II
EXPLAIN SELECT row_number + 1 FROM (SELECT row_number() OVER () AS row_number FROM tbl);
----
physical_plan	<!REGEX>:.*WINDOW.*

# read_duckdb also exposes a row_number virtual column, but with file-local
# semantics rather than SQL window semantics, so the rewrite must not fire for
# it: ROW_NUMBER() OVER () must still be computed and return 1-based values, not
# the scan's 0-based file-local row number. See issue #23586.
statement ok
ATTACH '{TEST_DIR}/row_number_read_duckdb.db' AS rd

statement ok
CREATE TABLE rd.t AS SELECT * FROM (VALUES (10), (20)) v(x)

statement ok
DETACH rd

query II
SELECT x, ROW_NUMBER() OVER () AS rn FROM read_duckdb('{TEST_DIR}/row_number_read_duckdb.db', table_name='t') ORDER BY x
----
10	1
20	2

# the window must be kept (not eliminated) for a table function scan
query II
EXPLAIN SELECT x, ROW_NUMBER() OVER () FROM read_duckdb('{TEST_DIR}/row_number_read_duckdb.db', table_name='t')
----
physical_plan	<REGEX>:.*WINDOW.*

# Issue #25553: vector-sized assignments must reserve only their visible rows.
foreach parallelism verify_parallelism disable_verify_parallelism

statement ok
PRAGMA {parallelism};

foreach threads 1 4

statement ok
SET threads = {threads};

foreach row_count 2047 2048 2049 2050 130000

statement ok
CREATE OR REPLACE TABLE rn_batches AS SELECT range AS i FROM range({row_count});

query I
SELECT count(*) = {row_count} AND min(rn) = 1 AND max(rn) = {row_count} AND count(DISTINCT rn) = {row_count}
FROM (SELECT row_number() OVER () AS rn FROM rn_batches);
----
true

# Keep the scan optimization enabled: correctness must not come from a fallback.
query II
EXPLAIN SELECT row_number() OVER () FROM rn_batches;
----
physical_plan	<!REGEX>:.*WINDOW.*

statement ok
DELETE FROM rn_batches WHERE i < 5;

query I
SELECT count(*) = {row_count} - 5 AND min(rn) = 1 AND max(rn) = {row_count} - 5 AND count(DISTINCT rn) = {row_count} - 5
FROM (SELECT row_number() OVER () AS rn FROM rn_batches);
----
true

# The final base of the table scan is also the initial base for local rows.
statement ok
BEGIN;

statement ok
INSERT INTO rn_batches VALUES (-1), (-2);

query I
SELECT count(*) = {row_count} - 3 AND min(rn) = 1 AND max(rn) = {row_count} - 3 AND count(DISTINCT rn) = {row_count} - 3
FROM (SELECT row_number() OVER () AS rn FROM rn_batches);
----
true

statement ok
ROLLBACK;

# Entirely invisible assignments must not consume any row numbers.
statement ok
DELETE FROM rn_batches WHERE i < 2048;

query I
SELECT count(*) = greatest({row_count} - 2048, 0)
       AND coalesce(min(rn), 1) = 1
       AND coalesce(max(rn), 0) = greatest({row_count} - 2048, 0)
       AND count(DISTINCT rn) = greatest({row_count} - 2048, 0)
FROM (SELECT row_number() OVER () AS rn FROM rn_batches);
----
true

endloop

# Local storage can itself span multiple scan assignments, with no visible base rows.
statement ok
CREATE OR REPLACE TABLE rn_local(i BIGINT);

statement ok
BEGIN;

statement ok
INSERT INTO rn_local SELECT range FROM range(2050);

statement ok
DELETE FROM rn_local WHERE i < 5;

query IIII
SELECT count(*), min(rn), max(rn), count(DISTINCT rn)
FROM (SELECT row_number() OVER () AS rn FROM rn_local);
----
2045	1	2045	2045

statement ok
ROLLBACK;

endloop

endloop

# A reader's snapshot keeps rows deleted by a later committed transaction visible.
statement ok con1
PRAGMA verify_parallelism;

statement ok con1
CREATE TABLE rn_snapshot AS SELECT range AS i FROM range(2050);

statement ok con1
BEGIN;

query I con1
SELECT count(*) FROM rn_snapshot;
----
2050

statement ok con2
DELETE FROM rn_snapshot WHERE i < 2048;

query IIII con1
SELECT count(*), min(rn), max(rn), count(DISTINCT rn)
FROM (SELECT row_number() OVER () AS rn FROM rn_snapshot);
----
2050	1	2050	2050

# Later inserts must also remain invisible to the existing snapshot.
statement ok con2
INSERT INTO rn_snapshot SELECT range FROM range(2050, 4100);

query IIII con1
SELECT count(*), min(rn), max(rn), count(DISTINCT rn)
FROM (SELECT row_number() OVER () AS rn FROM rn_snapshot);
----
2050	1	2050	2050

statement ok con1
COMMIT;

query IIII con1
SELECT count(*), min(rn), max(rn), count(DISTINCT rn)
FROM (SELECT row_number() OVER () AS rn FROM rn_snapshot);
----
2052	1	2052	2052

statement ok
PRAGMA disable_verify_parallelism;

statement ok
RESET threads;
