i_item_id|i_item_desc|i_category|i_class|i_current_price|itemrevenue|revenueratio
AAAAAAAAHLGEAAAA|Hands complete very by a schools. Growing, public animals would support british exhibitions. Armed areas select brilliant streets. Broad, basic hours|Books|NULL|NULL|11467.59|20.814430935111034
AAAAAAAAOJGAAAAA|NULL|Books|NULL|NULL|17129.92|31.09193272204336
AAAAAAAAAAKAAAAA|Small, political activities help great, bad policies. Therefore square features provide on a machines. Rules make over me|Books|arts|2.42|7916.05|1.3171180640470073
AAAAAAAAACIEAAAA|Im|Books|arts|4.02|8993.44|1.496380427349867
AAAAAAAAACKBAAAA|Clinical, inc initiatives make specially according to a activities.|Books|arts|6.92|464.66|0.07731281126825656
AAAAAAAAACMIAAAA|Aggressive, possible men will consist absolutely also magnetic transactions. Only old decisions release members; experiences could|Books|arts|3.36|1092.28|0.18173984739829396
AAAAAAAAAHAGAAAA|Emotional, good options exploit about christian eyes. Forth small branches s|Books|arts|5.40|851.90|0.1417440363264059
AAAAAAAAAINHAAAA|Inches would force once crops. Courts will keep in a lands. Groups lead most long, fresh pupils. Marine patients used to give breasts. Little existing exercises shall look now legal institutions. Ma|Books|arts|0.95|443.50|0.07379208840328796
AAAAAAAAAJIAAAAA|Joint, superior police would use through an restrictions. Buyers ought to contract generally in a efforts. Days cut also sure, frequent s|Books|arts|0.43|10814.92|1.7994487772592718
AAAAAAAAANCIAAAA|Previous change|Books|arts|4.95|6997.32|1.164254466800665
AAAAAAAAANOEAAAA|Chief cattle develop less within the nations; situations show in the pairs. Public, relevant risks try. Liberal, direct races could pay professional services. Methods could not |Books|arts|5.35|2677.85|0.4455561306217467
AAAAAAAAAPDFAAAA|Bags help now political o|Books|arts|2.02|3537.78|0.5886362446705391
AAAAAAAABFHDAAAA|Little days answer in a emotions; players touch.|Books|arts|2.58|10431.81|1.7357047254257123
AAAAAAAABHDCAAAA|Minor heads close common children; recently strong firms provide. Useful, young men ought to create changes. Popular, common regulations might decide. Points fit. Obvious, glad officials |Books|arts|3.88|6603.27|1.0986901546579015
AAAAAAAABKDIAAAA|French books undergo so technical figures; beings test then friends. Top, constant proceedings will not face too. Weakly public cuts change organic, resp|Books|arts|2.01|3559.20|0.5922002278353609
AAAAAAAABOFFAAAA|Local, religious hours turn always other prices. Tonight subject stars bring firmly members; high, full-time officials find over positions. Benefits may not relax far so various bonds. Direct feat|Books|arts|9.66|1777.19|0.2956991242151958
AAAAAAAABPNFAAAA|Too certain firms could watch just relative examples. Again likely services beat on a lessons. Sure, small laws could spend as quite only countries. Clear hills may not interpret open netw|Books|arts|5.69|NULL|NULL
AAAAAAAACBACAAAA|Remaining, main passengers go far sure men. |Books|arts|4.78|16136.98|2.6849638212448474
AAAAAAAACCLCAAAA|Multiple, personal attitudes change so. Major, international companies can give scales. Strong women may take there expensive scores|Books|arts|45.80|4146.98|0.6899984549417523
AAAAAAAACDAFAAAA|Local, foreign lips take highly more wonderful schools. Artistic, dry goods used to lose only in a designs. Now differen|Books|arts|3.87|6.90|0.001148061803794108
AAAAAAAACDLEAAAA|Basically difficult governments make commercially weekly, cold rates. Sad standards will close once still pretty parents. Hopes must come of course. Policemen improve together. Geographically sure |Books|arts|8.87|7656.70|1.2739659149435287
AAAAAAAACIEGAAAA|Necessary developers will not build most in a days. Perhaps young weeks provide with a faces. Bizarre areas must not work incomes; deaf, re|Books|arts|3.85|1649.58|0.2744666362757514
AAAAAAAACIMEAAAA|Pages may take less about a causes. Feelings used to win reason|Books|arts|3.84|3031.26|0.5043585251259316
AAAAAAAACJHHAAAA|Pretty inc companies would take actually sorts. Only medic|Books|arts|5.03|9833.01|1.6360729271486236
AAAAAAAACKEAAAAA|Legs appear eventually soci|Books|arts|35.27|198.99|0.03310910410681008
AAAAAAAACKGHAAAA|Burning children suffer backwards equations. As basic districts hope well separately relevant days. Ready organisms like |Books|arts|2.39|1070.08|0.17804608333391292
AAAAAAAACLPHAAAA|Social grounds must tell thus expo|Books|arts|3.60|13207.26|2.197500107069242
AAAAAAAACMDCAAAA|Black, powerful others go now years. Diverse orders might not mean away medium minutes; tight authorities ought to put however for the things|Books|arts|2.75|12421.43|2.0667491784785867
AAAAAAAACMHIAAAA|Wild, certain rounds want here parliamentary courts. British, white reasons sit all but churches. Stro|Books|arts|6.35|6336.21|1.0542551712780095
AAAAAAAACNEDAAAA|Particularly labour stores get farmers. Hence true records see rel|Books|arts|6.89|21697.95|3.610230089222372
AAAAAAAADCCDAAAA|Glad users understand very almost original jobs. Towns can understand. Supreme, following days work by a parents; german, crucial weapons work sure; fair pictur|Books|arts|7.18|4018.77|0.6686661355411084
AAAAAAAADJFCAAAA|Significant, preliminary boys can remain lightly more pale discussion|Books|arts|2.74|7236.45|1.2040422956617207
AAAAAAAADPCCAAAA|Especially true items might supply particularly. Black, automatic words might develop post-war problems. Fresh, visible workers could not appe|Books|arts|4.23|3733.18|0.621148023867839
AAAAAAAAEBPGAAAA|Very real boards may take in order. Pages used to escape a bit to a efforts. So fat members operate reasonably officers. Secondly italian areas may not understand too |Books|arts|3.10|9718.99|1.6171016218053476
AAAAAAAAEDCFAAAA|Certain, upper minutes must provide only public troubles. Rules will worry especially american things. Days will make as in order mature costs. European investments give just relatives. British, ne|Books|arts|5.89|4638.33|0.7717521023756994
AAAAAAAAEDKDAAAA|Times live now to a sales. British years bring all financ|Books|arts|4.24|1049.59|0.17463683893395043
AAAAAAAAEECGAAAA|National, recent flats see seldom. At last vast considerations can think most. Romantic products develop fully long moves. Labour styles offer nece|Books|arts|3.41|16437.56|2.7349760555904172
AAAAAAAAEGIHAAAA|Chief police shall trap then now certain men. Nice magazines try very single police; later public tests can think urban conservatives. Members know however general places.|Books|arts|1.17|1214.06|0.20200230630641666
AAAAAAAAEHLEAAAA|Big, good girls look yesterday. Powerful, extensive schools help instead in order |Books|arts|3.27|1085.01|0.18053022286009351
AAAAAAAAEMLHAAAA|Industrial, european police would not make musical results. Numbers nod inevitable lists; problems want. Over blue losses manage contents. Streets develop always rates. Whole artis|Books|arts|0.41|4646.83|0.7731663814093588
AAAAAAAAEPDDAAAA|Services used to work most new provi|Books|arts|2.84|6668.90|1.1096100526554387
AAAAAAAAEPKAAAAA|Here political studies give once at the qu|Books|arts|1.78|1017.27|0.16925925089067134
AAAAAAAAFBMBAAAA|Years light glasses. Contemporary members might detect even drawings. Private instructions ought to expect well main streets. Children will say well; usually young members ought to ensure enough. |Books|arts|4.78|95.18|0.01583659746161206
AAAAAAAAFCFBAAAA|Golden estates meet as yet hands. About solid proteins used to tell. Once causal boots imagine frequently new elections; flexible, other ways find re|Books|arts|9.76|749.76|0.12474939391487978
AAAAAAAAFCKCAAAA|Brilliant, acceptable resources might not pick as. Positive, married parties support only strongly impossible needs. Photogra|Books|arts|2.44|1206.99|0.20082595892194935
AAAAAAAAFFEIAAAA|Local times understand. Often clear mice|Books|arts|2.57|9529.66|1.5855998042238493
AAAAAAAAFMIGAAAA|Intimately alive police would not relieve ther|Books|arts|26.86|3913.48|0.6511473779582849
AAAAAAAAFNKGAAAA|Fundamental, red drivers show in public in a houses. Political houses mean no longer long cities. |Books|arts|3.12|15185.58|2.526664400936193
AAAAAAAAGAGFAAAA|Political messages give. Ordinary children absorb fully available, rare days|Books|arts|8.04|19613.36|3.2633839797193054
AAAAAAAAGAKHAAAA|Facilities shall cover. Available things would not taste alone mediterranean companies; total, dull officials feel so current women; crucial losses might not listen enough blind, commercial rises.|Books|arts|8.61|7328.43|1.2193464586636023
AAAAAAAAGFHBAAAA|Contemporary occasions provide she|Books|arts|1.75|10826.58|1.8013888353219152
AAAAAAAAGFIHAAAA|Unit|Books|arts|5.82|1557.74|0.2591857672814832
AAAAAAAAGGLFAAAA|Items need otherwise; arms secure slightly. Cool, small sources used to try eagerly letters; clear guns must contact also in the muscles. Figures used to rise already in a changes. Unaccepta|Books|arts|0.37|159.36|0.02651523609458392
AAAAAAAAGHOBAAAA|Fully existing proceedings could not tak|Books|arts|8.66|7489.25|1.2461046179804383
AAAAAAAAGKLEAAAA|Common, contemporary pati|Books|arts|3.07|6907.13|1.1492481343246954
AAAAAAAAGOKBAAAA|Othe|Books|arts|60.94|3363.68|0.5596684823458211
AAAAAAAAGPOFAAAA|Local children could not pause services. Strong, imaginative points accept hard international expenses; too ce|Books|arts|3.94|11888.12|1.9780139841914222
AAAAAAAAHBAFAAAA|Patients might accept satisfactory studies. Expected, foreign conditions should touch. Things get then friends. True years could put to a duties. Relations can pay el|Books|arts|46.43|5950.25|0.9900369200037524
AAAAAAAAHHCGAAAA|Minutes mig|Books|arts|1.43|7267.00|1.2091253808944613
AAAAAAAAHPNCAAAA|Correct, certain humans cut|Books|arts|37.98|7891.25|1.312991696984095
AAAAAAAAIAKIAAAA|Facilities hire tonight at|Books|arts|4.01|3139.39|0.522349818291766
AAAAAAAAIAOAAAAA|Professional circumstances could live else others. Symptoms can see very leaves. Just personal institutions used to go. Capable workers used to play then able police.|Books|arts|2.40|6925.26|1.1522647083106066
AAAAAAAAIBGHAAAA|In order exclusive historians cannot give sometimes available women. Years could reject merely main weeks. Certainly male rates contribute on a executives; thanks used to |Books|arts|1.92|946.56|0.15749411318831175
AAAAAAAAICHGAAAA|Perception|Books|arts|9.09|4770.60|0.7937599479971263
AAAAAAAAIEPCAAAA|New, popular years should think. Shareholders speak also friends; special members could not identify social eyes; indoors full |Books|arts|0.91|4624.26|0.7694110546105714
AAAAAAAAIHKBAAAA|Very historic arms may happen even able exis|Books|arts|9.19|4612.30|0.7674210808173282
AAAAAAAAIIAGAAAA|Well organisational elections improve national, available courts. Sad results think necessarily from the functions. Tickets might not paint also commercial|Books|arts|69.87|3423.46|0.5696150235966634
AAAAAAAAIIPDAAAA|Af|Books|arts|6.04|4183.45|0.6960665439249945
AAAAAAAAIJGAAAAA|Then western animals could teach somewhere. Today waiting servants confuse|Books|arts|4.10|1571.98|0.2615551006272844
AAAAAAAAIKMHAAAA|Sure, previous complaints restrain likely british forces. Wide, complete mother|Books|arts|35.47|0.00|0.0
AAAAAAAAJCJFAAAA|Probably similar words should annoy ancient roots. Other, environmental ways will discover eyes. Painful, public programmes might get generally constantly prime word|Books|arts|1.79|10514.82|1.7495164080826615
AAAAAAAAJJDBAAAA|Problems compete with a sets. Interesting, automatic pounds tell complete hills. |Books|arts|1.20|954.08|0.15874533416867864
AAAAAAAAKACFAAAA|Special birds cannot look bare|Books|arts|4.93|7026.78|1.16915619154556
AAAAAAAAKAEIAAAA|Doubts come best markets; white, good costs cannot sail nearly kind of crucial eyes; particular, obvious pupils help high examples. Able, indian maps become evidently e|Books|arts|50.78|2387.27|0.39720775396283486
AAAAAAAAKAFHAAAA|Red economies used to conform more religious careers; perfect, left sections must apply virtually british adults. Ever bad w|Books|arts|86.29|6804.54|1.1321786183172695
AAAAAAAAKAHFAAAA|Less large actions will not visit very. English, other terms ought to use then strikingly enormous remains. Intensive, po|Books|arts|4.03|22586.17|3.7580172566667205
AAAAAAAAKALIAAAA|Today contemporary leaders shall build despite the fields; different|Books|arts|4.96|3152.76|0.5245743960188278
AAAAAAAAKDCIAAAA|Secondary versions delight|Books|arts|2.72|4497.04|0.7482434571209067
AAAAAAAAKGBAAAAA|Light moments cannot date following sy|Books|arts|5.60|12051.58|2.0052114019375358
AAAAAAAAKICDAAAA|Wet, concerned representatives get up to a owners. Necessary, like|Books|arts|1.89|7091.96|1.1800012159471975
AAAAAAAAKKIAAAAA|Naked, popular schemes campaign then offices. Underlying shares may join|Books|arts|79.28|9362.08|1.5577168771108325
AAAAAAAALIOHAAAA|Kinds ought to encourage representatives. Less local months come sure|Books|arts|2.52|1090.00|0.1813604878457359
AAAAAAAAMFFAAAAA|Communities used to relocate clearly strange, new walls; european, rich championships make current depths. Sure studies may reflect only instinctively old forces. Foreign, diverse|Books|arts|8.22|3040.41|0.5058809549092238
AAAAAAAAMFKIAAAA|Similar nations take much home helpful inches. Clear, early voices can incorporate so as home trying compan|Books|arts|5.44|10318.55|1.7168598732666223
AAAAAAAAMGPFAAAA|Forces could see often catholic ends. Valid children will see charges; hot, present men say with a players. Priorities affect assets; positive, safe minutes should lend very |Books|arts|12.07|2313.63|0.3849551059582844
AAAAAAAAMHCFAAAA|Large, british prices could work daily extended, empty products. Managers used to applaud; comfortable months should tell precious |Books|arts|8.23|244.56|0.04069130358491117
AAAAAAAAMLKEAAAA|Easily able parts keep else very similar floors. Symbolic, proud boats used to go yet appropriate, co|Books|arts|9.35|214.36|0.035666453371203624
AAAAAAAAMNDGAAAA|Fast, relative steps could n|Books|arts|87.18|936.96|0.15589680980911994
AAAAAAAANDEIAAAA|Immediate characteristics should allow away. Necessarily different words build so solicitors. Professional, sufficient sets consider usually urban features. Comfortable, public p|Books|arts|81.24|392.17|0.0652515068976718
AAAAAAAANEDFAAAA|Short, good factors look working, flexible governments. Fig|Books|arts|4.33|21834.42|3.632936755072196
AAAAAAAANFIIAAAA|European, necessary types ought to add pointedly con|Books|arts|2.49|227.04|0.03777622491788613
AAAAAAAANHHEAAAA|Banks would not read abroad museums. Here old childr|Books|arts|4.04|4581.92|0.7623662811652608
AAAAAAAANIBAAAAA|Beneath decent wives write t|Books|arts|2.72|11.00|0.0018302434553239405
AAAAAAAANOGHAAAA|Quite unusual governments reappear minor, physical prices. Sad doctors feel high parameters. Stiffly special cases co|Books|arts|35.55|4029.81|0.670503034427179
AAAAAAAANPKFAAAA|Young, initial pounds may prevent large, bad relations. At once absolute industries might escape. Perhaps open roots cannot give so exten|Books|arts|2.59|28102.35|4.675831106065703
AAAAAAAAOAOGAAAA|Clear, previous voices shall set with a losses. Patients ought to see men. Essential, like instruments would read more. Politi|Books|arts|3.77|10982.96|1.827408241825875
AAAAAAAAOBGFAAAA|Users will not see very following options. As pregnant provisions could not review lengthy, detailed towns. Badly semantic expenses should not g|Books|arts|4.58|232.48|0.038681363499428155
AAAAAAAAOBIIAAAA|Never back funds would not address that. High, essential police get programmes. Too hi|Books|arts|6.49|7723.23|1.2850355601328651
AAAAAAAAODFHAAAA|Canadian, gradual experts shall catch so politi|Books|arts|2.59|783.11|0.13029835929988465
AAAAAAAAOEDIAAAA|Large, yo|Books|arts|4.48|4158.08|0.6918453369739428
