s_store_name|i_item_desc|revenue|i_current_price|i_wholesale_cost|i_brand
able|NULL|10.81|NULL|NULL|"amalgmaxi #6"
able|NULL|13.38|1.74|NULL|"edu packimporto #1"
able|NULL|12.26|0.36|NULL|NULL
able|NULL|2.22|NULL|1.51|"brandnameless #9"
able|A|2.74|9.75|7.11|"exporticorp #3"
able|A|13.15|9.75|7.11|"exporticorp #3"
able|Able bound|5.24|6.13|2.26|"exportiunivamalg #9"
able|Able, actual men contribute beautiful, national orders. Days get just subsequently useful differences. Generally useful doctors look nations. Heavy minutes celebrate as good te|6.19|9.69|4.16|"edu packbrand #9"
able|Able, large months share also. Economic mount|14.00|0.66|0.25|"exportischolar #1"
able|Able, sharp offices put similarly also curious connections; so broken decades divert frequently rights. Candidates should want both previous cells. Eyes think european hands. Northern depths|18.66|3.54|1.94|"amalgamalgamalg #6"
able|About existing results ensure as foreign so|6.27|15.86|8.08|"amalgnameless #6"
able|About private months would|9.07|4.12|2.71|"scholarbrand #3"
able|About whole elements should not make only alive real results. Wise, right cards might collect so cou|6.13|4.15|1.57|"scholarmaxi #3"
able|Above social cars will not try actual, good babies. Daily, environmental lawyers create about however light cards. High, dead governments say completely central police. |9.70|2.10|1.47|"exportimaxi #8"
able|Abroad sorry ways must make home satisfied, fat effec|16.27|2.87|2.09|"edu packedu pack #2"
able|Absolute proteins will happen huge, important unions. Varieties might not climb old, dead memories. Social, efficient governments form especially. Deputies may encourage for ever years. |13.10|0.79|0.38|"edu packmaxi #2"
able|Absolutely elegant women must gain well complete |8.30|60.16|29.47|"corpunivamalg #5"
able|Absolutely favorite ages would persuade months. Scottish sales keep across new police. Serious, menta|15.61|3.54|2.83|"corpamalgamalg #16"
able|Accounts move operations; new scores must teach on a views. Men must not prove in order right, perso|16.41|1.12|0.39|"maxinameless #9"
able|Actions might want yet natural miles. True, charming equations join much. Rivers would not care in a mod|6.98|4.84|2.51|"amalgunivamalg #5"
able|Acts receive confidential, separate p|13.06|2.02|1.57|"brandnameless #10"
able|Actual, japanese successes ought to put. Studies shall make out of a observers. Public, dangerous ideas must stop blue, soft men. Shy, relevant pounds feel surprisingly old criteria; interested yea|17.49|2.89|2.51|"amalgmaxi #5"
able|Additional, related fruits want previous, protective details. Sexu|6.19|0.09|0.06|"exporticorp #7"
able|Adequate, big holes must result fair origin|10.61|1.56|1.02|"amalgscholar #1"
able|Afraid sessions must accept so at the ways. Russian w|11.49|41.72|21.27|"importounivamalg #3"
able|Again conventional years see. Eventually appointed affairs applaud true big findings; nights shall not come more than small samples. Remains feel only academic, sufficient w|10.12|6.10|5.06|"amalgscholar #2"
able|Again human powers should|8.11|0.69|0.54|"corpbrand #4"
able|Again labour requirements cannot take merely at the ends. So financial colleagues may appear rural ex|8.86|6.21|3.66|"amalgcorp #3"
able|Again small deaths could flou|18.31|6.40|3.64|"exportischolar #1"
able|Again sure relations will not amuse criminal, annual thousands. European, sorry minis|6.55|2.45|1.69|"amalgedu pack #1"
able|Agents show days. Economic councillors can get merely large con|2.26|14.21|4.97|"importoimporto #1"
able|Ages see both to an supporters. Creative sides will not make always. Groups grow therefore expensive talks. Apparent citizens survive across new, single minutes; previous, dark rivers qualify.|2.67|7.04|5.98|"corpmaxi #2"
able|Ago difficult processes can show increasingly things. Subsequent opportunities exist largely favorable journalists. Also other creatures work long little po|11.18|4.79|3.83|"amalgimporto #1"
able|Alive sources should drive upstairs interests. Elections shall meet severe, controversial lines. Central, full provisions determine as large officials; neatly select sources come; pregnant, wooden |16.69|8.62|3.79|"amalgscholar #2"
able|Alive stores judge huge, white connections. Just young agreements could not break accordingly on a assets.|0.73|3.03|2.21|"corpunivamalg #8"
able|All bad figures get brown games. Circumstances cannot understand just. Bio|2.86|1.30|0.83|"exportiimporto #2"
able|All minute markets provide extremely then different obligations. Necessary fears would not control in the solutions. Young ingredients shall fly in a terms. Accounts will not sum relevant boat|14.88|32.34|27.48|"importoedu pack #1"
able|Almost british differences can ease practical edges. Guns can make both goods. Head, young drawings may pay to the representatives. Immediately top documents want deep cities; anima|19.88|5.15|2.78|"namelessunivamalg #13"
able|Almost separate f|10.02|0.36|0.29|"scholaramalgamalg #16"
able|Alone exotic prospects may see great, private schools. Considerably genuine ins|18.33|8.27|5.21|"importonameless #7"
able|Alone, legal workers shall not raise perhaps. Slow, compre|1.32|4.01|2.56|"exportimaxi #4"
able|Already certain territories appear even for a failures. Soft, western women see yet by a homes; issues would set on a progra|3.40|3.58|1.32|"amalgcorp #6"
able|Already corporate tests will give trees. Relationships understand peacefully at the plans. Schools could afford away on a languages. Able, pure years may defend over a hands. More valid|10.76|18.30|10.06|"edu packscholar #1"
able|Already educational steps might find. Abroad good roles learn separately minute, regular experts. Chemical futures can gr|14.12|0.42|0.31|"exportiamalg #1"
able|Already necessary buildings will not |7.22|0.90|0.34|"exportibrand #7"
able|Already other authorities may keep partners. Cells submit en|17.71|8.13|6.91|"importoimporto #2"
able|Already regular forms must not keep later complete difficult respects; huge|5.86|4.67|2.94|"amalgscholar #2"
able|Also aware paintings will happen advisory, ugly cities. Meetings should not pray just in a police. Managers |19.54|3.04|1.76|"exportibrand #2"
able|Also constant men would not go already often only rivers. Local powers would com|19.30|0.22|0.17|"importoamalgamalg #16"
able|Also firm practices lead positively with a savings. Tropical foods might not assess obviously also fellow outcomes. Gastric men blame s|19.81|4.37|3.05|"namelesscorp #1"
able|Also individual arguments appear sufficiently levels; appropriate, economic churches know as insects. Settings take at least directly urgent conditions; then initial flowers must catc|3.67|4.61|3.22|"importoscholar #1"
able|Also informal photographs will not need much. Everyday, economic efforts will not provide also through a deaths; final items shall no|4.59|2.11|1.58|"edu packamalg #2"
able|Also lovely instruments say enough. Effects ought to find illegal, able arms. Children remember here. Very small patterns used to stay anxious changes.|12.50|9.55|7.06|"edu packscholar #1"
able|Also massive leaders take f|2.61|3.98|2.74|"importoedu pack #1"
able|Also medical women monitor. Much different books swim else other things; judges would distract more contracts.|18.86|5.77|4.03|"edu packamalgamalg #1"
able|Also neutral levels get for long across a forces. Mountains emigrate further great police. Now decisive experiments us|8.72|4.35|1.39|"corpmaxi #3"
able|Also political flowers confirm now then close companies. Just past arguments should produce additional, outer ingredients. Tories should see. Goods |9.84|8.28|6.95|"edu packscholar #1"
able|Also public names should choose spanish, local things; slow aims use elderly bills. Workers might choose home local windows. Weekly, relative|18.68|2.52|1.99|"exportiimporto #1"
able|Also various outcomes promote students. White moments wish incomes. Entire arms us|14.04|5.83|4.13|"amalgbrand #1"
able|Alternative, deaf acres know. Past, capitalist directors m|10.03|0.86|0.27|"importoimporto #1"
able|Always long members increase impossible organisati|18.55|4.78|4.06|"importoexporti #1"
able|And so on main images run early even small differences. Appropriate profits shall happen available courts. Joint, regular attitudes look. Simpl|11.26|3.91|2.38|"amalgedu pack #1"
able|Annual, financial ye|18.42|4.82|2.07|"importobrand #5"
able|Annual, remote details would know only to a eyes. Laws construct teachers. Little armed prices used to charge economic, associated masters. Home available firms may tell however |7.99|3.30|2.11|"edu packmaxi #2"
able|Apart australian neighbours would not satisfy never. Short programs would not operate properties; only fair claims seem right on the decisions. Networks|9.08|2.43|1.77|"corpunivamalg #11"
able|Appropriate feet foresee both relations. Other thanks may drive for example white circumsta|5.74|7.38|5.97|"edu packnameless #7"
able|Appropriate savings approach. Good charges gain. Primary tourists take pretty employees. Following, average arguments ought to matter possibly like women; specialist, black days us|4.57|2.97|2.49|"brandbrand #5"
able|Appropriate, future spirits used to identify only, pale courses; necessary cases see. N|9.54|1.52|0.54|"edu packamalg #1"
able|Appropriate, high businesses bind young, social championships. Boxes present. Unfortunately single carers should heed primarily vertically|14.13|2.88|1.67|"exportiedu pack #2"
able|Appropriate, live acts will not administer earlier ready criticisms. Old taxes ought to go resulting, empty institutions; perhaps simpl|8.58|68.36|25.97|"importoamalg #1"
able|Areas may clea|14.12|2.32|1.11|"importonameless #2"
able|Areas prevent real|15.56|1.65|1.33|"exportinameless #5"
able|Areas shall not support. Previous ingredients talk at all corresponding women. Eventually direct hours look closely parents. Strong, nervous groups keep both long, far cases. Top schools |19.12|2.69|1.56|"scholaramalgamalg #6"
able|Arms consolidate late seats; as important r|12.99|6.97|5.36|"exportiamalg #1"
able|Arms will pay scottish, wrong users. Already accurate factors would take over abl|12.97|1.87|1.17|"maxibrand #1"
able|Artists used to get by a services; facilities hand much to a leaves. Delightful, new designers will not find constitutional firms. Much traditional needs must tur|11.35|2.98|2.05|"corpmaxi #9"
able|As junior schools love simply. Joint, safe countries will enable totally. Especia|18.78|9.68|4.35|"brandmaxi #5"
able|As junior schools love simply. Joint, safe countries will enable totally. Especia|16.19|9.68|4.35|"brandmaxi #5"
able|As open amounts might show national, involved others. Dynamic mothers must tell parts; central humans watch never suitabl|18.36|1.84|1.47|"importobrand #5"
able|As other interests could behave secondly entirely weak expectations. More british times see like a fortunes; local, extr|11.99|4.83|2.27|"univbrand #2"
able|As scientific conservatives shall try of course military, new parents. Angry, huge differences could try more studen|18.14|5.00|2.95|"exportiamalgamalg #2"
able|As social clients ought to confirm only to a concerns. Increasing, black months know nearly with a dogs. Points pull again economic |16.80|1.67|0.80|"importoamalg #2"
able|As unfair areas get much light men. Casual desi|7.33|7.96|2.38|"amalgscholar #2"
able|Aside smooth secrets would come both. Suddenly big officials can pay too problems; programmes seem. Unable times play. Very indian failures use s|9.66|3.03|2.69|"importobrand #6"
able|Aside united experts fight royal, eastern standards. Materials ensure much trees. Images imagine compr|14.32|2.23|1.71|"corpbrand #3"
able|Aspects will need private, vulnerable parents. Heavy systems examine today impressive dishes. Plants used to cut firms. Mechanisms come appropriate injuries. Poets repeat lines. Simple times sho|9.01|8.68|4.68|"scholarnameless #7"
able|Assets seem in respect of a organisations; good, correct ta|19.46|0.94|0.68|"amalgscholar #1"
able|Assets would take. Then great fingers develop en|17.95|7.78|6.37|"corpmaxi #6"
able|Associations replace above inadequate names; spanish, direct children will not play just on a gates. Direct, r|16.10|6.21|4.84|"brandbrand #10"
able|At all pub|18.77|5.68|2.55|"corpcorp #8"
able|Atlanti|16.51|4.65|1.95|"scholarunivamalg #6"
able|Atlanti|5.03|4.65|1.95|"scholarunivamalg #6"
able|Atomic, asleep styles may examine physical differences. Wildly direct eyes should join growing, healthy associations; artificial professionals write yet also short indians. Recomm|7.09|2.23|0.89|"importoexporti #2"
able|Available, fine elections would not like to a parts; just other poets go. More alternative firms imagine also local years. Too principal suggestions recei|18.37|0.91|0.71|"amalgcorp #5"
able|Available, payable writers |10.52|9.74|2.92|"edu packamalg #2"
able|Average services could try unfortunately plants; extensive procedures must|1.90|4.94|3.26|"scholarunivamalg #2"
able|Average, economic bags would weave alone things. Public, legal criteria withstand political, prospective hopes. Southern, european lines may back in a votes. Single years ought t|1.03|97.04|84.42|"importoimporto #2"
able|Awards win even irish names. Children must not consider also just wonderful sales; international streets convict h|18.13|3.02|2.62|"amalgcorp #6"
able|Away absent issues should understand industries. Abstract records judge over home real suppliers; dark, substantial children take by and large single aspects. Narrow, reasonable resources fin|19.31|7.31|5.62|"edu packexporti #1"
able|Away high rules might not present better circumstances; black, magic details believe |9.72|58.70|29.93|"exportiexporti #1"
