# name: test/sql/index/art/vacuum/test_art_vacuum_strings.test_slow
# description: Test checkpointing for vacuum operations with strings
# group: [vacuum]

statement ok
PRAGMA enable_verification

# FIXME: the metadata rework temporarily broke this test - should be revisited with the new ART storage
mode skip

# load the DB from disk
load __TEST_DIR__/test_art_vacuum_strings.db

statement ok
CREATE FUNCTION mem_to_bytes(x) AS CASE
    WHEN CONTAINS(x, 'KB') THEN REPLACE(x, 'KB', '')::INT * 1000
    WHEN CONTAINS(x, 'MB') THEN REPLACE(x, 'MB', '')::INT * 1000 * 1000
    WHEN CONTAINS(x, 'GB') THEN REPLACE(x, 'GB', '')::INT * 1000 * 1000 * 1000
    WHEN CONTAINS(x, 'TB') THEN REPLACE(x, 'TB', '')::INT * 1000 * 1000 * 1000 * 1000
    WHEN x = '0 bytes' THEN 0
    ELSE x::INT END;

# store the memory usage of 100K strings in base table
# verify that the memory increases and drops again
# this is the setup phase of the memory tests in this file

statement ok
CREATE TABLE temp (i varchar);

statement ok
CREATE TABLE empty AS
SELECT mem_to_bytes(memory_usage) AS usage FROM pragma_database_size();

statement ok
INSERT INTO temp SELECT range || 'I am' || range || 'a long not' || range || 'inlined string' || range FROM range(100000) AS range;

statement ok
CREATE TABLE base AS
SELECT mem_to_bytes(memory_usage) AS usage FROM pragma_database_size();

query I
SELECT base.usage > empty.usage
FROM base, empty;
----
true

statement ok
DROP TABLE temp;

statement ok
UPDATE empty SET usage = (SELECT mem_to_bytes(current.memory_usage) FROM pragma_database_size() AS current);

# create a table with an index, then restart the database
# due to serialization + lazy loading, the index size after the reload must be almost zero

statement ok
CREATE TABLE t (i varchar);

statement ok
INSERT INTO t SELECT range || 'I am' || range || 'a long not' || range || 'inlined string' || range FROM range(100000) AS range;

statement ok
CREATE INDEX idx ON t(i);

query I
SELECT mem_to_bytes(current.memory_usage) > 3 * base.usage AND mem_to_bytes(current.memory_usage) < 7 * base.usage
FROM base, pragma_database_size() current;
----
1

restart

query I
SELECT mem_to_bytes(current.memory_usage) < base.usage
FROM base, pragma_database_size() current;
----
1

# insert 100K values into every fourth leaf, partially deserializing the ART

statement ok
INSERT INTO t SELECT (range * 4) || 'I am' || (range * 4) || 'a long not' || (range * 4) || 'inlined string' || (range * 4) FROM range(100000) AS range;

# NOTE: the table itselt also takes up significant memory
query I
SELECT mem_to_bytes(current.memory_usage) > 10 * base.usage AND mem_to_bytes(current.memory_usage) < 25 * base.usage
FROM base, pragma_database_size() current;
----
1

# store the current size of the DB
statement ok
CREATE TABLE db_size AS
SELECT mem_to_bytes(current.memory_usage) AS usage
FROM pragma_database_size() AS current;

# now perform one bulk deletion of half the values
# and then loop and perform some smaller deletions

statement ok
DELETE FROM t WHERE rowid > (SELECT AVG(rowid) FROM t);

# half the index still is not in-memory, and the DB is persistent,
# so we don't expect the vacuum to clean up too much memory
# (since many allocators won't pass the threshold)

query I
SELECT mem_to_bytes(current.memory_usage) < db_size.usage
FROM db_size, pragma_database_size() current;
----
1

statement ok
UPDATE db_size SET usage = (SELECT mem_to_bytes(current.memory_usage) AS usage
FROM pragma_database_size() AS current);

loop threshold 0 4

statement ok
DELETE FROM t WHERE rowid > (SELECT AVG(rowid) FROM t);

endloop

query I
SELECT mem_to_bytes(current.memory_usage) < db_size.usage
FROM db_size, pragma_database_size() current;
----
1

statement ok
UPDATE db_size SET usage = (SELECT mem_to_bytes(current.memory_usage) AS usage
FROM pragma_database_size() AS current);

statement ok
DELETE FROM t;

query I
SELECT mem_to_bytes(current.memory_usage) < db_size.usage
FROM db_size, pragma_database_size() current;
----
1

restart

query I
SELECT mem_to_bytes(current.memory_usage) <= base.usage
FROM pragma_database_size() current, base;
----
1

