# name: test/sql/cte/materialized/materialized_cte_prepared.test
# description: Test DML statements with materialized Common Table Expressions (CTE)
# group: [materialized]

require no_alternative_verify

# Prepared plans reuse the physical CTE/exchange while rebuilding pipeline objects.
statement ok
PREPARE direct_fanout_cte AS
WITH c AS MATERIALIZED (SELECT i FROM range(1000) t(i))
SELECT count(*) FROM c;

loop i 0 20

query I
EXECUTE direct_fanout_cte
----
1000

endloop

statement ok
create table a(i integer);

statement ok
insert into a values (1), (2), (3), (NULL), (42), (84);

# prepare in materialized cte
statement ok
PREPARE v1 AS WITH t(x) AS MATERIALIZED (VALUES ($1))
DELETE FROM a WHERE i IN (FROM t);

query I
EXECUTE v1(42)
----
1

query I
FROM a ORDER BY 1
----
1
2
3
84
NULL

# prepare in both materialized cte and delete
statement ok
PREPARE v2 AS WITH t(x) AS MATERIALIZED (VALUES ($1))
DELETE FROM a WHERE (i + $2) IN (FROM t);

query I
EXECUTE v2(5, 2)
----
1

query I
FROM a ORDER BY 1
----
1
2
84
NULL
