# name: test/sql/constraints/unique/test_unique_multi_column.test
# description: NULL values and a multi-column UNIQUE constraint
# group: [unique]

statement ok
SET default_null_order='nulls_first';

require skip_reload

statement ok
CREATE TEMPORARY TABLE integers(i INTEGER, j INTEGER)

statement ok
CREATE UNIQUE INDEX uidx ON integers (i,j)

statement ok
INSERT INTO integers VALUES (3, 4), (2, 5)

query II
SELECT * FROM integers
----
3	4
2	5

# insert a duplicate value as part of a chain of values, this should fail
statement error
INSERT INTO integers VALUES (6, 6), (3, 4);
----
Constraint Error: Duplicate key "i: 3, j: 4" violates unique constraint. If this is an unexpected constraint violation please double check with the known index limitations section in our documentation (docs - sql - indexes).

statement ok
INSERT INTO integers VALUES (NULL, 6), (NULL, 6), (NULL, 7)

statement error
UPDATE integers SET i=77 WHERE i IS NULL
----
PLACEHOLDER_ERROR_MESSAGE1226

query II
SELECT * FROM integers ORDER BY i, j
----
NULL	6
NULL	6
NULL	7
2	5
3	4

statement ok
UPDATE integers SET i=77 WHERE i IS NULL AND j=7

query II
SELECT * FROM integers ORDER BY i, j
----
NULL	6
NULL	6
2	5
3	4
77	7

statement ok
INSERT INTO integers VALUES (NULL, 6), (NULL, 7)

statement ok
INSERT INTO integers VALUES (NULL, 6), (NULL, 7)

statement ok
INSERT INTO integers VALUES (NULL, 6), (NULL, 7)

statement ok
INSERT INTO integers VALUES (NULL, 6), (NULL, 7)

statement ok
INSERT INTO integers VALUES (NULL, 6), (NULL, 7)

statement ok
INSERT INTO integers VALUES (NULL, 6), (NULL, 7)

statement ok
INSERT INTO integers VALUES (NULL, 6), (NULL, 7)

statement ok
INSERT INTO integers VALUES (NULL, 6), (NULL, 7)

statement ok
INSERT INTO integers VALUES (NULL, 6), (NULL, 7)

statement ok
INSERT INTO integers VALUES (NULL, 6), (NULL, 7)

statement error
INSERT INTO integers VALUES  (3, 4)
----
PLACEHOLDER_ERROR_MESSAGE1225

statement ok
DROP TABLE integers

