# name: test/sql/storage/compression/roaring/roaring_fetch_row.test
# group: [roaring]

require block_size 262144

# load the DB from disk
load __TEST_DIR__/test_roaring_compression_fetch_row.db readwrite v1.2.0

statement ok
CREATE TABLE test (
	a INT
);

statement ok
pragma force_compression='roaring'

# Array Container
statement ok
INSERT INTO test SELECT case when i%25=0 then 1337 else null end FROM range(0,10000) tbl(i);

statement ok
checkpoint

restart

query I
SELECT compression FROM pragma_storage_info('test') WHERE segment_type ILIKE 'VALIDITY' and compression != 'Roaring';
----

query I
select count(*) from test WHERE a IS NOT NULL;
----
400

query III
select sum(a), min(a), max(a) from test;
----
534800	1337	1337

statement ok
delete from test;

# Run Container
statement ok
INSERT INTO test SELECT case when i = 0 or (i % 512 != 0 and (i % 512) < 350 or (i % 512) > 450) then null else 1337 end FROM range(0,10000) tbl(i);

statement ok
checkpoint

restart

query I
SELECT compression FROM pragma_storage_info('test') WHERE segment_type ILIKE 'VALIDITY' and compression != 'Roaring';
----

query I
select count(*) from test WHERE a IS NOT NULL;
----
1938

query III
select sum(a), min(a), max(a) from test;
----
2591106	1337	1337

statement ok
delete from test;

# Bitset Container
statement ok
INSERT INTO test SELECT case when i%3=0 then 1337 else null end FROM range(0,10000) tbl(i);

statement ok
checkpoint

restart

query I
SELECT compression FROM pragma_storage_info('test') WHERE segment_type ILIKE 'VALIDITY' and compression != 'Roaring';
----

query I
select count(*) from test WHERE a IS NOT NULL;
----
3334

query III
select sum(a), min(a), max(a) from test;
----
4457558	1337	1337

statement ok
delete from test;
