# name: test/sql/storage/compression/roaring/roaring_inverted_array_simple.test
# description: Test bitpacking with nulls
# group: [roaring]

# This test defaults to another compression function for smaller block sizes,
# because the bitpacking groups no longer fit the blocks.
require block_size 262144

load __TEST_DIR__/test_roaring.db

statement ok
PRAGMA force_compression='roaring'

# simple compression with few values
statement ok
CREATE TABLE test (a BIGINT);

statement ok
INSERT INTO test SELECT case when i%25=0 then null else 1337 end FROM range(0,10000) tbl(i);

statement ok
checkpoint

query I
SELECT compression FROM pragma_storage_info('test') WHERE segment_type ILIKE 'VALIDITY' and compression != 'Roaring';
----

query III
select sum(a), min(a), max(a) from test;
----
12835200	1337	1337

statement ok
delete from test

# 5 null values per Vector, uses inverted uncompressed arrays
statement ok
with intermediates as (
	select i % 2048 as i
	from range(0, 10_000) t(i)
)
insert into test select case when
	i = 0 or
	i = 6 or
	i = 1000 or
	i = 1500 or
	i = 2000
	then null
else 1337 end from intermediates;

statement ok
checkpoint;

query I
select count(*) from test WHERE a IS NOT NULL;
----
9976

query III
select sum(a), min(a), max(a) from test;
----
13337912	1337	1337

statement ok
DROP TABLE test;
