# name: test/sql/storage/compression/roaring/roaring_bool_fetch_row.test
# group: [roaring]

require block_size 262144

# load the DB from disk
load __TEST_DIR__/test_roaring_compression_fetch_row.db readwrite v1.5.0

statement ok
CREATE TABLE test (
	a BOOL
);

statement ok
pragma force_compression='roaring'

# Array Container
statement ok
INSERT INTO test SELECT case when i%25=0 then true else false end FROM range(0,10000) tbl(i);

statement ok
checkpoint

restart

query I
SELECT compression FROM pragma_storage_info('test') WHERE segment_type ILIKE 'VALIDITY' and compression != 'Constant';
----

query I
SELECT compression FROM pragma_storage_info('test') WHERE segment_type ILIKE 'BOOLEAN' and compression != 'Roaring';
----

query I
select count(*) from test WHERE a IS true;
----
400

statement ok
delete from test;

# Run Container
statement ok
INSERT INTO test SELECT case when i = 0 or (i % 512 != 0 and (i % 512) < 350 or (i % 512) > 450) then false else true end FROM range(0,10000) tbl(i);

statement ok
checkpoint

restart

query I
SELECT compression FROM pragma_storage_info('test') WHERE segment_type ILIKE 'VALIDITY' and compression != 'Constant';
----

query I
SELECT compression FROM pragma_storage_info('test') WHERE segment_type ILIKE 'BOOLEAN' and compression != 'Roaring';
----

query I
select count(*) from test WHERE a IS true;
----
1938

statement ok
delete from test;

# Bitset Container
statement ok
INSERT INTO test SELECT case when i%3=0 then true else false end FROM range(0,10000) tbl(i);

statement ok
checkpoint

restart

query I
SELECT compression FROM pragma_storage_info('test') WHERE segment_type ILIKE 'VALIDITY' and compression != 'Constant';
----

query I
SELECT compression FROM pragma_storage_info('test') WHERE segment_type ILIKE 'BOOLEAN' and compression != 'Roaring';
----


query I
select count(*) from test WHERE a IS true;
----
3334

statement ok
delete from test;
