# name: test/sql/transactions/test_transaction_local_unique_ops.test
# description: Test operations on transaction local data with unique indices
# group: [transactions]

statement ok
PRAGMA enable_verification

# perform different operations on the same data within one transaction
statement ok
BEGIN TRANSACTION

statement ok
CREATE TABLE integers(i INTEGER PRIMARY KEY, j INTEGER)

statement ok
INSERT INTO integers VALUES (1, 3), (2, 3)

query II
SELECT * FROM integers ORDER BY 1
----
1	3
2	3

# appending the same value again fails
statement error
INSERT INTO integers VALUES (1, 2)

statement ok
ROLLBACK

statement ok
BEGIN TRANSACTION

statement ok
CREATE TABLE integers(i INTEGER PRIMARY KEY, j INTEGER)

statement ok
INSERT INTO integers VALUES (1, 3), (2, 3)

query II
SELECT * FROM integers ORDER BY 1
----
1	3
2	3

# updating also fails if there is a conflict
statement error
UPDATE integers SET i=1 WHERE i=2

statement ok
ROLLBACK

statement ok
BEGIN TRANSACTION

statement ok
CREATE TABLE integers(i INTEGER PRIMARY KEY, j INTEGER)

statement ok
INSERT INTO integers VALUES (1, 3), (2, 3)

query II
SELECT * FROM integers ORDER BY 1
----
1	3
2	3

# but not if there is no conflict
statement ok
UPDATE integers SET i=3 WHERE i=2

statement ok
COMMIT

query II
SELECT * FROM integers ORDER BY 1
----
1	3
3	3

# if we delete, we can insert the value again
statement ok
DELETE FROM integers WHERE i=1

query II
SELECT * FROM integers ORDER BY 1
----
3	3

statement ok
INSERT INTO integers VALUES (1, 3)

query II
SELECT * FROM integers ORDER BY 1
----
1	3
3	3

