# name: test/sql/sample/table_samples/test_sample_is_destroyed_on_updates.test
# description: Test sampling of larger relations
# group: [table_samples]

mode skip

# required when testing table samples. See basic_sample_test.test
require vector_size 2048

load __TEST_DIR__/test_sample_is_destroyed_on_update.db

statement ok
create or replace table integers_1 as select range a, range+1 b  from range(102400);

# no sample collected yet. There are only 5
query I
select count(*) from duckdb_table_sample('integers_1') order by all;
----
1024

statement ok
delete from integers_1 where a = 3;

# sample no longer exists
query I
select count(*) from duckdb_table_sample('integers_1') order by all;
----
0

statement ok
create or replace table integers_1 as select range a, range+1 b  from range(102400);

query I
select count(*) from duckdb_table_sample('integers_1');
----
1024

statement ok
update integers_1 set a = 5 where a = 1;

query II
select * from duckdb_table_sample('integers_1');
----

# test adding columns destroys the sample.
statement ok
create or replace table integers_1 as select range a, range+1 b  from range(204800);

query I
select count(*) from duckdb_table_sample('integers_1');
----
2048

statement ok
Alter table integers_1 add column c DOUBLE;

query III
select * from duckdb_table_sample('integers_1');
----


# test altering types destroys the sample
statement ok
create or replace table integers_1 as select range a, range+1 b  from range(102400);


# don't have enough smaples yet.
query I
select count(*) from duckdb_table_sample('integers_1');
----
1024

statement ok
Alter table integers_1 alter b TYPE VARCHAR

query II
select * from duckdb_table_sample('integers_1');
----

# test dropping a columns
statement ok
create or replace table integers_1 as select range a, range+1 b  from range(102400);

query I
select count(*) from duckdb_table_sample('integers_1');
----
1024

statement ok
Alter table integers_1 drop b;

query I
select * from duckdb_table_sample('integers_1');
----

# test sample is destroyed after a restart
statement ok
create or replace table integers_1 as select range a, range+1 b  from range(500);

query I
select count(*) from duckdb_table_sample('integers_1');
----
5

statement ok
Alter table integers_1 drop b;

# sample is destroyed
query I
select * from duckdb_table_sample('integers_1');
----

restart

statement ok
insert into integers_1 select range a from range(500);

# sample is still destroyed
query I
select * from duckdb_table_sample('integers_1');
----




