# name: test/sql/storage/wal/wal_store_alter_type.test
# description: Remove column from persistent table
# group: [wal]

require skip_reload


load __TEST_DIR__/test_store_alter_type.db

statement ok
PRAGMA disable_checkpoint_on_shutdown

statement ok
PRAGMA wal_autocheckpoint='1TB';

# create a table and add a column to it
statement ok
CREATE TABLE test (a INTEGER, b INTEGER);

statement ok
INSERT INTO test VALUES (11, 22), (13, 22), (12, 21)

restart

statement ok
PRAGMA disable_checkpoint_on_shutdown

statement ok
PRAGMA wal_autocheckpoint='1TB';

statement ok
ALTER TABLE test ALTER b TYPE VARCHAR

query IT
SELECT * FROM test ORDER BY 1
----
11	22
12	21
13	22

restart

statement ok
PRAGMA disable_checkpoint_on_shutdown

statement ok
PRAGMA wal_autocheckpoint='1TB';

query IT
SELECT * FROM test ORDER BY 1
----
11	22
12	21
13	22

statement ok
INSERT INTO test VALUES (10, 'hello')

query IT
SELECT * FROM test ORDER BY 1
----
10	hello
11	22
12	21
13	22

restart

statement ok
PRAGMA disable_checkpoint_on_shutdown

statement ok
PRAGMA wal_autocheckpoint='1TB';

query IT
SELECT * FROM test ORDER BY 1
----
10	hello
11	22
12	21
13	22

statement ok
DELETE FROM test WHERE b='hello'

restart

query IT
SELECT * FROM test ORDER BY 1
----
11	22
12	21
13	22

statement ok
INSERT INTO test VALUES (10, 'hello')

query IT
SELECT * FROM test ORDER BY 1
----
10	hello
11	22
12	21
13	22

restart

query IT
SELECT * FROM test ORDER BY 1
----
10	hello
11	22
12	21
13	22
