# name: test/sql/storage/optimistic_write/optimistic_write_delete.test
# description: Test optimistic write with deletes in transaction-local storage
# group: [optimistic_write]

# load the DB from disk
load __TEST_DIR__/optimistic_write_delete.db

statement ok
CREATE TABLE test (a INTEGER);

statement ok
BEGIN TRANSACTION

statement ok
INSERT INTO test SELECT * FROM range(1000000)

statement ok
DELETE FROM test WHERE a=0

statement ok
COMMIT

query I
SELECT SUM(a) FROM test
----
499999500000

restart

query I
SELECT SUM(a) FROM test
----
499999500000

statement ok
BEGIN TRANSACTION

statement ok
INSERT INTO test SELECT * FROM range(1000000)

statement ok
DELETE FROM test WHERE a=1

statement ok
ROLLBACK

query I
SELECT SUM(a) FROM test
----
499999500000
