# name: test/sql/storage/update/test_store_null_updates.test
# description: Test updates with storage and null values
# group: [update]

# load the DB from disk
load __TEST_DIR__/test_store_updates.db

statement ok
CREATE TABLE test (a INTEGER, b INTEGER);

statement ok
INSERT INTO test VALUES (11, 22), (NULL, 22), (12, 21)

query I
UPDATE test SET b=b+1 WHERE a=11
----
1

query II
SELECT a, b FROM test ORDER BY a
----
11	23
12	21
NULL	22

query I
UPDATE test SET b=b+1 WHERE a=11
----
1

query II
SELECT a, b FROM test ORDER BY a
----
11	24
12	21
NULL	22

statement ok
UPDATE test SET b=NULL WHERE a=11

query II
SELECT a, b FROM test ORDER BY a
----
11	NULL
12	21
NULL	22

restart

query II
SELECT a, b FROM test ORDER BY a
----
11	NULL
12	21
NULL	22
