# name: test/sql/storage/compression/reuse_explicit_compression_segments.test
# description: Test persistent base segment reuse across checkpoint rewrites
# group: [compression]

require noforcestorage

require no_alternative_verify

require vector_size 2048

load {TEST_DIR}/reuse_explicit_compression_segments.db readwrite v1.2.0

statement ok
SET threads=1

statement ok
SET checkpoint_threshold='9999GB'

statement ok
SET debug_verify_blocks=true

statement ok
CALL enable_logging(storage='memory', level='trace')

# Exercise the tuple/Vector amortization policy on deterministic 16 KiB fixed-size Segments.
statement ok
ATTACH '{TEST_DIR}/reuse_range_gate.db' AS range_gate_db (STORAGE_VERSION 'v1.2.0', BLOCK_SIZE 16384)

statement ok
CREATE TABLE range_gate_db.reuse_pipeline_gate_t(
    id BIGINT,
    v BIGINT USING COMPRESSION UNCOMPRESSED)

statement ok
INSERT INTO range_gate_db.reuse_pipeline_gate_t
SELECT i, i FROM range(860160) t(i)

statement ok
FORCE CHECKPOINT range_gate_db

statement ok
CREATE TEMP TABLE reuse_pipeline_gate_cases(
    row_group_id BIGINT,
    expected_local BOOLEAN)

statement ok
INSERT INTO reuse_pipeline_gate_cases VALUES
    (0, true),
    (1, true),
    (2, true),
    (3, true),
    (4, false),
    (5, false),
    (6, false)

statement ok
CREATE TABLE range_gate_db.reuse_pipeline_gate_targets AS
WITH segments AS (
    SELECT row_group_id, start, count,
           row_number() OVER (PARTITION BY row_group_id ORDER BY start) AS segment_no
    FROM pragma_storage_info('range_gate_db.reuse_pipeline_gate_t')
    WHERE column_name='v' AND segment_type='BIGINT'
)
SELECT row_group_id, start AS segment_start,
       row_group_id*122880+start+count//2 AS id
FROM segments
WHERE CASE row_group_id
    WHEN 0 THEN segment_no>=9
    WHEN 1 THEN segment_no BETWEEN 11 AND 35 OR segment_no>=37
    WHEN 2 THEN segment_no BETWEEN 12 AND 35 OR segment_no>=37
    WHEN 3 THEN segment_no BETWEEN 5 AND 10 OR segment_no BETWEEN 20 AND 25
                 OR segment_no BETWEEN 35 AND 40 OR segment_no BETWEEN 50 AND 55
    WHEN 4 THEN segment_no NOT IN (1,2,3,4,5,6,7,8,20,40,60)
    WHEN 5 THEN segment_no IN (5,15,25,35,45)
    WHEN 6 THEN segment_no>=8
    ELSE false
END

statement ok
CREATE TEMP TABLE reuse_pipeline_gate_before AS
SELECT row_group_id, start, count, block_id, block_offset,
       row_number() OVER (PARTITION BY row_group_id ORDER BY start) AS segment_no,
       EXISTS (SELECT 1 FROM range_gate_db.reuse_pipeline_gate_targets target
               WHERE target.row_group_id=storage.row_group_id
                 AND target.segment_start=storage.start) AS dirty
FROM pragma_storage_info('range_gate_db.reuse_pipeline_gate_t') storage
WHERE column_name='v' AND segment_type='BIGINT'

statement ok
CREATE TEMP TABLE reuse_pipeline_gate_metrics AS
WITH starts AS (
    SELECT *,
           (dirty AND NOT coalesce(lag(dirty) OVER (
               PARTITION BY row_group_id ORDER BY start), false))::INTEGER AS range_start
    FROM reuse_pipeline_gate_before
), numbered AS (
    SELECT *, sum(range_start) OVER (
        PARTITION BY row_group_id ORDER BY start) AS range_no
    FROM starts
), layout AS (
    SELECT row_group_id, sum(count) AS column_count, max(count) AS max_count,
           sum(count) FILTER (WHERE NOT dirty) AS reused_tuple_count,
           sum(count) FILTER (WHERE dirty) AS dirty_tuple_count,
           sum(range_start) AS dirty_range_count,
           count(*) FILTER (WHERE NOT dirty) AS clean_segment_count
    FROM numbered
    GROUP BY row_group_id
), dirty_ranges AS (
    SELECT row_group_id, range_no, sum(count) AS rewrite_count
    FROM numbered
    WHERE dirty
    GROUP BY row_group_id, range_no
), dirty_projection AS (
    SELECT dirty_ranges.row_group_id,
           sum((rewrite_count+max_count-1)//max_count+1) AS projected_dirty_segments
    FROM dirty_ranges
    JOIN layout USING (row_group_id)
    GROUP BY dirty_ranges.row_group_id
), projection AS (
    SELECT layout.*,
           clean_segment_count+projected_dirty_segments AS projected_segment_count
    FROM layout
    JOIN dirty_projection USING (row_group_id)
)
SELECT *, column_count//8 AS minimum_reused_tuple_count,
       greatest(column_count//8, greatest(dirty_range_count-1, 0)*5*2048) AS required_reused_tuple_count,
       (column_count+max_count-1)//max_count AS compact_segment_count,
       (column_count+max_count-1)//max_count
         + greatest(1, ((column_count+max_count-1)//max_count)//4) AS maximum_segment_count
FROM projection

# Cover the base reuse, pipeline amortization and dirty-range limits.
query IIIII rowsort
SELECT row_group_id, dirty_range_count, reused_tuple_count, minimum_reused_tuple_count,
       required_reused_tuple_count
FROM reuse_pipeline_gate_metrics
----
0	1	16376	15360	15360
1	2	22517	15360	15360
2	2	24564	15360	15360
3	4	73752	15360	30720
4	4	22517	15360	30720
5	5	112645	15360	40960
6	1	14329	15360	15360

# RowGroup 3 is the maximum accepted range count; RowGroup 5 exceeds it.
query III
SELECT (SELECT dirty_range_count=4 AND reused_tuple_count>=required_reused_tuple_count
        FROM reuse_pipeline_gate_metrics WHERE row_group_id=3)::INTEGER,
       (SELECT dirty_range_count=5 AND reused_tuple_count>=required_reused_tuple_count
        FROM reuse_pipeline_gate_metrics WHERE row_group_id=5)::INTEGER,
       (count(*) FILTER (WHERE projected_segment_count<=maximum_segment_count)=7)::INTEGER
FROM reuse_pipeline_gate_metrics
----
1	1	1

statement ok
SET threads=32

statement ok
UPDATE range_gate_db.reuse_pipeline_gate_t AS target
SET v=-target.id-1
FROM range_gate_db.reuse_pipeline_gate_targets AS changes
WHERE target.id=changes.id

statement ok
FORCE CHECKPOINT range_gate_db

query II rowsort
WITH after_segments AS (
    SELECT row_group_id, start, count, block_id, block_offset
    FROM pragma_storage_info('range_gate_db.reuse_pipeline_gate_t')
    WHERE column_name='v' AND segment_type='BIGINT'
), matches AS (
    SELECT before.row_group_id,
           count(*) FILTER (WHERE NOT before.dirty) AS clean_segments,
           count(*) FILTER (WHERE NOT before.dirty AND before.block_id=after.block_id
                                                   AND before.block_offset=after.block_offset) AS reused_clean_segments,
           count(*) FILTER (WHERE before.block_id=after.block_id
                              AND before.block_offset=after.block_offset) AS retained_segments
    FROM reuse_pipeline_gate_before before
    LEFT JOIN after_segments after USING (row_group_id, start, count)
    GROUP BY before.row_group_id
)
SELECT matches.row_group_id,
       CASE WHEN cases.expected_local THEN reused_clean_segments=clean_segments AND clean_segments>0
            ELSE retained_segments=0 END::INTEGER
FROM matches
JOIN reuse_pipeline_gate_cases cases USING (row_group_id)
ORDER BY row_group_id
----
0	1
1	1
2	1
3	1
4	1
5	1
6	1

query I
SELECT count(*) FROM range_gate_db.reuse_pipeline_gate_t
WHERE v IS DISTINCT FROM CASE
    WHEN id IN (SELECT id FROM range_gate_db.reuse_pipeline_gate_targets) THEN -id-1
    ELSE id END
----
0

statement ok
SET threads=1

# One dirty range passes tuple amortization but an already sparse layout exceeds the Segment budget.
statement ok
CREATE TABLE range_gate_db.reuse_layout_gate_t(
    id BIGINT,
    v VARCHAR USING COMPRESSION UNCOMPRESSED)

statement ok
INSERT INTO range_gate_db.reuse_layout_gate_t
SELECT i, CASE WHEN i<32768 THEN 'x' ELSE repeat('y',64) END
FROM range(122880) t(i)

statement ok
FORCE CHECKPOINT range_gate_db

statement ok
CREATE TABLE range_gate_db.reuse_layout_gate_target AS
SELECT start+count//2 AS id
FROM pragma_storage_info('range_gate_db.reuse_layout_gate_t')
WHERE column_name='v' AND segment_type='VARCHAR'
ORDER BY start
LIMIT 1

statement ok
CREATE TEMP TABLE reuse_layout_gate_before AS
SELECT start, count, block_id, block_offset,
       (SELECT id FROM range_gate_db.reuse_layout_gate_target)>=start
         AND (SELECT id FROM range_gate_db.reuse_layout_gate_target)<start+count AS dirty
FROM pragma_storage_info('range_gate_db.reuse_layout_gate_t')
WHERE column_name='v' AND segment_type='VARCHAR'

query III
WITH metrics AS (
    SELECT sum(count) AS column_count, max(count) AS max_count,
           sum(count) FILTER (WHERE NOT dirty) AS reused_tuple_count,
           sum(count) FILTER (WHERE dirty) AS dirty_tuple_count,
           count(*) AS segment_count,
           count(*) FILTER (WHERE dirty) AS dirty_segment_count
    FROM reuse_layout_gate_before
)
SELECT (reused_tuple_count>=column_count//8)::INTEGER,
       (segment_count-dirty_segment_count
          +(dirty_tuple_count+max_count-1)//max_count+1
          >(column_count+max_count-1)//max_count
         + greatest(1, ((column_count+max_count-1)//max_count)//4))::INTEGER,
       (dirty_segment_count=1)::INTEGER
FROM metrics
----
1	1	1

statement ok
UPDATE range_gate_db.reuse_layout_gate_t
SET v=repeat('z',64)
WHERE id=(SELECT id FROM range_gate_db.reuse_layout_gate_target)

statement ok
FORCE CHECKPOINT range_gate_db

query II
SELECT (SELECT count(*)
        FROM reuse_layout_gate_before before
        JOIN pragma_storage_info('range_gate_db.reuse_layout_gate_t') after USING (block_id, block_offset)
        WHERE after.column_name='v' AND after.segment_type='VARCHAR'),
       (SELECT count(*) FROM range_gate_db.reuse_layout_gate_t
        WHERE v IS DISTINCT FROM CASE
            WHEN id=(SELECT id FROM range_gate_db.reuse_layout_gate_target) THEN repeat('z',64)
            WHEN id<32768 THEN 'x' ELSE repeat('y',64) END)
----
0	0

# Analyze candidates are initialized independently for every dirty range.
statement ok
CREATE TABLE range_gate_db.reuse_range_analyze_t(
    id BIGINT,
    v VARCHAR USING COMPRESSION DICTIONARY)

statement ok
INSERT INTO range_gate_db.reuse_range_analyze_t
SELECT i, concat('dictionary-', i::VARCHAR, '-', repeat(md5(i::VARCHAR), 2))
FROM range(122880) t(i)

statement ok
FORCE CHECKPOINT range_gate_db

statement ok
CREATE TABLE range_gate_db.reuse_range_analyze_targets AS
WITH segments AS (
    SELECT start, count, row_number() OVER (ORDER BY start) AS segment_no,
           count(*) OVER () AS segment_count
    FROM pragma_storage_info('range_gate_db.reuse_range_analyze_t')
    WHERE column_name='v' AND segment_type='VARCHAR'
)
SELECT start+count//2 AS id, segment_no=2 AS use_large_string
FROM segments
WHERE segment_no=2 OR segment_no=segment_count-1

query I
SELECT (count(*)=2 AND count(*) FILTER (WHERE use_large_string)=1)::INTEGER
FROM range_gate_db.reuse_range_analyze_targets
----
1

statement ok
CREATE TEMP TABLE reuse_range_analyze_before AS
SELECT start, count, block_id, block_offset,
       EXISTS (SELECT 1 FROM range_gate_db.reuse_range_analyze_targets target
               WHERE target.id>=storage.start AND target.id<storage.start+storage.count) AS dirty
FROM pragma_storage_info('range_gate_db.reuse_range_analyze_t') storage
WHERE column_name='v' AND segment_type='VARCHAR'

statement ok
CALL truncate_duckdb_logs()

statement ok
UPDATE range_gate_db.reuse_range_analyze_t AS target
SET v=CASE WHEN changes.use_large_string THEN repeat('L',300000) ELSE 'dictionary-after-failure' END
FROM range_gate_db.reuse_range_analyze_targets AS changes
WHERE target.id=changes.id

statement ok
FORCE CHECKPOINT range_gate_db

query IIIII
WITH after_segments AS (
    SELECT start, count, block_id, block_offset
    FROM pragma_storage_info('range_gate_db.reuse_range_analyze_t')
    WHERE column_name='v' AND segment_type='VARCHAR'
)
SELECT (count(*) FILTER (WHERE NOT before.dirty AND before.block_id=after.block_id
                                          AND before.block_offset=after.block_offset)
            = count(*) FILTER (WHERE NOT before.dirty)
        AND count(*) FILTER (WHERE NOT before.dirty)>0)::INTEGER,
       (SELECT count(*) FROM duckdb_logs
        WHERE contains(message, 'reuse_range_analyze_t.1(VARCHAR)')
          AND starts_with(message, 'ColumnDataCheckpointer FinalAnalyze(UNCOMPRESSED)')),
       (SELECT count(*) FROM duckdb_logs
        WHERE contains(message, 'reuse_range_analyze_t.1(VARCHAR)')
          AND starts_with(message, 'ColumnDataCheckpointer FinalAnalyze(DICTIONARY)')),
       (SELECT count(*) FROM range_gate_db.reuse_range_analyze_t data
        JOIN range_gate_db.reuse_range_analyze_targets target USING (id)
        WHERE target.use_large_string AND data.v!=repeat('L',300000)),
       (SELECT count(*) FROM range_gate_db.reuse_range_analyze_t data
        JOIN range_gate_db.reuse_range_analyze_targets target USING (id)
        WHERE NOT target.use_large_string AND data.v!='dictionary-after-failure')
FROM reuse_range_analyze_before before
LEFT JOIN after_segments after USING (start, count)
----
1	1	1	0	0

statement ok
ATTACH '{TEST_DIR}/reuse_fragment_guard.db' AS fragment_db (STORAGE_VERSION 'v1.2.0', BLOCK_SIZE 262144)

statement ok
CREATE TABLE fragment_db.reuse_fragment_guard_t(
    id BIGINT,
    v VARCHAR USING COMPRESSION FSST)

statement ok
INSERT INTO fragment_db.reuse_fragment_guard_t
SELECT i, md5(i::VARCHAR) || md5((i+1)::VARCHAR)
FROM range(122880) t(i)

statement ok
FORCE CHECKPOINT fragment_db

# Alternating dirty segments exceed the budget and rewrite the complete base column.
statement ok
CREATE TABLE fragment_db.reuse_fragment_guarded_targets AS
WITH segments AS (
    SELECT start, count, row_number() OVER (ORDER BY start) AS segment_no
    FROM pragma_storage_info('fragment_db.reuse_fragment_guard_t')
    WHERE column_name='v' AND segment_type='VARCHAR'
)
SELECT start+count//2 AS id
FROM segments
WHERE segment_no%2=1

statement ok
CREATE TEMP TABLE reuse_fragment_guarded_before AS
SELECT start, count, block_id, block_offset,
       EXISTS (SELECT 1 FROM fragment_db.reuse_fragment_guarded_targets targets
               WHERE targets.id>=start AND targets.id<start+count) AS dirty
FROM pragma_storage_info('fragment_db.reuse_fragment_guard_t')
WHERE column_name='v' AND segment_type='VARCHAR'

query I
WITH budget AS (
    SELECT (sum(count)+max(count)-1)//max(count) AS compact_segments
    FROM reuse_fragment_guarded_before
), estimate AS (
    SELECT count(*) FILTER (WHERE NOT dirty)
             + sum(CASE WHEN dirty THEN
                     (count+(SELECT max(count) FROM reuse_fragment_guarded_before)-1)
                       //(SELECT max(count) FROM reuse_fragment_guarded_before)+1
                   ELSE 0 END) AS projected_segments
    FROM reuse_fragment_guarded_before
)
SELECT (projected_segments > compact_segments+greatest(1, compact_segments//4))::INTEGER
FROM estimate, budget
----
1

statement ok
UPDATE fragment_db.reuse_fragment_guard_t AS target
SET v=md5(concat('guarded-', target.id::VARCHAR))
   || md5(concat('guarded-tail-', target.id::VARCHAR))
FROM fragment_db.reuse_fragment_guarded_targets AS changes
WHERE target.id=changes.id

statement ok
FORCE CHECKPOINT fragment_db

query III
WITH layout AS (
    SELECT count(*) AS segments, sum(count) AS tuples, max(count) AS max_count
    FROM pragma_storage_info('fragment_db.reuse_fragment_guard_t')
    WHERE column_name='v' AND segment_type='VARCHAR'
)
SELECT (SELECT count(*)
        FROM reuse_fragment_guarded_before before
        JOIN pragma_storage_info('fragment_db.reuse_fragment_guard_t') after USING (block_id, block_offset)
        WHERE after.column_name='v' AND after.segment_type='VARCHAR'),
       (SELECT (segments <= (tuples+max_count-1)//max_count
                           + greatest(1, ((tuples+max_count-1)//max_count)//8))::INTEGER
        FROM layout),
       (SELECT count(*) FROM fragment_db.reuse_fragment_guard_t
        WHERE v IS DISTINCT FROM CASE
            WHEN id IN (SELECT id FROM fragment_db.reuse_fragment_guarded_targets)
                THEN md5(concat('guarded-', id::VARCHAR))
                  || md5(concat('guarded-tail-', id::VARCHAR))
            ELSE md5(id::VARCHAR) || md5((id+1)::VARCHAR) END)
----
0	1	0

# Once compacted, one dirty segment is again eligible for local rewriting.
statement ok
CREATE TABLE fragment_db.reuse_fragment_post_target AS
SELECT start+count//2 AS id
FROM pragma_storage_info('fragment_db.reuse_fragment_guard_t')
WHERE column_name='v' AND segment_type='VARCHAR'
ORDER BY start
LIMIT 1

statement ok
CREATE TEMP TABLE reuse_fragment_compacted_before AS
SELECT start, count, block_id, block_offset,
       EXISTS (SELECT 1 FROM fragment_db.reuse_fragment_post_target target
               WHERE target.id>=start AND target.id<start+count) AS dirty
FROM pragma_storage_info('fragment_db.reuse_fragment_guard_t')
WHERE column_name='v' AND segment_type='VARCHAR'

statement ok
UPDATE fragment_db.reuse_fragment_guard_t AS target
SET v=md5(concat('post-', target.id::VARCHAR))
   || md5(concat('post-tail-', target.id::VARCHAR))
FROM fragment_db.reuse_fragment_post_target AS changes
WHERE target.id=changes.id

statement ok
FORCE CHECKPOINT fragment_db

query II
WITH after_segments AS (
    SELECT start, count, block_id, block_offset
    FROM pragma_storage_info('fragment_db.reuse_fragment_guard_t')
    WHERE column_name='v' AND segment_type='VARCHAR'
)
SELECT (count(*) FILTER (WHERE NOT before.dirty AND before.block_id=after.block_id
                                          AND before.block_offset=after.block_offset)
            = count(*) FILTER (WHERE NOT before.dirty)
        AND count(*) FILTER (WHERE NOT before.dirty)>0)::INTEGER,
       (SELECT count(*) FROM fragment_db.reuse_fragment_guard_t
        WHERE v IS DISTINCT FROM CASE
            WHEN id IN (SELECT id FROM fragment_db.reuse_fragment_post_target)
                THEN md5(concat('post-', id::VARCHAR))
                  || md5(concat('post-tail-', id::VARCHAR))
            WHEN id IN (SELECT id FROM fragment_db.reuse_fragment_guarded_targets)
                THEN md5(concat('guarded-', id::VARCHAR))
                  || md5(concat('guarded-tail-', id::VARCHAR))
            ELSE md5(id::VARCHAR) || md5((id+1)::VARCHAR) END)
FROM reuse_fragment_compacted_before before
LEFT JOIN after_segments after USING (start, count)
----
1	0

# Four RowGroups apply the default fragmentation guard in parallel.
statement ok
CREATE TABLE fragment_db.reuse_fragment_parallel_t(
    id BIGINT,
    v VARCHAR USING COMPRESSION FSST)

statement ok
INSERT INTO fragment_db.reuse_fragment_parallel_t
SELECT i, md5((i%122880)::VARCHAR) || md5(((i%122880)+1)::VARCHAR)
FROM range(491520) t(i)

statement ok
FORCE CHECKPOINT fragment_db

statement ok
CREATE TABLE fragment_db.reuse_fragment_parallel_targets AS
WITH segments AS (
    SELECT row_group_id, start, count,
           min(start) OVER (PARTITION BY row_group_id) AS first_start,
           row_number() OVER (PARTITION BY row_group_id ORDER BY start) AS segment_no
    FROM pragma_storage_info('fragment_db.reuse_fragment_parallel_t')
    WHERE column_name='v' AND segment_type='VARCHAR'
)
SELECT row_group_id, start AS segment_start,
       row_group_id*122880+(start-first_start)+count//2 AS id
FROM segments
WHERE segment_no%2=1

statement ok
CREATE TEMP TABLE reuse_fragment_parallel_before AS
SELECT row_group_id, start, count, block_id, block_offset,
       EXISTS (SELECT 1 FROM fragment_db.reuse_fragment_parallel_targets targets
               WHERE targets.row_group_id=storage.row_group_id
                 AND targets.segment_start=storage.start) AS dirty
FROM pragma_storage_info('fragment_db.reuse_fragment_parallel_t') storage
WHERE column_name='v' AND segment_type='VARCHAR'

query II
WITH layout AS (
    SELECT row_group_id, (sum(count)+max(count)-1)//max(count) AS compact_segments
    FROM reuse_fragment_parallel_before
    GROUP BY row_group_id
), estimate AS (
    SELECT row_group_id,
           count(*) FILTER (WHERE NOT dirty)
             + sum(CASE WHEN dirty THEN
                     (count+(SELECT max(count) FROM reuse_fragment_parallel_before maximum
                             WHERE maximum.row_group_id=before.row_group_id)-1)
                       //(SELECT max(count) FROM reuse_fragment_parallel_before maximum
                          WHERE maximum.row_group_id=before.row_group_id)+1
                   ELSE 0 END) AS projected_segments
    FROM reuse_fragment_parallel_before before
    GROUP BY row_group_id
)
SELECT count(*), count(*) FILTER (
           WHERE projected_segments > compact_segments+greatest(1, compact_segments//4))
FROM estimate JOIN layout USING (row_group_id)
----
4	4

statement ok
SET threads=32

statement ok
UPDATE fragment_db.reuse_fragment_parallel_t AS target
SET v=md5(concat('parallel-', target.id::VARCHAR))
   || md5(concat('parallel-tail-', target.id::VARCHAR))
FROM fragment_db.reuse_fragment_parallel_targets AS changes
WHERE target.id=changes.id

statement ok
FORCE CHECKPOINT fragment_db

query III
WITH layout AS (
    SELECT row_group_id, count(*) AS segments, sum(count) AS tuples, max(count) AS max_count
    FROM pragma_storage_info('fragment_db.reuse_fragment_parallel_t')
    WHERE column_name='v' AND segment_type='VARCHAR'
    GROUP BY row_group_id
)
SELECT (SELECT count(*)
        FROM reuse_fragment_parallel_before before
        JOIN pragma_storage_info('fragment_db.reuse_fragment_parallel_t') after USING (block_id, block_offset)
        WHERE after.column_name='v' AND after.segment_type='VARCHAR'),
       (SELECT count(*) FROM layout
        WHERE segments <= (tuples+max_count-1)//max_count
                         + greatest(1, ((tuples+max_count-1)//max_count)//8)),
       (SELECT count(*) FROM fragment_db.reuse_fragment_parallel_t
        WHERE v IS DISTINCT FROM CASE
            WHEN id IN (SELECT id FROM fragment_db.reuse_fragment_parallel_targets)
                THEN md5(concat('parallel-', id::VARCHAR))
                  || md5(concat('parallel-tail-', id::VARCHAR))
            ELSE md5((id%122880)::VARCHAR) || md5(((id%122880)+1)::VARCHAR) END)
----
0	4	0

# Concurrent local rewrites retain a clean peer when several RLE tails share one Block.
statement ok
ATTACH '{TEST_DIR}/reuse_shared_block.db' AS shared_db (STORAGE_VERSION 'v1.2.0', BLOCK_SIZE 262144)

statement ok
CREATE TABLE shared_db.reuse_shared_block_t(
    id BIGINT,
    v INTEGER USING COMPRESSION RLE)

statement ok
INSERT INTO shared_db.reuse_shared_block_t
SELECT i, (((i%122880)*100000)//122880)::INTEGER
FROM range(491520) t(i)

statement ok
FORCE CHECKPOINT shared_db

statement ok
CREATE TABLE reuse_shared_block_targets AS
WITH segments AS (
    SELECT row_group_id, start, count, block_id, block_offset,
           min(start) OVER (PARTITION BY row_group_id) AS first_start,
           row_number() OVER (PARTITION BY row_group_id ORDER BY start DESC) AS tail_no
    FROM pragma_storage_info('shared_db.reuse_shared_block_t')
    WHERE column_name='v' AND segment_type='INTEGER' AND block_id>=0
), tails AS (
    SELECT *, count(*) OVER (PARTITION BY block_id) AS peer_count,
           row_number() OVER (PARTITION BY block_id ORDER BY row_group_id) AS peer_no
    FROM segments
    WHERE tail_no=1
)
SELECT row_group_id, start, count, block_id, block_offset,
       row_group_id*122880+(start-first_start)+count//2 AS id,
       peer_no<peer_count AS dirty
FROM tails
WHERE peer_count>1

query IIII
SELECT (count(*)>1)::INTEGER,
       (count(DISTINCT block_id)<count(*))::INTEGER,
       (count(*) FILTER (WHERE dirty)>0)::INTEGER,
       (count(*) FILTER (WHERE NOT dirty)>0)::INTEGER
FROM reuse_shared_block_targets
----
1	1	1	1

statement ok
CREATE TABLE reuse_shared_block_before AS
SELECT storage.row_group_id, storage.start, storage.count, storage.block_id, storage.block_offset,
       EXISTS (SELECT 1 FROM reuse_shared_block_targets target
               WHERE target.row_group_id=storage.row_group_id
                 AND target.start=storage.start AND target.dirty) AS dirty
FROM pragma_storage_info('shared_db.reuse_shared_block_t') storage
WHERE column_name='v' AND segment_type='INTEGER'

statement ok
UPDATE shared_db.reuse_shared_block_t AS target
SET v=-1
FROM reuse_shared_block_targets AS changes
WHERE changes.dirty AND target.id=changes.id

statement ok
FORCE CHECKPOINT shared_db

query III
WITH after_segments AS (
    SELECT row_group_id, start, count, block_id, block_offset
    FROM pragma_storage_info('shared_db.reuse_shared_block_t')
    WHERE column_name='v' AND segment_type='INTEGER'
)
SELECT (count(*) FILTER (WHERE NOT before.dirty AND before.block_id=after.block_id
                                          AND before.block_offset=after.block_offset)
            = count(*) FILTER (WHERE NOT before.dirty))::INTEGER,
       (count(*) FILTER (WHERE before.dirty AND before.block_id=after.block_id
                                        AND before.block_offset=after.block_offset)=0)::INTEGER,
       (SELECT count(*) FROM shared_db.reuse_shared_block_t
        WHERE v IS DISTINCT FROM CASE
            WHEN id IN (SELECT id FROM reuse_shared_block_targets WHERE dirty) THEN -1
            ELSE (((id%122880)*100000)//122880)::INTEGER END)
FROM reuse_shared_block_before before
LEFT JOIN after_segments after USING (row_group_id, start, count)
----
1	1	0

statement ok
SET threads=1

# An explicit codec rewrites the dirty segment and reuses every unchanged segment.
statement ok
CREATE TABLE reuse_numeric_t(
    id BIGINT,
    v BIGINT USING COMPRESSION UNCOMPRESSED)

statement ok
INSERT INTO reuse_numeric_t SELECT i, i FROM range(122880) t(i)

statement ok
FORCE CHECKPOINT

statement ok
CREATE TEMP TABLE reuse_numeric_before AS
SELECT start, count, block_id, block_offset,
       start<=60000 AND start+count>60000 AS dirty
FROM pragma_storage_info('reuse_numeric_t')
WHERE column_name='v' AND segment_type='BIGINT'

statement ok
CALL truncate_duckdb_logs()

statement ok
UPDATE reuse_numeric_t SET v=v+1 WHERE id=60000

statement ok
FORCE CHECKPOINT

query III
WITH after_segments AS (
    SELECT start, count, block_id, block_offset
    FROM pragma_storage_info('reuse_numeric_t')
    WHERE column_name='v' AND segment_type='BIGINT'
)
SELECT (count(*) FILTER (WHERE NOT before.dirty AND before.block_id=after.block_id
                                          AND before.block_offset=after.block_offset)
            = count(*) FILTER (WHERE NOT before.dirty)
        AND count(*) FILTER (WHERE NOT before.dirty)>0)::INTEGER,
       (SELECT count(*) FROM duckdb_logs
        WHERE starts_with(message, 'ColumnDataCheckpointer FinalAnalyze(UNCOMPRESSED)')
          AND contains(message, 'main.reuse_numeric_t.1(BIGINT)')),
       (SELECT count(*) FROM reuse_numeric_t
        WHERE v IS DISTINCT FROM CASE WHEN id=60000 THEN id+1 ELSE id END)
FROM reuse_numeric_before before
LEFT JOIN after_segments after USING (start, count)
----
1	1	0

# A partial RowGroup with no reusable tuples takes the whole-column path.
statement ok
CREATE TABLE reuse_tiny_row_group_t(
    id BIGINT,
    v BIGINT USING COMPRESSION UNCOMPRESSED)

statement ok
INSERT INTO reuse_tiny_row_group_t VALUES
    (0, NULL),
    (1, 10),
    (2, 20),
    (3, 30)

statement ok
FORCE CHECKPOINT

query II
SELECT (count(*)=1)::INTEGER, max(count)//8
FROM pragma_storage_info('reuse_tiny_row_group_t')
WHERE column_name='v' AND segment_type='BIGINT'
----
1	0

statement ok
CALL truncate_duckdb_logs()

statement ok
UPDATE reuse_tiny_row_group_t SET v=v+1 WHERE id=1

statement ok
FORCE CHECKPOINT

query III
SELECT (SELECT count(*) FROM duckdb_logs
        WHERE contains(message, 'main.reuse_tiny_row_group_t.1(BIGINT)')
          AND starts_with(message, 'ColumnDataCheckpointer FinalAnalyze(')),
       (SELECT count(*) FROM duckdb_logs
        WHERE contains(message, 'main.reuse_tiny_row_group_t.0(VALIDITY)')
          AND starts_with(message, 'ColumnDataCheckpointer FinalAnalyze(')),
       (SELECT count(*) FROM reuse_tiny_row_group_t
        WHERE v IS DISTINCT FROM CASE id
            WHEN 0 THEN NULL WHEN 1 THEN 11 WHEN 2 THEN 20 ELSE 30 END)
----
1	1	0

# A validity-only change can reuse the base of a tiny partial RowGroup.
statement ok
CREATE TEMP TABLE reuse_tiny_validity_before AS
SELECT start, count, block_id, block_offset
FROM pragma_storage_info('reuse_tiny_row_group_t')
WHERE column_name='v' AND segment_type='BIGINT'

statement ok
CALL truncate_duckdb_logs()

statement ok
UPDATE reuse_tiny_row_group_t SET v=NULL WHERE id=2

statement ok
FORCE CHECKPOINT

query IIII
WITH after_segments AS (
    SELECT start, count, block_id, block_offset
    FROM pragma_storage_info('reuse_tiny_row_group_t')
    WHERE column_name='v' AND segment_type='BIGINT'
)
SELECT (count(*) FILTER (WHERE before.block_id=after.block_id
                           AND before.block_offset=after.block_offset)=1)::INTEGER,
       (SELECT count(*) FROM duckdb_logs
        WHERE contains(message, 'main.reuse_tiny_row_group_t.1(BIGINT)')
          AND starts_with(message, 'ColumnDataCheckpointer FinalAnalyze(')),
       (SELECT count(*) FROM duckdb_logs
        WHERE contains(message, 'main.reuse_tiny_row_group_t.0(VALIDITY)')
          AND starts_with(message, 'ColumnDataCheckpointer FinalAnalyze(')),
       (SELECT count(*) FROM reuse_tiny_row_group_t
        WHERE v IS DISTINCT FROM CASE id
            WHEN 0 THEN NULL WHEN 1 THEN 11 WHEN 2 THEN NULL ELSE 30 END)
FROM reuse_tiny_validity_before before
LEFT JOIN after_segments after USING (start, count)
----
1	0	1	0

# AUTO fully analyzes one contiguous dirty range while preserving the clean suffix.
statement ok
CREATE TABLE reuse_auto_t(id BIGINT, v VARCHAR)

statement ok
INSERT INTO reuse_auto_t
SELECT i, concat('value-', i::VARCHAR, '-', repeat(md5(i::VARCHAR), 2))
FROM range(122880) t(i)

statement ok
FORCE CHECKPOINT

statement ok
CREATE TEMP TABLE reuse_auto_contiguous_before AS
SELECT start, count, block_id, block_offset, start<30720 AS dirty
FROM pragma_storage_info('reuse_auto_t')
WHERE column_name='v' AND segment_type='VARCHAR'

statement ok
CALL truncate_duckdb_logs()

statement ok
UPDATE reuse_auto_t
SET v=concat('dense-', id::VARCHAR, '-', repeat(md5(id::VARCHAR), 2))
WHERE id<30720

statement ok
FORCE CHECKPOINT

query III
WITH after_segments AS (
    SELECT start, count, block_id, block_offset
    FROM pragma_storage_info('reuse_auto_t')
    WHERE column_name='v' AND segment_type='VARCHAR'
)
SELECT (count(*) FILTER (WHERE NOT before.dirty AND before.block_id=after.block_id
                                          AND before.block_offset=after.block_offset)
            = count(*) FILTER (WHERE NOT before.dirty)
        AND count(*) FILTER (WHERE NOT before.dirty)>0)::INTEGER,
       (SELECT count(*) FROM duckdb_logs
        WHERE contains(message, 'main.reuse_auto_t.1(VARCHAR)')
          AND starts_with(message, 'ColumnDataCheckpointer FinalAnalyze(')),
       (SELECT count(*) FROM reuse_auto_t
        WHERE v IS DISTINCT FROM CASE WHEN id<30720
            THEN concat('dense-', id::VARCHAR, '-', repeat(md5(id::VARCHAR), 2))
            ELSE concat('value-', id::VARCHAR, '-', repeat(md5(id::VARCHAR), 2)) END)
FROM reuse_auto_contiguous_before before
LEFT JOIN after_segments after USING (start, count)
----
1	1	0

# A fresh compact layout keeps two separated dirty segments as independent rewrite ranges.
statement ok
CREATE TABLE reuse_auto_disjoint_t(id BIGINT, v VARCHAR)

statement ok
INSERT INTO reuse_auto_disjoint_t
SELECT i, concat('value-', i::VARCHAR, '-', repeat(md5(i::VARCHAR), 2))
FROM range(122880) t(i)

statement ok
FORCE CHECKPOINT

statement ok
CREATE TABLE reuse_auto_disjoint_targets AS
WITH segments AS (
    SELECT start, count, row_number() OVER (ORDER BY start) AS segment_no,
           count(*) OVER () AS segment_count
    FROM pragma_storage_info('reuse_auto_disjoint_t')
    WHERE column_name='v' AND segment_type='VARCHAR'
)
SELECT start+count//2 AS id, segment_count
FROM segments
WHERE segment_no=1 OR segment_no=segment_count

query I
SELECT (count(*)=2 AND min(segment_count)>=3)::INTEGER
FROM reuse_auto_disjoint_targets
----
1

statement ok
CREATE TEMP TABLE reuse_auto_disjoint_before AS
SELECT start, count, block_id, block_offset,
       EXISTS (SELECT 1 FROM reuse_auto_disjoint_targets targets
               WHERE targets.id>=start AND targets.id<start+count) AS dirty
FROM pragma_storage_info('reuse_auto_disjoint_t')
WHERE column_name='v' AND segment_type='VARCHAR'

statement ok
CALL truncate_duckdb_logs()

statement ok
UPDATE reuse_auto_disjoint_t AS target
SET v=concat('point-', target.id::VARCHAR)
FROM reuse_auto_disjoint_targets changes
WHERE target.id=changes.id

statement ok
FORCE CHECKPOINT

query III
WITH after_segments AS (
    SELECT start, count, block_id, block_offset
    FROM pragma_storage_info('reuse_auto_disjoint_t')
    WHERE column_name='v' AND segment_type='VARCHAR'
)
SELECT (count(*) FILTER (WHERE NOT before.dirty AND before.block_id=after.block_id
                                          AND before.block_offset=after.block_offset)
            = count(*) FILTER (WHERE NOT before.dirty)
        AND count(*) FILTER (WHERE NOT before.dirty)>0)::INTEGER,
       (SELECT count(*) FROM duckdb_logs
        WHERE contains(message, 'main.reuse_auto_disjoint_t.1(VARCHAR)')
          AND starts_with(message, 'ColumnDataCheckpointer FinalAnalyze(')),
       (SELECT count(*) FROM reuse_auto_disjoint_t
        WHERE v IS DISTINCT FROM CASE
            WHEN id IN (SELECT id FROM reuse_auto_disjoint_targets) THEN concat('point-', id::VARCHAR)
            ELSE concat('value-', id::VARCHAR, '-', repeat(md5(id::VARCHAR), 2)) END)
FROM reuse_auto_disjoint_before before
LEFT JOIN after_segments after USING (start, count)
----
1	2	0

# AUTO can retain and rewrite ranges with different physical codecs.
statement ok
CREATE TABLE reuse_mixed_codec_t(id BIGINT, v UBIGINT)

statement ok
INSERT INTO reuse_mixed_codec_t SELECT i, hash(i) FROM range(122880) t(i)

statement ok
FORCE CHECKPOINT

statement ok
CREATE TABLE reuse_mixed_codec_target AS
SELECT start, count
FROM pragma_storage_info('reuse_mixed_codec_t')
WHERE column_name='v' AND segment_type='UBIGINT'
ORDER BY start
LIMIT 1

query I
SELECT (count(*)>1 AND count(DISTINCT compression)=1)::INTEGER
FROM pragma_storage_info('reuse_mixed_codec_t')
WHERE column_name='v' AND segment_type='UBIGINT'
----
1

statement ok
CREATE TEMP TABLE reuse_mixed_codec_before AS
SELECT start, count, block_id, block_offset,
       start=(SELECT start FROM reuse_mixed_codec_target) AS dirty
FROM pragma_storage_info('reuse_mixed_codec_t')
WHERE column_name='v' AND segment_type='UBIGINT'

statement ok
UPDATE reuse_mixed_codec_t
SET v=7
WHERE id>=(SELECT start FROM reuse_mixed_codec_target)
  AND id<(SELECT start+count FROM reuse_mixed_codec_target)

statement ok
FORCE CHECKPOINT

query IIII
WITH after_segments AS (
    SELECT start, count, block_id, block_offset, compression
    FROM pragma_storage_info('reuse_mixed_codec_t')
    WHERE column_name='v' AND segment_type='UBIGINT'
)
SELECT (count(*) FILTER (WHERE NOT before.dirty AND before.block_id=after.block_id
                                          AND before.block_offset=after.block_offset)
            = count(*) FILTER (WHERE NOT before.dirty)
        AND count(*) FILTER (WHERE NOT before.dirty)>0)::INTEGER,
       (SELECT count(DISTINCT compression) FROM after_segments),
       (SELECT count(*) FROM after_segments WHERE compression='Constant'),
       (SELECT count(*) FROM reuse_mixed_codec_t
        WHERE v IS DISTINCT FROM CASE
            WHEN id>=(SELECT start FROM reuse_mixed_codec_target)
             AND id<(SELECT start+count FROM reuse_mixed_codec_target) THEN 7::UBIGINT
            ELSE hash(id) END)
FROM reuse_mixed_codec_before before
LEFT JOIN after_segments after USING (start, count)
----
1	2	1	0

# A reused RLE prefix followed by a rewritten Constant segment keeps mixed-codec filtering safe.
statement ok
ATTACH '{TEST_DIR}/reuse_mixed_state.db' AS mixed_state_db (STORAGE_VERSION 'v1.2.0')

statement ok
CREATE TABLE mixed_state_db.reuse_clean_first_mixed_t(
    id BIGINT,
    v INTEGER USING COMPRESSION RLE)

statement ok
INSERT INTO mixed_state_db.reuse_clean_first_mixed_t SELECT i, i::INTEGER FROM range(122880) t(i)

statement ok
FORCE CHECKPOINT mixed_state_db

statement ok
DETACH mixed_state_db

statement ok
ATTACH '{TEST_DIR}/reuse_mixed_state.db' AS mixed_state_db

statement ok
CREATE TABLE reuse_clean_first_mixed_target AS
SELECT start, count
FROM pragma_storage_info('mixed_state_db.reuse_clean_first_mixed_t')
WHERE column_name='v' AND segment_type='INTEGER'
ORDER BY start DESC
LIMIT 1

query I
SELECT (count(*)>1 AND count(DISTINCT compression)=1
        AND min(compression)='RLE')::INTEGER
FROM pragma_storage_info('mixed_state_db.reuse_clean_first_mixed_t')
WHERE column_name='v' AND segment_type='INTEGER'
----
1

statement ok
UPDATE mixed_state_db.reuse_clean_first_mixed_t
SET v=-1
WHERE id>=(SELECT start FROM reuse_clean_first_mixed_target)
  AND id<(SELECT start+count FROM reuse_clean_first_mixed_target)

statement ok
FORCE CHECKPOINT mixed_state_db

query III
SELECT (count(DISTINCT compression)=2)::INTEGER,
       (count(*) FILTER (WHERE compression='Constant')>0)::INTEGER,
       (SELECT count(*)=(SELECT count FROM reuse_clean_first_mixed_target)
        FROM mixed_state_db.reuse_clean_first_mixed_t WHERE v=-1)::INTEGER
FROM pragma_storage_info('mixed_state_db.reuse_clean_first_mixed_t')
WHERE column_name='v' AND segment_type='INTEGER'
----
1	1	1

# A fully dirty column takes the original whole-column path.
statement ok
CREATE TEMP TABLE reuse_auto_full_before AS
SELECT block_id, block_offset
FROM pragma_storage_info('reuse_auto_t')
WHERE column_name='v' AND segment_type='VARCHAR'

statement ok
CALL truncate_duckdb_logs()

statement ok
UPDATE reuse_auto_t SET v=concat('full-', id::VARCHAR)

statement ok
FORCE CHECKPOINT

query III
SELECT (SELECT count(*)
        FROM reuse_auto_full_before before
        JOIN pragma_storage_info('reuse_auto_t') after USING (block_id, block_offset)
        WHERE after.column_name='v' AND after.segment_type='VARCHAR'),
       (SELECT count(*) FROM duckdb_logs
        WHERE contains(message, 'main.reuse_auto_t.1(VARCHAR)')
          AND starts_with(message, 'ColumnDataCheckpointer FinalAnalyze(')),
       (SELECT count(*) FROM reuse_auto_t WHERE v!=concat('full-', id::VARCHAR))
----
0	1	0

# Use stable multi-segment data to cover both sides of the local rewrite threshold.
statement ok
CREATE TABLE reuse_threshold_t(
    id BIGINT,
    v VARCHAR USING COMPRESSION UNCOMPRESSED)

statement ok
INSERT INTO reuse_threshold_t
SELECT i, concat('threshold-', i::VARCHAR, '-', repeat(md5(i::VARCHAR), 2))
FROM range(122880) t(i)

statement ok
FORCE CHECKPOINT

# A dense rewrite remains local while at least one eighth of the tuples can be reused.
statement ok
CREATE TEMP TABLE reuse_threshold_dense_boundary AS
SELECT max(start) AS boundary
FROM pragma_storage_info('reuse_threshold_t')
WHERE column_name='v' AND segment_type='VARCHAR' AND start<=98304

query I
SELECT ((SELECT boundary FROM reuse_threshold_dense_boundary)>=61440
        AND 122880-(SELECT boundary FROM reuse_threshold_dense_boundary)>=122880//8)::INTEGER
----
1

statement ok
CREATE TEMP TABLE reuse_threshold_dense_before AS
SELECT start, count, block_id, block_offset,
       start<(SELECT boundary FROM reuse_threshold_dense_boundary) AS dirty
FROM pragma_storage_info('reuse_threshold_t')
WHERE column_name='v' AND segment_type='VARCHAR'

statement ok
CALL truncate_duckdb_logs()

statement ok
UPDATE reuse_threshold_t
SET v=concat('dense-profit-', id::VARCHAR)
WHERE id<(SELECT boundary FROM reuse_threshold_dense_boundary)

statement ok
FORCE CHECKPOINT

query III
WITH after_segments AS (
    SELECT start, count, block_id, block_offset
    FROM pragma_storage_info('reuse_threshold_t')
    WHERE column_name='v' AND segment_type='VARCHAR'
)
SELECT (count(*) FILTER (WHERE NOT before.dirty AND before.block_id=after.block_id
                                          AND before.block_offset=after.block_offset)
            = count(*) FILTER (WHERE NOT before.dirty)
        AND count(*) FILTER (WHERE NOT before.dirty)>0)::INTEGER,
       (SELECT count(*) FROM duckdb_logs
        WHERE contains(message, 'main.reuse_threshold_t.1(VARCHAR)')
          AND starts_with(message, 'ColumnDataCheckpointer FinalAnalyze(')),
       (SELECT count(*) FROM reuse_threshold_t
        WHERE v IS DISTINCT FROM CASE
            WHEN id<(SELECT boundary FROM reuse_threshold_dense_boundary)
                THEN concat('dense-profit-', id::VARCHAR)
            ELSE concat('threshold-', id::VARCHAR, '-', repeat(md5(id::VARCHAR), 2)) END)
FROM reuse_threshold_dense_before before
LEFT JOIN after_segments after USING (start, count)
----
1	1	0

# Rewriting all but a suffix smaller than one eighth takes the whole-column path.
statement ok
CREATE TEMP TABLE reuse_threshold_small_suffix_boundary AS
SELECT max(start) AS boundary
FROM pragma_storage_info('reuse_threshold_t')
WHERE column_name='v' AND segment_type='VARCHAR'

query I
SELECT ((SELECT boundary FROM reuse_threshold_small_suffix_boundary)<122880
        AND 122880-(SELECT boundary FROM reuse_threshold_small_suffix_boundary)<122880//8)::INTEGER
----
1

statement ok
CREATE TEMP TABLE reuse_threshold_small_suffix_before AS
SELECT block_id, block_offset
FROM pragma_storage_info('reuse_threshold_t')
WHERE column_name='v' AND segment_type='VARCHAR'

statement ok
CALL truncate_duckdb_logs()

statement ok
UPDATE reuse_threshold_t
SET v=concat('dense-fallback-', id::VARCHAR)
WHERE id<(SELECT boundary FROM reuse_threshold_small_suffix_boundary)

statement ok
FORCE CHECKPOINT

query III
SELECT (SELECT count(*)
        FROM reuse_threshold_small_suffix_before before
        JOIN pragma_storage_info('reuse_threshold_t') after USING (block_id, block_offset)
        WHERE after.column_name='v' AND after.segment_type='VARCHAR'),
       (SELECT count(*) FROM duckdb_logs
        WHERE contains(message, 'main.reuse_threshold_t.1(VARCHAR)')
          AND starts_with(message, 'ColumnDataCheckpointer FinalAnalyze(')),
       (SELECT count(*) FROM reuse_threshold_t
        WHERE v IS DISTINCT FROM CASE
            WHEN id<(SELECT boundary FROM reuse_threshold_small_suffix_boundary)
                THEN concat('dense-fallback-', id::VARCHAR)
            ELSE concat('threshold-', id::VARCHAR, '-', repeat(md5(id::VARCHAR), 2)) END)
----
0	1	0

# A validity-only update preserves the complete base and independently rewrites validity.
statement ok
CREATE TABLE reuse_validity_t(id BIGINT, v VARCHAR)

statement ok
INSERT INTO reuse_validity_t
SELECT i, CASE WHEN i=60000 THEN repeat('x', 300000) ELSE concat('base-', i::VARCHAR) END
FROM range(122880) t(i)

statement ok
FORCE CHECKPOINT

statement ok
CREATE TEMP TABLE reuse_validity_only_before AS
SELECT start, count, block_id, block_offset
FROM pragma_storage_info('reuse_validity_t')
WHERE column_name='v' AND segment_type='VARCHAR'

statement ok
CALL truncate_duckdb_logs()

statement ok
UPDATE reuse_validity_t SET v=NULL WHERE id<30720

statement ok
FORCE CHECKPOINT

query IIIII
WITH after_segments AS (
    SELECT start, count, block_id, block_offset
    FROM pragma_storage_info('reuse_validity_t')
    WHERE column_name='v' AND segment_type='VARCHAR'
)
SELECT (count(*) FILTER (WHERE before.block_id=after.block_id
                           AND before.block_offset=after.block_offset)
            = (SELECT count(*) FROM reuse_validity_only_before))::INTEGER,
       (SELECT count(*) FROM duckdb_logs
        WHERE contains(message, 'main.reuse_validity_t.1(VARCHAR)')
          AND starts_with(message, 'ColumnDataCheckpointer FinalAnalyze(')),
       (SELECT count(*) FROM duckdb_logs
        WHERE contains(message, 'main.reuse_validity_t.0(VALIDITY)')
          AND starts_with(message, 'ColumnDataCheckpointer FinalAnalyze(')),
       (SELECT count(*) FROM reuse_validity_t WHERE v IS NULL),
       (SELECT count(*) FROM reuse_validity_t
        WHERE v IS DISTINCT FROM CASE WHEN id<30720 THEN NULL
            WHEN id=60000 THEN repeat('x', 300000) ELSE concat('base-', id::VARCHAR) END)
FROM reuse_validity_only_before before
LEFT JOIN after_segments after USING (start, count)
----
1	0	1	30720	0

# NULL-to-value updates rewrite the affected base range and retain its clean suffix.
statement ok
CREATE TEMP TABLE reuse_validity_restore_before AS
SELECT start, count, block_id, block_offset, start<30720 AS dirty
FROM pragma_storage_info('reuse_validity_t')
WHERE column_name='v' AND segment_type='VARCHAR'

statement ok
CALL truncate_duckdb_logs()

statement ok
UPDATE reuse_validity_t SET v=concat('restored-', id::VARCHAR) WHERE v IS NULL

statement ok
FORCE CHECKPOINT

query IIII
WITH after_segments AS (
    SELECT start, count, block_id, block_offset
    FROM pragma_storage_info('reuse_validity_t')
    WHERE column_name='v' AND segment_type='VARCHAR'
)
SELECT (count(*) FILTER (WHERE NOT before.dirty AND before.block_id=after.block_id
                                          AND before.block_offset=after.block_offset)
            = count(*) FILTER (WHERE NOT before.dirty)
        AND count(*) FILTER (WHERE NOT before.dirty)>0)::INTEGER,
       (SELECT count(*) FROM duckdb_logs
        WHERE contains(message, 'main.reuse_validity_t.1(VARCHAR)')
          AND starts_with(message, 'ColumnDataCheckpointer FinalAnalyze(')),
       (SELECT count(*) FROM duckdb_logs
        WHERE contains(message, 'main.reuse_validity_t.0(VALIDITY)')
          AND starts_with(message, 'ColumnDataCheckpointer FinalAnalyze(')),
       (SELECT count(*) FROM reuse_validity_t
        WHERE v IS DISTINCT FROM CASE WHEN id<30720 THEN concat('restored-', id::VARCHAR)
            WHEN id=60000 THEN repeat('x', 300000) ELSE concat('base-', id::VARCHAR) END)
FROM reuse_validity_restore_before before
LEFT JOIN after_segments after USING (start, count)
----
1	1	1	0

# RLE uses the same segment reuse plan without sharing mutable state.
statement ok
CREATE TABLE reuse_rle_t(
    id BIGINT,
    v INTEGER USING COMPRESSION RLE)

statement ok
INSERT INTO reuse_rle_t SELECT i, i::INTEGER FROM range(122880) t(i)

statement ok
FORCE CHECKPOINT

statement ok
CREATE TEMP TABLE reuse_rle_before AS
SELECT start, count, block_id, block_offset,
       start<=60000 AND start+count>60000 AS dirty
FROM pragma_storage_info('reuse_rle_t')
WHERE column_name='v' AND segment_type='INTEGER'

statement ok
UPDATE reuse_rle_t SET v=v+1 WHERE id=60000

statement ok
FORCE CHECKPOINT

query II
WITH after_segments AS (
    SELECT start, count, block_id, block_offset
    FROM pragma_storage_info('reuse_rle_t')
    WHERE column_name='v' AND segment_type='INTEGER'
)
SELECT (count(*) FILTER (WHERE NOT before.dirty AND before.block_id=after.block_id
                                          AND before.block_offset=after.block_offset)
            = count(*) FILTER (WHERE NOT before.dirty)
        AND count(*) FILTER (WHERE NOT before.dirty)>0)::INTEGER,
       (SELECT count(*) FROM reuse_rle_t
        WHERE v IS DISTINCT FROM id::INTEGER + CASE WHEN id=60000 THEN 1 ELSE 0 END)
FROM reuse_rle_before before
LEFT JOIN after_segments after USING (start, count)
----
1	0

# A global force setting retains the original whole-column behavior.
statement ok
CREATE TABLE reuse_force_t(id BIGINT, v BIGINT)

statement ok
INSERT INTO reuse_force_t SELECT i, i//64 FROM range(122880) t(i)

statement ok
FORCE CHECKPOINT

statement ok
CREATE TEMP TABLE reuse_force_before AS
SELECT block_id, block_offset
FROM pragma_storage_info('reuse_force_t')
WHERE column_name='v' AND segment_type='BIGINT'

statement ok
SET force_compression='rle'

statement ok
UPDATE reuse_force_t SET v=-1 WHERE id=60000

statement ok
FORCE CHECKPOINT

query II
SELECT (SELECT count(*)
        FROM reuse_force_before before
        JOIN pragma_storage_info('reuse_force_t') after USING (block_id, block_offset)
        WHERE after.column_name='v' AND after.segment_type='BIGINT'),
       (SELECT count(*) FROM reuse_force_t
        WHERE v IS DISTINCT FROM CASE WHEN id=60000 THEN -1 ELSE id//64 END)
----
0	0

statement ok
RESET force_compression

# Empty validity means the base owns NULL information and disables reuse.
statement ok
ATTACH '{TEST_DIR}/reuse_empty_validity.db' AS empty_db (STORAGE_VERSION 'v1.3.0', BLOCK_SIZE 16384)

statement ok
SET force_compression='dict_fsst'

statement ok
CREATE TABLE empty_db.reuse_empty_t(id BIGINT, v VARCHAR)

statement ok
INSERT INTO empty_db.reuse_empty_t
SELECT i, CASE WHEN i=1000 THEN NULL ELSE concat('value-', (i%4)::VARCHAR) END
FROM range(122880) t(i)

statement ok
FORCE CHECKPOINT empty_db

statement ok
RESET force_compression

query II
SELECT (count(*) FILTER (WHERE segment_type='VARCHAR' AND compression='DICT_FSST')
            = count(*) FILTER (WHERE segment_type='VARCHAR')
        AND count(*) FILTER (WHERE segment_type='VARCHAR')>0)::INTEGER,
       count(*) FILTER (WHERE segment_type='VALIDITY' AND compression='Empty Validity')
FROM pragma_storage_info('empty_db.reuse_empty_t')
----
1	1

statement ok
CREATE TEMP TABLE reuse_empty_before AS
SELECT block_id, block_offset
FROM pragma_storage_info('empty_db.reuse_empty_t')
WHERE column_name='v' AND segment_type='VARCHAR'

statement ok
UPDATE empty_db.reuse_empty_t SET v=NULL WHERE id=1

statement ok
FORCE CHECKPOINT empty_db

query III
SELECT (SELECT count(*)
        FROM reuse_empty_before before
        JOIN pragma_storage_info('empty_db.reuse_empty_t') after USING (block_id, block_offset)
        WHERE after.column_name='v' AND after.segment_type='VARCHAR'),
       (SELECT count(*) FROM empty_db.reuse_empty_t WHERE v IS NULL),
       (SELECT count(*) FROM empty_db.reuse_empty_t
        WHERE v IS DISTINCT FROM CASE WHEN id IN (1, 1000) THEN NULL
                                      ELSE concat('value-', (id%4)::VARCHAR) END)
----
0	2	0

# Parallel RowGroups keep base and validity decisions local to each checkpoint task.
statement ok
SET threads=8

statement ok
CREATE TABLE reuse_parallel_t(id BIGINT, v VARCHAR)

statement ok
INSERT INTO reuse_parallel_t
SELECT i, concat('parallel-', i::VARCHAR, '-', repeat(md5(i::VARCHAR), 2))
FROM range(983040) t(i)

statement ok
FORCE CHECKPOINT

statement ok
CREATE TEMP TABLE reuse_parallel_validity_before AS
SELECT row_group_id, start, count, block_id, block_offset
FROM pragma_storage_info('reuse_parallel_t')
WHERE column_name='v' AND segment_type='VARCHAR'

statement ok
UPDATE reuse_parallel_t SET v=NULL WHERE id%122880=1

statement ok
FORCE CHECKPOINT

query III
WITH after_segments AS (
    SELECT row_group_id, start, count, block_id, block_offset
    FROM pragma_storage_info('reuse_parallel_t')
    WHERE column_name='v' AND segment_type='VARCHAR'
)
SELECT (count(*) FILTER (WHERE before.block_id=after.block_id
                           AND before.block_offset=after.block_offset)
            = (SELECT count(*) FROM reuse_parallel_validity_before))::INTEGER,
       (SELECT count(*) FROM reuse_parallel_t WHERE v IS NULL),
       (SELECT count(*) FROM reuse_parallel_t
        WHERE v IS DISTINCT FROM CASE WHEN id%122880=1 THEN NULL
            ELSE concat('parallel-', id::VARCHAR, '-', repeat(md5(id::VARCHAR), 2)) END)
FROM reuse_parallel_validity_before before
LEFT JOIN after_segments after USING (row_group_id, start, count)
----
1	8	0

statement ok
SET threads=32

statement ok
CREATE TEMP TABLE reuse_parallel_restore_before AS
WITH starts AS (
    SELECT row_group_id, start, count, block_id, block_offset,
           start-min(start) OVER (PARTITION BY row_group_id) AS local_start
    FROM pragma_storage_info('reuse_parallel_t')
    WHERE column_name='v' AND segment_type='VARCHAR'
)
SELECT *, local_start<=1 AND local_start+count>1 AS dirty FROM starts

statement ok
CALL truncate_duckdb_logs()

statement ok
UPDATE reuse_parallel_t SET v=concat('changed-', id::VARCHAR) WHERE v IS NULL

statement ok
FORCE CHECKPOINT

query IIIII
WITH after_segments AS (
    SELECT row_group_id, start, count, block_id, block_offset
    FROM pragma_storage_info('reuse_parallel_t')
    WHERE column_name='v' AND segment_type='VARCHAR'
)
SELECT (count(*) FILTER (WHERE NOT before.dirty AND before.block_id=after.block_id
                                          AND before.block_offset=after.block_offset)
            = count(*) FILTER (WHERE NOT before.dirty)
        AND count(*) FILTER (WHERE NOT before.dirty)>0)::INTEGER,
       count(DISTINCT before.row_group_id),
       (SELECT count(*) FROM duckdb_logs
        WHERE contains(message, 'main.reuse_parallel_t.1(VARCHAR)')
          AND starts_with(message, 'ColumnDataCheckpointer FinalAnalyze(')),
       (SELECT count(*) FROM duckdb_logs
        WHERE contains(message, 'main.reuse_parallel_t.0(VALIDITY)')
          AND starts_with(message, 'ColumnDataCheckpointer FinalAnalyze(')),
       (SELECT count(*) FROM reuse_parallel_t
        WHERE v IS DISTINCT FROM CASE WHEN id%122880=1 THEN concat('changed-', id::VARCHAR)
            ELSE concat('parallel-', id::VARCHAR, '-', repeat(md5(id::VARCHAR), 2)) END)
FROM reuse_parallel_restore_before before
LEFT JOIN after_segments after USING (row_group_id, start, count)
----
1	8	8	8	0

# An aborted checkpoint does not publish partial base or validity rewrites.
statement ok
CREATE TABLE reuse_abort_t(id BIGINT, v VARCHAR)

statement ok
INSERT INTO reuse_abort_t SELECT i, concat('abort-', i::VARCHAR) FROM range(122880) t(i)

statement ok
FORCE CHECKPOINT

statement ok
UPDATE reuse_abort_t SET v=NULL WHERE id=1

statement ok
UPDATE reuse_abort_t SET v='changed' WHERE id=90000

statement ok
PRAGMA disable_checkpoint_on_shutdown

statement ok
PRAGMA debug_checkpoint_abort='before_header'

statement error
FORCE CHECKPOINT
----
Checkpoint aborted before header write

restart

statement ok
ATTACH '{TEST_DIR}/reuse_fragment_guard.db' AS fragment_db

statement ok
ATTACH '{TEST_DIR}/reuse_mixed_state.db' AS mixed_state_db

statement ok
ATTACH '{TEST_DIR}/reuse_shared_block.db' AS shared_db

statement ok
ATTACH '{TEST_DIR}/reuse_range_gate.db' AS range_gate_db

statement ok
PRAGMA debug_checkpoint_abort='none'

statement ok
SET checkpoint_threshold='9999GB'

statement ok
SET debug_verify_blocks=true

statement ok
FORCE CHECKPOINT

statement ok
FORCE CHECKPOINT shared_db

statement ok
FORCE CHECKPOINT range_gate_db

query II
SELECT (SELECT count(*) FROM range_gate_db.reuse_pipeline_gate_t
WHERE v IS DISTINCT FROM CASE
    WHEN id IN (SELECT id FROM range_gate_db.reuse_pipeline_gate_targets) THEN -id-1
    ELSE id END),
       (SELECT count(*) FROM range_gate_db.reuse_layout_gate_t
        WHERE v IS DISTINCT FROM CASE
            WHEN id=(SELECT id FROM range_gate_db.reuse_layout_gate_target) THEN repeat('z',64)
            WHEN id<32768 THEN 'x' ELSE repeat('y',64) END)
----
0	0

query II
SELECT count(*) FILTER (WHERE v IS NULL),
       count(*) FILTER (WHERE v IS DISTINCT FROM CASE WHEN id=1 THEN NULL
           WHEN id=90000 THEN 'changed' ELSE concat('abort-', id::VARCHAR) END)
FROM reuse_abort_t
----
1	0

query I
SELECT count(*) FROM reuse_tiny_row_group_t
WHERE v IS DISTINCT FROM CASE id
    WHEN 0 THEN NULL WHEN 1 THEN 11 WHEN 2 THEN NULL ELSE 30 END
----
0

# Reused blocks, compacted layouts, overflow data, and validity changes remain correct after recovery.
query IIIII
SELECT (SELECT count(*) FROM reuse_numeric_t
        WHERE v IS DISTINCT FROM CASE WHEN id=60000 THEN id+1 ELSE id END),
       (SELECT count(*) FROM reuse_validity_t
        WHERE v IS DISTINCT FROM CASE WHEN id<30720 THEN concat('restored-', id::VARCHAR)
            WHEN id=60000 THEN repeat('x', 300000) ELSE concat('base-', id::VARCHAR) END),
       (SELECT count(*) FROM reuse_parallel_t
        WHERE v IS DISTINCT FROM CASE WHEN id%122880=1 THEN concat('changed-', id::VARCHAR)
            ELSE concat('parallel-', id::VARCHAR, '-', repeat(md5(id::VARCHAR), 2)) END),
       (SELECT count(*) FROM fragment_db.reuse_fragment_guard_t
        WHERE v IS DISTINCT FROM CASE
            WHEN id IN (SELECT id FROM fragment_db.reuse_fragment_post_target)
                THEN md5(concat('post-', id::VARCHAR))
                  || md5(concat('post-tail-', id::VARCHAR))
            WHEN id IN (SELECT id FROM fragment_db.reuse_fragment_guarded_targets)
                THEN md5(concat('guarded-', id::VARCHAR))
                  || md5(concat('guarded-tail-', id::VARCHAR))
            ELSE md5(id::VARCHAR) || md5((id+1)::VARCHAR) END),
       (SELECT count(*) FROM fragment_db.reuse_fragment_parallel_t
        WHERE v IS DISTINCT FROM CASE
            WHEN id IN (SELECT id FROM fragment_db.reuse_fragment_parallel_targets)
                THEN md5(concat('parallel-', id::VARCHAR))
                  || md5(concat('parallel-tail-', id::VARCHAR))
            ELSE md5((id%122880)::VARCHAR) || md5(((id%122880)+1)::VARCHAR) END)
----
0	0	0	0	0

# Segment and global statistics remain safe for equality pruning after validity changes.
query II
SELECT count(*) FILTER (WHERE v='base-90000'),
       count(*) FILTER (WHERE v='restored-2')
FROM reuse_validity_t
----
1	1

query II
SELECT (SELECT count(*) FROM shared_db.reuse_shared_block_t
        WHERE v IS DISTINCT FROM CASE
            WHEN id IN (SELECT id FROM reuse_shared_block_targets WHERE dirty) THEN -1
            ELSE (((id%122880)*100000)//122880)::INTEGER END),
       (SELECT (count(*) FILTER (WHERE before.block_id=after.block_id
                                  AND before.block_offset=after.block_offset)=count(*))::INTEGER
        FROM reuse_shared_block_before before
        LEFT JOIN (SELECT row_group_id, start, count, block_id, block_offset
                   FROM pragma_storage_info('shared_db.reuse_shared_block_t')
                   WHERE column_name='v' AND segment_type='INTEGER') after
          USING (row_group_id, start, count)
        WHERE NOT before.dirty)
----
0	1

query III
SELECT (SELECT count(*) FROM reuse_mixed_codec_t
        WHERE v IS DISTINCT FROM CASE
            WHEN id>=(SELECT start FROM reuse_mixed_codec_target)
             AND id<(SELECT start+count FROM reuse_mixed_codec_target) THEN 7::UBIGINT
            ELSE hash(id) END),
       (SELECT (count(DISTINCT compression)>1)::INTEGER
        FROM pragma_storage_info('reuse_mixed_codec_t')
        WHERE column_name='v' AND segment_type='UBIGINT'),
       (SELECT (count(*)>0)::INTEGER
        FROM pragma_storage_info('reuse_mixed_codec_t')
        WHERE column_name='v' AND segment_type='UBIGINT' AND compression='Constant')
----
0	1	1

query II
SELECT (SELECT count(*)=(SELECT count FROM reuse_clean_first_mixed_target)
        FROM mixed_state_db.reuse_clean_first_mixed_t WHERE v=-1)::INTEGER,
       (SELECT (count(DISTINCT compression)=2)::INTEGER
        FROM pragma_storage_info('mixed_state_db.reuse_clean_first_mixed_t')
        WHERE column_name='v' AND segment_type='INTEGER')
----
1	1
