# name: test/sql/storage/mix/updates_deletes_persistent_segments.test
# description: Test updates/deletes/insertions on persistent segments
# group: [mix]

# load the DB from disk
load __TEST_DIR__/updates_deletes_persistent_segments.db

statement ok
CREATE TABLE test(a INTEGER, b INTEGER);

statement ok
INSERT INTO test VALUES (1, 3), (NULL, NULL)

# reload the database from disk
restart

query II
SELECT * FROM test ORDER BY a
----
1	3
NULL	NULL

statement ok
INSERT INTO test VALUES (2, 2)

query II
SELECT * FROM test ORDER BY a
----
1	3
2	2
NULL	NULL

restart

query II
SELECT * FROM test ORDER BY a
----
1	3
2	2
NULL	NULL

statement ok
INSERT INTO test VALUES (3, 3)

statement ok
UPDATE test SET b=4 WHERE a=1

query II
SELECT * FROM test ORDER BY a
----
1	4
2	2
3	3
NULL	NULL

restart

query II
SELECT * FROM test ORDER BY a
----
1	4
2	2
3	3
NULL	NULL

statement ok
UPDATE test SET a=4, b=4 WHERE a=1

query II
SELECT * FROM test ORDER BY a
----
2	2
3	3
4	4
NULL	NULL

restart

query II
SELECT * FROM test ORDER BY a
----
2	2
3	3
4	4
NULL	NULL

statement ok
UPDATE test SET b=5, a=6 WHERE a=4

statement ok
DELETE FROM test WHERE a=2

query II
SELECT * FROM test ORDER BY a
----
3	3
6	5
NULL	NULL

restart

query II
SELECT * FROM test ORDER BY a
----
3	3
6	5
NULL	NULL

statement ok
UPDATE test SET b=7 WHERE a=3

query II
SELECT * FROM test ORDER BY a
----
3	7
6	5
NULL	NULL

restart

query II
SELECT * FROM test ORDER BY a
----
3	7
6	5
NULL	NULL
