# name: test/sql/parser/function_chaining.test
# description: Test function chaining
# group: [parser]

statement ok
CREATE TABLE varchars(v VARCHAR);

statement ok
INSERT INTO varchars VALUES ('Hello'), ('World')

statement error
SELECT x.lower() FROM varchars
----
not found in FROM clause

# conflict
statement error
SELECT main.lower() FROM varchars AS t(main)
----
No function matches the given name and argument types

query I
SELECT v.lower() FROM varchars
----
hello
world

query I
SELECT (v).lower() FROM varchars
----
hello
world

statement error
SELECT v.lowe() FROM varchars
----
Function with name lowe does not exist

query I
SELECT varchars.v.lower() FROM varchars
----
hello
world

query I
SELECT v.lower().upper() FROM varchars
----
HELLO
WORLD

query I
SELECT v.lower()[:3] FROM varchars
----
hel
wor

query I
SELECT v.lower()[:3] FROM varchars
----
hel
wor

statement ok
DELETE FROM varchars

statement ok
INSERT INTO varchars VALUES ('Hello World');

# list functions
query I
SELECT v.split(' ') FROM varchars
----
[Hello, World]

query I
SELECT v.split(' ').apply(lambda x: x.lower()) FROM varchars
----
[hello, world]

query I
SELECT v.split(' ').apply(lambda x: x.lower()).filter(lambda x: x[1] == 'h') FROM varchars
----
[hello]

query I
SELECT v.split(' ').length() FROM varchars
----
2

# list aggr
query I
SELECT v.split(' ').aggregate('count') FROM varchars
----
2

query I
SELECT v.split(' ').aggregate('min') FROM varchars
----
Hello

# prepared statements
statement ok
PREPARE v1 AS SELECT ?.split(' ')[1].lower()

query I
EXECUTE v1('Hello World')
----
hello

# Issue #17788: parser-level rewrites must apply through dot-chaining as well.
# These functions (coalesce, ifnull, if, try, construct_array, date, unpack) have no
# scalar-function counterpart, so x.<name>(...) must be rewritten the same way as <name>(x, ...).

query I
SELECT col.ifnull('b') FROM (SELECT 'a' AS col)
----
a

query I
SELECT col.ifnull('b') FROM (SELECT NULL::VARCHAR AS col)
----
b

query I
SELECT col.coalesce('b') FROM (SELECT 'a' AS col)
----
a

query I
SELECT col.coalesce('b', 'c') FROM (SELECT NULL::VARCHAR AS col)
----
b

# col.len() = 1, then 1.coalesce('b') = 1 (cast to first non-null result type)
query I
SELECT col.len().coalesce(99) FROM (SELECT 'a' AS col)
----
1

# Wrong number of arguments to IFNULL must error consistently in both paths.
statement error
SELECT col.ifnull('a', 'b') FROM (SELECT 'a' AS col)
----
Wrong number of arguments to IFNULL

statement error
SELECT col.len().ifnull('b','c') FROM (SELECT 'a' AS col)
----
Wrong number of arguments to IFNULL

# Other parser-level rewrites should also work through dot-chaining.
query I
SELECT (TRUE).if(1, 2)
----
1

query I
SELECT (FALSE).if(1, 2)
----
2

query I
SELECT ('2024-01-15').date()
----
2024-01-15
