# name: test/sql/storage/types/test_unsigned_storage.test
# description: Test unsigned types with persistent storage
# group: [types]

# load the DB from disk
load __TEST_DIR__/unsigned_storage_test.db

statement ok
PRAGMA preserve_insertion_order = false

statement ok
PRAGMA force_row_group_replacement = true

# create a table with all unsigned types
statement ok
CREATE TABLE unsigned (a utinyint, b usmallint, c uinteger, d ubigint);

statement ok
INSERT INTO unsigned VALUES (1,1,1,1), (42,42,42,42), (NULL,NULL,NULL,NULL), (255,65535,4294967295,18446744073709551615);

# reload the database from disk a few times, and check that the data is still there
loop i 0 2

restart

statement ok
PRAGMA preserve_insertion_order = false

statement ok
PRAGMA force_row_group_replacement = true

query IIII
SELECT * FROM unsigned
----
1	1	1	1
42	42	42	42
255	65535	4294967295	18446744073709551615
NULL	NULL	NULL	NULL

query IIII
SELECT * FROM unsigned WHERE a = 42
----
42	42	42	42

query I
SELECT a FROM unsigned WHERE a < 10 ORDER BY 1;
----
1

query IIII
SELECT * FROM unsigned WHERE b = 42
----
42	42	42	42

query I
SELECT b FROM unsigned WHERE b < 10 ORDER BY 1;
----
1

query IIII
SELECT * FROM unsigned WHERE c = 42
----
42	42	42	42

query I
SELECT c FROM unsigned WHERE c < 10 ORDER BY 1;
----
1

query IIII
SELECT * FROM unsigned WHERE d = 42
----
42	42	42	42

query I
SELECT d FROM unsigned WHERE d < 10 ORDER BY 1;
----
1

endloop

statement ok
UPDATE unsigned
SET a = 10, b = 9, c = 8, d = 7
WHERE a = 1;

query IIII
SELECT * FROM unsigned
----
10	9	8	7
42	42	42	42
255	65535	4294967295	18446744073709551615
NULL	NULL	NULL	NULL

restart

statement ok
PRAGMA preserve_insertion_order = false

statement ok
PRAGMA force_row_group_replacement = true

query IIII
SELECT * FROM unsigned
----
10	9	8	7
42	42	42	42
255	65535	4294967295	18446744073709551615
NULL	NULL	NULL	NULL