# name: test/sql/update/test_big_table_update.test_slow
# description: Update big table of even and odd values
# group: [update]

statement ok
CREATE TABLE test AS SELECT * FROM range (0, 31745, 1) t1(i);

query II
SELECT COUNT(i), SUM(i) FROM test
----
31745	503856640

statement ok
UPDATE test SET i=i+1

query II
SELECT COUNT(i), SUM(i) FROM test
----
31745	503888385

statement ok
UPDATE test SET i=i+1

query II
SELECT COUNT(i), SUM(i) FROM test
----
31745	503920130
