# name: test/sql/update/test_repeated_string_update.test
# description: Test repeated update of string in same segment
# group: [update]

# create a table
statement ok con1
CREATE TABLE test (a VARCHAR);

statement ok con1
INSERT INTO test VALUES ('hello'), ('world')

statement ok con2
BEGIN TRANSACTION;

# scan the table
query T con1
SELECT * FROM test ORDER BY a
----
hello
world

query T con2
SELECT * FROM test ORDER BY a
----
hello
world

# test a number of repeated updates
statement ok con1
UPDATE test SET a='test' WHERE a='hello';

query T con1
SELECT * FROM test ORDER BY a
----
test
world

statement ok con1
UPDATE test SET a='test2' WHERE a='world';

query T con1
SELECT * FROM test ORDER BY a
----
test
test2

query T con2
SELECT * FROM test ORDER BY a
----
hello
world

statement ok con2
COMMIT;

query T con1
SELECT * FROM test ORDER BY a
----
test
test2

