# name: test/sql/update/update_from_multi_match.test
# description: UPDATE ... FROM updates each target row at most once when matched by multiple source rows
# group: [update]

# ── basic multi-match: one target row, many source matches ──────────────────────
statement ok
CREATE TABLE t (id INTEGER, v INTEGER);

statement ok
INSERT INTO t VALUES (1, 0);

statement ok
CREATE TABLE s (id INTEGER, v INTEGER);

statement ok
INSERT INTO s VALUES (1, 10), (1, 20), (1, 30);

statement ok
UPDATE t SET v = s.v FROM s WHERE t.id = s.id;

# the single row is updated exactly once to one of the matching values
query I
SELECT count(*) FROM t;
----
1

query I
SELECT v IN (10, 20, 30) FROM t;
----
true

# ── every target row updated once, none dropped or duplicated ───────────────────
statement ok
CREATE TABLE t2 (id INTEGER, v INTEGER);

statement ok
INSERT INTO t2 SELECT i, -1 FROM range(1, 2000) tbl(i);

statement ok
CREATE TABLE s2 (id INTEGER, v INTEGER);

# two source matches for every target id (cross-chunk: ~4000 join rows)
statement ok
INSERT INTO s2 SELECT i, i * 10 FROM range(1, 2000) tbl(i);

statement ok
INSERT INTO s2 SELECT i, i * 100 FROM range(1, 2000) tbl(i);

statement ok
UPDATE t2 SET v = s2.v FROM s2 WHERE t2.id = s2.id;

# same number of rows, every row updated exactly once to one of its two matches
query I
SELECT count(*) FROM t2;
----
1999

query I
SELECT count(*) FROM t2 WHERE v = id * 10 OR v = id * 100;
----
1999

query I
SELECT count(*) FROM t2 WHERE v = -1;
----
0

# ── RETURNING yields one row per updated target, not one per match ───────────────
statement ok
CREATE TABLE t3 (id INTEGER, v INTEGER);

statement ok
INSERT INTO t3 VALUES (1, 0), (2, 0);

statement ok
CREATE TABLE s3 (id INTEGER, v INTEGER);

statement ok
INSERT INTO s3 VALUES (1, 11), (1, 12), (2, 21), (2, 22);

query I rowsort
UPDATE t3 SET v = s3.v FROM s3 WHERE t3.id = s3.id RETURNING id;
----
1
2

# ── reported row count reflects rows actually updated, not the number of join matches ──
statement ok
CREATE TABLE tcnt (id INTEGER, v INTEGER);

statement ok
INSERT INTO tcnt VALUES (1, 0);

statement ok
CREATE TABLE scnt (id INTEGER, v INTEGER);

statement ok
INSERT INTO scnt VALUES (1, 10), (1, 20), (1, 30);

# 3 join matches, 1 target row updated -> reports 1 (matches PostgreSQL's "UPDATE 1")
query I
UPDATE tcnt SET v = scnt.v FROM scnt WHERE tcnt.id = scnt.id;
----
1

# two target rows, each matched twice -> reports 2
statement ok
CREATE TABLE tcnt2 (id INTEGER, v INTEGER);

statement ok
INSERT INTO tcnt2 VALUES (1, 0), (2, 0);

statement ok
CREATE TABLE scnt2 (id INTEGER, v INTEGER);

statement ok
INSERT INTO scnt2 VALUES (1, 11), (1, 12), (2, 21), (2, 22);

query I
UPDATE tcnt2 SET v = scnt2.v FROM scnt2 WHERE tcnt2.id = scnt2.id;
----
2

# del+insert path reports the distinct count too (this over-count existed before dedup was unified)
statement ok
SET force_update_to_del_and_insert = true;

query I
UPDATE tcnt2 SET v = scnt2.v FROM scnt2 WHERE tcnt2.id = scnt2.id;
----
2

statement ok
SET force_update_to_del_and_insert = false;

# plain UPDATE (no FROM) still reports every affected row
query I
UPDATE tcnt2 SET v = v + 1;
----
2

# ── self-join multi-match: each row still updated once ──────────────────────────
statement ok
CREATE TABLE t_self (id INTEGER, v INTEGER);

statement ok
INSERT INTO t_self VALUES (1, 5), (1, 6), (2, 7);

# id=1 has two rows; joining on id makes each id=1 row match two partners
statement ok
UPDATE t_self SET v = o.v FROM t_self o WHERE t_self.id = o.id;

query I
SELECT count(*) FROM t_self;
----
3

# ── forced del+insert path deduplicates identically across chunks ────────────────
statement ok
SET force_update_to_del_and_insert = true;

statement ok
CREATE TABLE t5 (id INTEGER, v INTEGER);

statement ok
INSERT INTO t5 SELECT i, -1 FROM range(1, 2000) tbl(i);

statement ok
CREATE TABLE s5 (id INTEGER, v INTEGER);

statement ok
INSERT INTO s5 SELECT i, i * 10 FROM range(1, 2000) tbl(i);

statement ok
INSERT INTO s5 SELECT i, i * 100 FROM range(1, 2000) tbl(i);

statement ok
UPDATE t5 SET v = s5.v FROM s5 WHERE t5.id = s5.id;

query I
SELECT count(*) FROM t5;
----
1999

query I
SELECT count(*) FROM t5 WHERE v = id * 10 OR v = id * 100;
----
1999

statement ok
SET force_update_to_del_and_insert = false;

# ── zero matches: nothing updated, no error ─────────────────────────────────────
statement ok
CREATE TABLE t6 (id INTEGER, v INTEGER);

statement ok
INSERT INTO t6 VALUES (1, 100);

statement ok
CREATE TABLE s6 (id INTEGER, v INTEGER);

statement ok
INSERT INTO s6 VALUES (2, 1), (3, 2);

statement ok
UPDATE t6 SET v = s6.v FROM s6 WHERE t6.id = s6.id;

query I
SELECT v FROM t6;
----
100

# ── del+insert path (LIST column forces del+insert) dedups the same way ──────────
statement ok
CREATE TABLE t4 (id INTEGER, v INTEGER[]);

statement ok
INSERT INTO t4 VALUES (1, [0]);

statement ok
CREATE TABLE s4 (id INTEGER, v INTEGER[]);

statement ok
INSERT INTO s4 VALUES (1, [10]), (1, [20]);

statement ok
UPDATE t4 SET v = s4.v FROM s4 WHERE t4.id = s4.id;

query I
SELECT count(*) FROM t4;
----
1

query I
SELECT len(v) FROM t4;
----
1
