# name: test/sql/storage/checkpoint_abort_after_free_list.test_slow
# description: Test correct behavior if we unexpectedly abort after a checkpoint right after the free list is written
# group: [storage]

require skip_reload

load __TEST_DIR__/checkpoint_abort.db

statement ok
CREATE TABLE integers AS SELECT * FROM range(100000) tbl(i);

statement ok
CHECKPOINT;

statement ok
PRAGMA disable_checkpoint_on_shutdown;

statement ok
PRAGMA wal_autocheckpoint='1TB';

statement ok
PRAGMA debug_checkpoint_abort='after_free_list_write';

statement ok
INSERT INTO integers SELECT * FROM range(100000, 200000) tbl(i);

statement error
CHECKPOINT;
----

restart

# verify that the change was correctly loaded from disk
query III
SELECT MIN(i), MAX(i), COUNT(*) FROM integers;
----
0	199999	200000

# now verify that empty blocks left by a checkpoint aborts are re-used
# so that checkpoint aborts don't permanently leave holes in the file

loop i 0 10

statement ok
PRAGMA disable_checkpoint_on_shutdown;

statement ok
PRAGMA wal_autocheckpoint='1TB';

statement ok
PRAGMA debug_checkpoint_abort='after_free_list_write';

statement ok
UPDATE integers SET i=i;

statement error
CHECKPOINT;
----

restart

# verify that the change was correctly loaded from disk
query III
SELECT MIN(i), MAX(i), COUNT(*) FROM integers;
----
0	199999	200000

# ensure that the expected total storage size is the same as in the first iteration of the loop

query I nosort expected_blocks
SELECT total_blocks FROM pragma_database_size();

endloop
