# name: test/sql/storage/checkpoint_exactly_morsel_size.test_slow
# description: Run a checkpoint on a table that is exactly morsel size
# group: [storage]

load __TEST_DIR__/checkpoint_morsel_size.db

statement ok
CREATE TABLE integers AS SELECT * FROM range(1024*100*8) tbl(i);

statement ok
CHECKPOINT;

query III
SELECT min(i), max(i), count(i) from integers;
----
0	819199	819200

statement ok
UPDATE integers SET i=i+1;

query III
SELECT min(i), max(i), count(i) from integers;
----
1	819200	819200

restart

query III
SELECT min(i), max(i), count(i) from integers;
----
1	819200	819200

statement ok
DELETE FROM integers WHERE i<=1000

query III
SELECT min(i), max(i), count(i) from integers;
----
1001	819200	818200
