# name: test/sql/storage/scan_target_size_bytes_memory.test_slow
# description: scan_target_size_bytes bounds peak scan memory: the same query OOMs with the feature off and succeeds with it on
# group: [storage]

# Correctness of the sub-batched scan lives in scan_target_size_bytes.test; this file only covers the
# memory bound, which needs multi-hundred-MB blob tables and is therefore slow.
#
# Each TC pairs a negative guard (feature off -> OOM) with the same query succeeding once the feature is
# on. Every one of them sets max_temp_directory_size='0B': otherwise the buffer manager may evict blob
# blocks to the temp directory instead of failing, and whether the guard OOMs would depend on eviction
# timing rather than on the byte budget.

require noforcestorage

# byte-budgeted sub-batching only engages when a full 2048-row vector is large enough to OOM
require vector_size 2048

# large-BLOB tables (hundreds of MB) exceed the 32-bit address space
require 64bit

# ============================================================
# TC1: Plain scan path (no filters, no deletes, no pending updates)
# ============================================================

load {TEST_DIR}/scan_target_oom.db

statement ok
CREATE TABLE t_oom AS SELECT i, repeat(chr((65 + (i % 26))::INTEGER), 50000) as blob_data FROM range(0, 2048) tbl(i)

restart

statement ok
PRAGMA threads=1

statement ok
SET memory_limit='15MB'

statement ok
SET max_temp_directory_size='0B'

# Disabled: full vector of 50KB blobs needs ~100MB → OOM with 15MB limit
statement ok
SET scan_target_size_bytes=0

statement error
SELECT SUM(LENGTH(blob_data)) FROM t_oom
----
Out of Memory

# Enable adaptive scan: predictor estimates ~20 rows per 1MB target → fits in 15MB.
# Same query as the disabled case above — the only change is scan_target_size_bytes.
statement ok
SET scan_target_size_bytes=1048576

query I
SELECT SUM(LENGTH(blob_data)) FROM t_oom
----
102400000

# Verify content correctness under memory pressure
query II
SELECT i, LEFT(blob_data, 3) FROM t_oom WHERE i = 25
----
25	ZZZ

query I
SELECT COUNT(DISTINCT LEFT(blob_data, 1)) FROM t_oom
----
26

# ============================================================
# TC2: Parallel adaptive scan under memory pressure
# ============================================================

load {TEST_DIR}/scan_target_oom_parallel.db

statement ok
PRAGMA threads=4

statement ok
CREATE TABLE t_oom_parallel AS SELECT i, repeat('P', 50000) as blob_data FROM range(0, 4096) tbl(i)

restart

statement ok
PRAGMA threads=4

statement ok
SET memory_limit='30MB'

statement ok
SET max_temp_directory_size='0B'

# Disabled: parallel full-vector scan of 50KB blobs blows the 30MB limit → OOM
statement ok
SET scan_target_size_bytes=0

statement error
SELECT SUM(LENGTH(blob_data)) FROM t_oom_parallel
----
Out of Memory

# Enable adaptive scan: same query now fits within 30MB across 4 threads.
# Same query as the disabled case above — the only change is scan_target_size_bytes.
statement ok
SET scan_target_size_bytes=1048576

query I
SELECT SUM(LENGTH(blob_data)) FROM t_oom_parallel
----
204800000

query II
SELECT MIN(i), MAX(i) FROM t_oom_parallel
----
0	4095

# ============================================================
# TC3: Filter path under memory pressure — sub-batching also
# protects the WHERE (has_filters) scan path, not just no-filter.
#
# Strings must be >= block_size (256KB): only then does the overflow
# copy go through buffer_manager.Allocate (tracked by memory_limit).
# Sub-block strings land in the Vector's untracked string heap, so the
# filter path would not OOM and this test could not demonstrate the fix.
# A non-selective filter (i>=1) still materializes a full tracked vector.
#
# Storage must stay uncompressed for the same reason: a compressed column is
# decompressed into the untracked string heap, so memory_limit cannot see it.
# ============================================================

load {TEST_DIR}/scan_target_oom_filter.db

statement ok
PRAGMA force_compression='uncompressed'

statement ok
CREATE TABLE t_oom_filter AS SELECT i, repeat(chr((65 + (i % 26))::INTEGER), 300000) as blob_data FROM range(0, 2048) tbl(i)

restart

statement ok
PRAGMA threads=1

statement ok
SET memory_limit='30MB'

statement ok
SET max_temp_directory_size='0B'

# Disabled: non-selective filter still materializes the full 300KB-blob vector → OOM
statement ok
SET scan_target_size_bytes=0

statement error
SELECT SUM(LENGTH(blob_data)) FROM t_oom_filter WHERE i >= 1
----
Out of Memory

# Enable adaptive scan: filter path now scans byte-budgeted sub-batches → fits in 30MB.
# Same query as the disabled case above — the only change is scan_target_size_bytes.
statement ok
SET scan_target_size_bytes=1048576

query I
SELECT SUM(LENGTH(blob_data)) FROM t_oom_filter WHERE i >= 1
----
614100000

# Selective filter (matches a subset) also succeeds through the sub-batched path
query I
SELECT SUM(LENGTH(blob_data)) FROM t_oom_filter WHERE i >= 1024
----
307200000

# ============================================================
# TC4: Delete path under memory pressure — sub-batch adapts to deletes.
# Deletes take the complex scan path; the per-batch valid_sel window keeps
# the physical scan byte-budgeted, so the same query that OOMs with the
# feature off now succeeds. 21 of 2048 rows are deleted (i % 100 = 0).
# ============================================================

load {TEST_DIR}/scan_target_oom_delete.db

statement ok
CREATE TABLE t_oom_delete AS SELECT i, repeat(chr((65 + (i % 26))::INTEGER), 50000) as blob_data FROM range(0, 2048) tbl(i)

statement ok
DELETE FROM t_oom_delete WHERE i % 100 = 0

statement ok
PRAGMA threads=1

statement ok
SET memory_limit='15MB'

statement ok
SET max_temp_directory_size='0B'

# Disabled: full vector of 50KB blobs needs ~100MB → OOM with 15MB limit
statement ok
SET scan_target_size_bytes=0

statement error
SELECT SUM(LENGTH(blob_data)) FROM t_oom_delete
----
Out of Memory

# Enable adaptive scan: deletes now scan byte-budgeted sub-batches → fits in 15MB.
# Same query as the disabled case above — the only change is scan_target_size_bytes.
statement ok
SET scan_target_size_bytes=1048576

query I
SELECT SUM(LENGTH(blob_data)) FROM t_oom_delete
----
101350000

query I
SELECT COUNT(*) FROM t_oom_delete
----
2027

# ============================================================
# TC5: Update path — sub-batch adapts to pending updates (windowed merge)
# checkpoint_threshold is raised so the UPDATE stays pending in memory
# (a checkpoint would merge it into the base data and clear HasUpdates()).
# FetchUpdates is windowed to each sub-batch, so scan_target_size_bytes lowers
# the peak and the same query that OOMs when disabled succeeds when enabled.
# ============================================================

load {TEST_DIR}/scan_target_oom_update.db

statement ok
CREATE TABLE t_oom_update AS SELECT i, repeat(chr((65 + (i % 26))::INTEGER), 50000) as blob_data FROM range(0, 2048) tbl(i)

# Keep the update pending (no checkpoint) so HasUpdates() stays true at scan time
statement ok
SET checkpoint_threshold='10GB'

statement ok
UPDATE t_oom_update SET blob_data = repeat('Z', 50000) WHERE i < 10

statement ok
PRAGMA threads=1

statement ok
SET memory_limit='15MB'

statement ok
SET max_temp_directory_size='0B'

# Disabled: full vector of 50KB blobs needs ~100MB → OOM with 15MB limit
statement ok
SET scan_target_size_bytes=0

statement error
SELECT SUM(LENGTH(blob_data)) FROM t_oom_update
----
Out of Memory

# Enabled: FetchUpdates is windowed per sub-batch, so the pending-update column is
# byte-budgeted like any other. Same query as the disabled case above — the only
# change is scan_target_size_bytes — succeeds under the 15MB limit.
statement ok
SET scan_target_size_bytes=1048576

query I
SELECT SUM(LENGTH(blob_data)) FROM t_oom_update
----
102400000

# The update keeps the row width, so SUM(LENGTH) alone cannot tell whether the overlay was merged at
# the right offsets. Compare every row against its expected value instead: the first 10 rows carry the
# update, the rest keep their original letter.
query I
SELECT COUNT(*) FROM t_oom_update
WHERE blob_data = repeat(CASE WHEN i < 10 THEN 'Z' ELSE chr((65 + (i % 26))::INTEGER) END, 50000)::BLOB
----
2048
