# name: test/sql/storage/test_update_delete_string.test
# description: Test updates/deletes and strings
# group: [storage]

# load the DB from disk
load __TEST_DIR__/test_string_update.db

# create a database and insert values
statement ok
CREATE TABLE test (a INTEGER, b STRING);

statement ok
INSERT INTO test VALUES (NULL, 'hello'), (13, 'abcdefgh'), (12, NULL)

query II
SELECT a, b FROM test ORDER BY a
----
NULL	hello
12	NULL
13	abcdefgh

restart

statement ok
PRAGMA enable_verification

query II
SELECT a, b FROM test ORDER BY a
----
NULL	hello
12	NULL
13	abcdefgh

query II
SELECT * FROM test WHERE a IS NULL
----
NULL	hello

query I
UPDATE test SET b=NULL WHERE a IS NULL
----
1

query II
SELECT * FROM test WHERE a IS NULL
----
NULL	NULL

query II
SELECT a, b FROM test ORDER BY a
----
NULL	NULL
12	NULL
13	abcdefgh

restart

query II
SELECT a, b FROM test ORDER BY a
----
NULL	NULL
12	NULL
13	abcdefgh

restart

statement ok
DELETE FROM test WHERE a=12

restart

query II
SELECT a, b FROM test ORDER BY a
----
NULL	NULL
13	abcdefgh

restart

statement ok
INSERT INTO test VALUES (12, NULL)

query II
SELECT a, b FROM test ORDER BY a
----
NULL	NULL
12	NULL
13	abcdefgh

restart

query II
SELECT a, b FROM test ORDER BY a
----
NULL	NULL
12	NULL
13	abcdefgh

restart

query II
SELECT a, b FROM test ORDER BY a
----
NULL	NULL
12	NULL
13	abcdefgh

statement ok
UPDATE test SET b='test123' WHERE a=12

query II
SELECT a, b FROM test ORDER BY a
----
NULL	NULL
12	test123
13	abcdefgh

restart

query II
SELECT a, b FROM test ORDER BY a
----
NULL	NULL
12	test123
13	abcdefgh

statement ok
UPDATE test SET a=a+1

query II
SELECT a, b FROM test ORDER BY a
----
NULL	NULL
13	test123
14	abcdefgh

restart

query II
SELECT a, b FROM test ORDER BY a
----
NULL	NULL
13	test123
14	abcdefgh
