# name: test/sql/types/blob/test_blob_function.test
# description: BLOB with Functions
# group: [blob]

statement ok
PRAGMA enable_verification

statement ok
CREATE TABLE blobs (b BYTEA);

statement ok
INSERT INTO blobs VALUES ('a'::BYTEA)

# conventional concat
query T
SELECT b || 'ZZ'::BYTEA FROM blobs
----
aZZ

query T
SELECT 'abc '::BYTEA || 'klm *\xEF\xBF\xBDT'::BYTEA
----
abc klm *\xEF\xBF\xBDT

statement ok
INSERT INTO blobs VALUES ('abc klm *\xEF\xBF\xBDT'::BYTEA)

query I
SELECT COUNT(*) FROM blobs
----
2

# octet_length
query I
SELECT OCTET_LENGTH(b) FROM blobs
----
1
13

# HEX strings
statement ok
DELETE FROM blobs

statement ok
INSERT INTO blobs VALUES ('\xFF'::BYTEA)

query T
SELECT b || 'ZZ'::BYTEA FROM blobs
----
\xFFZZ

query T
SELECT b || '\x5A\x5A'::BYTEA FROM blobs
----
\xFFZZ

# BLOB || VARCHAR is not allowed, should fail
query I
SELECT b || '5A5A'::VARCHAR FROM blobs
----
\xFF5A5A

# Octet Length tests
statement ok
DELETE FROM blobs

statement ok
INSERT INTO blobs VALUES ('\xFF'::BYTEA)

statement ok
INSERT INTO blobs VALUES ('FF'::BYTEA)

statement ok
INSERT INTO blobs VALUES ('\x55\xAA\xFF\x55\xAA\xFF\x55\xAA\xFF\x01'::BYTEA)

statement ok
INSERT INTO blobs VALUES ('55AAFF55AAFF55AAFF01'::BYTEA)

query I
SELECT OCTET_LENGTH(b) FROM blobs
----
1
2
10
20

