# name: test/remote_pushdown/remote_pushdown_bugfix.test
# description: Regression tests for specific bugs in RemotePushdownOptimizer
# group: [remote_pushdown]

require quack

require httpfs

statement ok db1:con1
call quack_serve('quack:localhost', token='asdf');

statement ok db1:con1
create table t1(i int);

statement ok db1:con1
insert into t1 from range(10);

statement ok db1:con1
create table t2(i int);

statement ok db1:con1
insert into t2 values (5), (6), (7), (8), (9), (10), (11), (12), (13), (14);

statement ok db1:con1
create table t3(i int, j int);

statement ok db1:con1
insert into t3 values (1, 10), (2, 20), (3, 30);

statement ok db1:con1
create table t1_struct(id int, info struct(val int));

statement ok db1:con1
insert into t1_struct values (1, {'val': 10}), (2, {'val': 20}), (3, {'val': 30});

statement ok db1:con1
create table t_struct_col(id int, rpc struct(x int, y int));

statement ok db1:con1
insert into t_struct_col values (1, {'x': 10, 'y': 1}), (2, {'x': 20, 'y': 2}), (3, {'x': 5, 'y': 3});

statement ok db1:con1
create table t_nested(id int, s struct(a struct(b struct(c int))));

statement ok db1:con1
insert into t_nested values (1, {'a': {'b': {'c': 42}}}), (2, {'a': {'b': {'c': 7}}});

statement ok
attach 'quack:localhost' as rpc (token 'asdf')

statement ok
create table local_t(local_col int);

statement ok
insert into local_t from range(10);

# Bug 1: StripCatalogName(SetOperationNode) did not strip ORDER BY expressions.

# UNION ALL with catalog-qualified ORDER BY: pushed and produces correct order
query II
explain select i from rpc.t1 union all select i from rpc.t1 order by rpc.t1.i
----
physical_plan	<!REGEX>:.*UNION.*

query I
select i from rpc.t1 union all select i from rpc.t1 order by rpc.t1.i limit 4
----
0
0
1
1

# UNION (dedup) with catalog-qualified ORDER BY DESC
query I
select i from rpc.t1 union select i from rpc.t1 order by rpc.t1.i desc limit 3
----
9
8
7

# INTERSECT with catalog-qualified ORDER BY
# t1 ∩ t2 = {5..9}; ascending order
query I
select i from rpc.t1 intersect select i from rpc.t2 order by rpc.t1.i
----
5
6
7
8
9

# EXCEPT with catalog-qualified ORDER BY
# t1 - t2 = {0..4}; ascending order
query I
select i from rpc.t1 except select i from rpc.t2 order by rpc.t1.i
----
0
1
2
3
4

# Bug 2: StripCatalogName(JoinRef) did not strip JOIN ON condition expressions.

# JOIN ON with catalog-qualified left column: rpc.t1.i stripped to t1.i
query II
explain select count(*) from rpc.t1 join rpc.t1 t2 on rpc.t1.i = t2.i
----
physical_plan	<!REGEX>:.*JOIN.*

query I
select count(*) from rpc.t1 join rpc.t1 t2 on rpc.t1.i = t2.i
----
10

# JOIN ON with both sides catalog-qualified: rpc.t1.i and rpc.t2.i both stripped
# t1={0..9}, t2={5..14}: join on equal values gives {5,6,7,8,9} -> 5 rows
query II
explain select count(*) from rpc.t1 join rpc.t2 on rpc.t1.i = rpc.t2.i
----
physical_plan	<!REGEX>:.*JOIN.*

query I
select count(*) from rpc.t1 join rpc.t2 on rpc.t1.i = rpc.t2.i
----
5

# JOIN ON with catalog-qualified filter: t1 rows where i < 5 have no overlap with t2={5..14} -> 0 rows
query I
select count(*) from rpc.t1 join rpc.t2 on rpc.t1.i = rpc.t2.i and rpc.t1.i < 5
----
0

# Bug 3: Rewrite(JoinRef) did not analyze the JOIN ON condition; local macro in ON must block pushdown.

statement ok
create macro double_it(x) as x * 2;

# Local macro in JOIN ON blocks full pushdown; hits "multiple streaming scans" limitation
mode skip multiple_streaming_scans

query I
select count(*) from rpc.t1 a join rpc.t2 b on double_it(a.i) = b.i
----
5

mode unskip

# double_it(i) > 10 -> i > 5 -> {6,7,8,9} = 4 rows
query I
select count(*) from rpc.t1 where double_it(i) > 10
----
4

# double_it(i) in [10,14] -> i in {5,6,7} = 3 rows
query I
select count(*) from rpc.t1 where double_it(i) >= 10 and double_it(i) <= 14
----
3

statement ok
drop macro double_it;

# Bug 4: pushing a JOIN with duplicate output column names caused an internal binding crash.
# Fix: quack_query_by_name's bind function now calls QueryResult::DeduplicateColumns so that
# two identically-named result columns (e.g. a.i and b.i both named "i") are renamed to i, i_1.
# The pushed query executes correctly; the test verifies values (not column names).

mode skip duplicate_name_pushdown_bug

query II rowsort
select a.i, b.i from rpc.t1 a join rpc.t1 b on a.i + 1 = b.i order by a.i
----
0	1
1	2
2	3
3	4
4	5
5	6
6	7
7	8
8	9

mode unskip

# Verify that the alias-based workaround still works correctly
query II
select a.i as ai, b.i as bi from rpc.t1 a join rpc.t1 b on a.i + 1 = b.i where a.i < 3 order by ai
----
0	1
1	2
2	3

# Bug 6: FinishPushdown(TableRef&) with a JoinRef loses table aliases, causing "table not found".
# Fix: skip JoinRef pushdown in FinishPushdown(TableRef&); falls back to native scanning.

statement ok
create macro double_it(x) as x * 2;

# Local macro in SELECT over 2-table remote join must produce "Multiple streaming scans", not an internal error
mode skip multiple_streaming_scans

query I rowsort
select double_it(a.i) from rpc.t1 a join rpc.t2 b on a.i = b.i
----
10
12
14
16
18

mode unskip

statement ok
drop macro double_it;

# Bug 5: PushdownSubqueries was not called for GROUP BY / ORDER BY when the whole query could not be pushed.

# Scalar subquery in ORDER BY: local_t={0..9}; order by (9 - local_col) ASC -> local_col=9 first
query I
select local_col from local_t
order by (select max(i) from rpc.t1) - local_col
limit 3
----
9
8
7

# Scalar subquery in ORDER BY ascending
query I
select local_col from local_t
order by local_col - (select min(i) from rpc.t1)
limit 3
----
0
1
2

# Scalar subquery in GROUP BY: local_col % 9 for {0..9} yields 9 distinct buckets
query I
select count(distinct bucket) from (
  select local_col % (select max(i) from rpc.t1) as bucket from local_t
) sub
----
9

# Bug 7: Rewrite(DML) did not guard on target-table locality; local DML with remote subquery was pushed to remote.

# DELETE with remote scalar subquery in WHERE; max(rpc.t1.i)=9; local_col > 9 -> 0 rows deleted
query I
select count(*) from local_t
----
10

statement ok
delete from local_t where local_col > (select max(i) from rpc.t1)

query I
select count(*) from local_t
----
10

# local_col IN {0,1,2} -> 3 rows removed; 7 remain
statement ok
delete from local_t where local_col in (select i from rpc.t1 where i < 3)

query I
select count(*) from local_t
----
7

statement ok
insert into local_t from range(3)

# UPDATE local table with remote scalar subquery in SET: local_col += max(rpc.t1.i)=9 where local_col < 3
statement ok
update local_t set local_col = local_col + (select max(i) from rpc.t1) where local_col < 3

query I
select count(*) from local_t where local_col >= 9
----
4

# Restore
statement ok
update local_t set local_col = local_col - (select max(i) from rpc.t1) where local_col >= 9 and local_col <= 11

# INSERT into local table from remote SELECT: adds rows {100,101,102}
statement ok
insert into local_t select i + 100 from rpc.t1 where i < 3

query I
select count(*) from local_t where local_col >= 100
----
3

statement ok
delete from local_t where local_col >= 100

# Bug 8: Rewrite(BaseTableRef) returned NO_CATALOG_REFERENCED for local tables with explicit catalog prefix,
# causing them to be misclassified as all-remote and pushed to the remote server.

# Reset local_t to a known state
statement ok
drop table local_t

statement ok
create table local_t(local_col int);

statement ok
insert into local_t from range(10);

# local_t = {0..9}; local_col IN {0..4} -> 5 rows
query I
select count(*) from memory.main.local_t where local_col in (select i from rpc.t1 where i < 5)
----
5

# Result sanity check with explicit-catalog subquery
query I
select count(*) from local_t where local_col >= (select min(i) from rpc.t1)
----
10

statement ok
drop table local_t

# Bug 9: Rewrite(SubqueryRef) did not save/restore local_table_names, causing column names from inner
# local tables to leak into the outer scope and falsely block remote subquery pushdown.

statement ok
create table local_i(i int);

statement ok
insert into local_i from range(5);

# FROM clause has local SubqueryRef (local_i with column 'i'); WHERE has purely-remote IN subquery.
# With fix: save/restore clears leaked 'i', IN subquery is correctly pushed.
# local_i={0..4}; IN filter keeps i in {0,1,2} -> 3 rows.
query I
select count(*) from (select * from local_i) sq
where sq.i in (select i from rpc.t1 where i < 3)
----
3

statement ok
drop table local_i

# Bug 10: Rewrite/StripCatalogName for DML did not process the node's own cte_map,
# causing CTE bodies to be invisible and CTE catalog refs to go unstripped.

# Restore local_t for DML CTE tests
statement ok
create table local_t(local_col int);

statement ok
insert into local_t from range(10);

# DELETE with all-remote CTE: t1={0..9}; cte = {8,9}; delete local_col in {8,9} -> 2 removed; 8 remain.
statement ok
with remote_cte as (select i from rpc.t1 where i > 7)
delete from local_t where local_col in (select i from remote_cte)

query I
select count(*) from local_t
----
8

statement ok
insert into local_t values (8), (9)

# DELETE with local CTE: must NOT be pushed to remote; deletes local_col in {0,1,2} -> 7 remain.
statement ok
create table local_t2(v int);

statement ok
insert into local_t2 values (0), (1), (2);

statement ok
with local_cte as (select v from local_t2)
delete from local_t where local_col in (select v from local_cte)

query I
select count(*) from local_t
----
7

statement ok
insert into local_t values (0), (1), (2)

# INSERT with all-remote CTE: cte = {0..4}; insert {100..104} -> 5 new rows added.
statement ok
with remote_cte as (select i from rpc.t1 where i < 5)
insert into local_t select local_col + 100 from (select i as local_col from remote_cte) sub

query I
select count(*) from local_t where local_col >= 100
----
5

statement ok
delete from local_t where local_col >= 100

# UPDATE with all-remote CTE: max(rpc.t1.i)=9; local_col {0,1,2} become {9,10,11}; count >= 9 becomes 4
statement ok
with remote_max as (select max(i) as m from rpc.t1)
update local_t set local_col = local_col + (select m from remote_max) where local_col < 3

query I
select count(*) from local_t where local_col >= 9
----
4

statement ok
drop table local_t

statement ok
drop table local_t2

# Bug 11: Correlated WHERE subquery was pushed independently when the outer from_table was pushed to remote.
# Fix: alias must be preserved on the outer table-function wrapper so column refs like ft.i resolve.

statement ok
create macro id_macro(x) as x;

# id_macro(ft.i) forces UNKNOWN result; rpc.t1 AS ft is pushed individually.
# t1={0..9}; ft.i>=5 -> {5,6,7,8,9} -> count=5.
query I
select count(*) from rpc.t1 AS ft where id_macro(ft.i) >= 5
----
5

statement ok
drop macro id_macro;

# Bug 12: StripCatalogName(ParsedExpression) stripped unqualified column refs whose single name matched
# the catalog name, leaving column_names=[] and causing a binder crash.
# Fix: require at least 2 elements before stripping.

statement ok
create table local_rpc(rpc int);

statement ok
insert into local_rpc values (3), (5), (7);

# Mixed join: local_rpc + rpc.t1; "rpc" column ref must survive stripping intact.
# local_rpc={3,5,7}; rpc.t1={0..9}: inner join matches {3,5,7} -> 3 rows.
query I
select rpc from local_rpc join rpc.t1 on local_rpc.rpc = rpc.t1.i order by rpc
----
3
5
7

statement ok
drop table local_rpc

# Bug 13: Two bugs: (a) StripCatalogName incorrectly recursed into unpushed subquery bodies in partial
# pushdown; (b) HasLocalTableReference missed aliases of individually pushed JoinRef children.
# Fix: pass strip_subquery_bodies=false in partial-pushdown; populate from_pushed_table_aliases.

statement ok
create table local_k(k int);

statement ok
insert into local_k values (2), (5), (8);

# Mixed join with correlated EXISTS: must hit "Multiple streaming scans", not a binder error.
mode skip multiple_streaming_scans

query I
select count(*) from rpc.t1 t1 join local_k on t1.i = local_k.k
where exists (select 1 from rpc.t2 where t2.i = t1.i)
----
2

mode unskip

statement ok
drop table local_k

# Bug 14: PushdownSubqueries was incorrectly called when JoinRef children already occupied the quack
# streaming slot, creating a second concurrent connection.

statement ok
create table local_m(m int);

statement ok
insert into local_m values (1), (3), (5);

# Mixed join (rpc.t1 + local_m): both old and new code produce "Multiple streaming scans".
mode skip multiple_streaming_scans

query I rowsort
select t1.i from rpc.t1 join local_m on t1.i = local_m.m
where t1.i < (select max(i) from rpc.t2)
----
1
3
5

mode unskip

statement ok
drop table local_m

# Bug 15: FinishPushdown(QueryNode) pushed a UNION ALL child standalone when an outer SINGLE_REMOTE CTE
# was in scope; remote failed with "Table cte_name not found".
# Fix: check cte_results for outer SINGLE_REMOTE CTEs and skip the push.

statement ok
create table local_bugfix15(i int);

statement ok
insert into local_bugfix15 from range(5, 10);

# outer_cte = {0..4}, local_bugfix15 = {5..9} -> total 10 rows.
query I
with outer_cte as (select i from rpc.t1 where i < 5)
select count(*) from (
    select i from outer_cte
    union all
    select i from local_bugfix15
)
----
10

statement ok
drop table local_bugfix15

# Bug 16: Rewrite(InsertQueryNode) polluted local_table_column_names with INSERT target's columns,
# falsely blocking pushdown of remote subqueries in the source SELECT.
# Fix: save/restore local_table_names/column_names around Rewrite(target_ref).

statement ok
create table local_bugfix16(i int);

# Source SELECT (rpc.t1 WHERE i < max(rpc.t2.i)) must be pushed as a single quack call.
query I rowsort
insert into local_bugfix16
select i from rpc.t1
where i < (select max(i) from rpc.t2)
returning i
----
0
1
2
3
4
5
6
7
8
9

statement ok
drop table local_bugfix16

# Bug 17: any_child_pushed in Rewrite(SetOperationNode) did not detect TABLE_FUNCTION refs in UNKNOWN
# children, causing PushdownSubqueries to open a second streaming connection.
# Fix: HasTableFunctionInTree detects TABLE_FUNCTION refs so any_child_pushed is set correctly.

statement ok
create table local_bugfix17(local_col int);

statement ok
insert into local_bugfix17 from range(10);

# rpc.t1 pushed to TABLE_FUNCTION (slot 1); UNION with local arm uses local_bugfix17.
# rpc.t1={0..9}; i < max(local_bugfix17)=9 -> {0..8}; local_bugfix17 where local_col<5 -> {0..4}.
query I rowsort
(select i from rpc.t1 where i < (select max(local_col) from local_bugfix17))
union all
(select local_col from local_bugfix17 where local_col < 5)
----
0
0
1
1
2
2
3
3
4
4
5
6
7
8

statement ok
drop table local_bugfix17

# Bug 18: TryPushDMLWithLocalReturning — DML on remote table with local-only expression in RETURNING
# must split: push DML with raw column RETURNING, evaluate local expressions over results locally.

mode skip unsupported_returning

statement ok
CREATE OR REPLACE MACRO local_double(x) AS (x * 2);

# INSERT into remote table with mixed RETURNING: remote returns i=77, local applies local_double(77)=154.
query II
INSERT INTO rpc.t1 VALUES (77) RETURNING i, local_double(i) AS doubled
----
77	154

# Verify the row was actually inserted on the remote.
query I
SELECT i FROM rpc.t1 WHERE i = 77
----
77

statement ok
DELETE FROM rpc.t1 WHERE i = 77

statement ok db1:con1
INSERT INTO t1 VALUES (88);

# DELETE from remote table with mixed RETURNING: remote returns i=88, local applies local_double(88)=176.
query II
DELETE FROM rpc.t1 WHERE i = 88 RETURNING i, local_double(i) AS doubled
----
88	176

query I
SELECT count(*) FROM rpc.t1 WHERE i = 88
----
0

statement ok db1:con1
INSERT INTO t1 VALUES (99);

# UPDATE on remote table with mixed RETURNING: remote returns i=100, local applies local_double(100)=200.
query II
UPDATE rpc.t1 SET i = i + 1 WHERE i = 99 RETURNING i, local_double(i) AS doubled
----
100	200

query I
SELECT i FROM rpc.t1 WHERE i = 100
----
100

statement ok
DELETE FROM rpc.t1 WHERE i = 100

statement ok
DROP MACRO local_double;

# Bug 19: TryPushDMLWithLocalReturning with RETURNING * — remote RETURNING must use * so all columns
# are returned; without the fix only macro-argument columns were returned, silently dropping others.

statement ok
CREATE OR REPLACE MACRO local_double(x) AS (x * 2);

# INSERT with RETURNING * + local macro: remote returns (77, 770), local adds doubled=154.
query III
INSERT INTO rpc.t3 VALUES (77, 770) RETURNING *, local_double(i) AS doubled
----
77	770	154

# DELETE with RETURNING * + local macro: remote returns (77, 770), local adds doubled=154.
query III
DELETE FROM rpc.t3 WHERE i = 77 RETURNING *, local_double(i) AS doubled
----
77	770	154

query I
SELECT count(*) FROM rpc.t3 WHERE i = 77
----
0

statement ok
DROP MACRO local_double;

# Bug 20: TryPushDMLWithLocalReturning with table-qualified star (t.*) — StripAllTableQualifiers must
# clear StarExpression::relation_name so "t3.*" becomes "*" in the outer SELECT.

statement ok
CREATE OR REPLACE MACRO local_double(x) AS (x * 2);

# INSERT with table-qualified star: remote executes "INSERT ... RETURNING *", outer strips "t3.*" -> "*".
query III
INSERT INTO rpc.t3 VALUES (88, 880) RETURNING t3.*, local_double(i) AS doubled
----
88	880	176

# DELETE with table-qualified star.
query III
DELETE FROM rpc.t3 WHERE i = 88 RETURNING t3.*, local_double(i) AS doubled
----
88	880	176

query I
SELECT count(*) FROM rpc.t3 WHERE i = 88
----
0

statement ok
DROP MACRO local_double;

mode unskip

# Bug 21: Rewrite(JoinRef) analyzed the right side without the left remote table's aliases in
# local_table_names; a LATERAL correlated subquery was incorrectly classified SINGLE_REMOTE and pushed.
# Fix: add left aliases to local_table_names before analyzing the right side.

statement ok
CREATE OR REPLACE MACRO local_double(x) AS (x * 2);

# Both with and without the fix, quack rejects this due to single-stream limit.
# The error must be about streaming concurrency, not an undefined table reference.
mode skip multiple_streaming_scans

query II rowsort
SELECT t1.i, sub.i AS sub_i
FROM rpc.t1 JOIN (SELECT i FROM rpc.t2 WHERE i = t1.i) sub ON local_double(sub.i) > 0
ORDER BY t1.i
----
5	5
6	6
7	7
8	8
9	9

mode unskip


statement ok
DROP MACRO local_double;

# Bug 22: HasLocalTableReference(QueryNode) returned false for INSERT/DELETE/UPDATE nodes, causing DML
# CTEs inside subqueries to be pushed to remote where local tables don't exist.
# Fix: add explicit cases for DML nodes that inspect body expressions for local table refs.
# Note: DuckDB's binder rejects DML CTEs inside non-top-level subqueries; with the fix the optimizer
# correctly preserves the subquery locally, and the binder then raises the clear error below.

statement ok
create table local_t(local_col int);

statement ok
insert into local_t from range(10);

# Correlated IN subquery with DELETE CTE referencing outer local table.
# Without fix: remote error. With fix: binder error (DML not at top level).
statement error
select count(*) from local_t where local_col in (
    with del as (delete from rpc.t1 where t1.i > 100 and t1.i = local_t.local_col returning i)
    select * from del
)
----
<REGEX>:.*WITH clause containing a data-modifying statement must be at the top level.*

# Same pattern with INSERT.
statement error
select count(*) from local_t where local_col in (
    with ins as (insert into rpc.t2 select i from rpc.t2 where t2.i > 100 and t2.i = local_t.local_col returning i)
    select * from ins
)
----
<REGEX>:.*WITH clause containing a data-modifying statement must be at the top level.*

statement ok
drop table local_t;

# Bug 23: StripCatalogName(InsertQueryNode) used exact string comparison instead of CIEquals for
# catalog/schema fields; uppercase-quoted catalog "RPC" was not stripped, failing on the remote.

# INSERT with uppercase-quoted catalog name must still push and succeed.
statement ok
INSERT INTO "RPC".t1 VALUES (55)

query I
SELECT i FROM rpc.t1 WHERE i = 55
----
55

statement ok
DELETE FROM rpc.t1 WHERE i = 55

statement ok
create table local_t(local_col int);

statement ok
insert into local_t from range(10);

# Bug 24: Rewrite(InsertQueryNode/DeleteQueryNode/UpdateQueryNode) did not include returning_list
# inside the save/restore block, causing stale quack wrappers from JoinRef pushes to trigger
# "Multiple streaming scans". Fix: include returning_list inside the save/restore block.

mode skip unsupported_returning

# All-remote INSERT with RETURNING: whole INSERT is pushed; returns i=99.
query I
with ins as (insert into rpc.t1 values (99) returning i as val)
select val from ins
----
99

statement ok
DELETE FROM rpc.t1 WHERE i = 99

# INSERT with pure-local RETURNING subquery: TryPushDMLWithLocalReturning falls back to RETURNING *.
# Remote executes "INSERT INTO t1 VALUES (99) RETURNING *"; outer evaluates max(local_col)=9.
query I
INSERT INTO rpc.t1 VALUES (99) RETURNING (select max(local_col) from local_t) AS local_max
----
9

statement ok
DELETE FROM rpc.t1 WHERE i = 99

mode unskip

# Bug 25: Rewrite(SubqueryRef) did not save/restore the subquery node before calling Rewrite(*subquery->node).
# A mixed JoinRef inside a FROM-clause subquery had its remote child pushed in-place even when result was UNKNOWN.
# Fix: save and restore the subquery node when result is not SINGLE_REMOTE.

# FROM-clause SubqueryRef with rpc.t2 JOIN local_t (mixed); t2=[5..14] ∩ local_t=[0..9] = {5..9}.
query I
select sub.i from (
    select t2.i from rpc.t2 join local_t on t2.i = local_t.local_col
) sub order by sub.i
----
5
6
7
8
9

# Bug 26: Rewrite(SetOperationNode) did not save/restore UNKNOWN children; stale quack wrappers from
# nested JoinRef pushes caused "Multiple streaming scans" with a pushed SINGLE_REMOTE sibling.
# Fix: (a) save/restore UNKNOWN children; (b) skip individual child pushdown when any sibling is UNKNOWN.

# UNION ALL: all-remote arm {8,9} + range(3) arm {0,1,2} -> 5 rows total
query I
select count(*) from (
    select i from rpc.t1 where i >= 8
    union all
    select * from range(3)
)
----
5

query I
select i from (
    select i from rpc.t1 where i >= 8
    union all
    select * from range(3)
) order by i
----
0
1
2
8
9


# Bug 27: DELETE with multiple remote USING clauses each being pushed to concurrent quack streaming slots.
# Fix: pre-analyze all USING clauses; restore all when more than one is SINGLE_REMOTE.

# Two remote USING clauses still hit quack's single-stream limit; fix ensures no worse failure.
mode skip multiple_streaming_scans

query I
delete from local_t using rpc.t1, rpc.t2
where local_t.local_col = t1.i and local_t.local_col = t2.i
----
5

mode unskip

# Single remote USING clause: rpc.t1 pushed to one quack slot; removes {7,8,9} from local_t.
statement ok
delete from local_t using rpc.t1
where local_t.local_col = rpc.t1.i and rpc.t1.i > 6

query I
select count(*) from local_t
----
7

query I
select local_col from local_t order by local_col
----
0
1
2
3
4
5
6

# Bug 29: Nested mixed JoinRef — outer ON condition references a remote table pushed in-place inside an
# inner JoinRef; the stripping loop only processed direct SINGLE_REMOTE children, not nested ones.
# Fix: also strip catalogs accumulated by nested JoinRef processing from the outer ON condition.
# local_t.local_col = {0..6}, local_x.x = {0,2,4,6}: intersection = {0,2,4,6}

statement ok
create table local_x(x int);

statement ok
insert into local_x values (0), (2), (4), (6);

# Nested mixed join: rpc.t1 pushed inside (rpc.t1 JOIN local_x); outer ON references rpc.t1.i -> stripped to t1.i.
query I
select local_t.local_col
from local_t
join (rpc.t1 join local_x on rpc.t1.i = local_x.x)
on local_t.local_col = rpc.t1.i
order by local_col
----
0
2
4
6

statement ok
drop table local_x;

statement ok
drop table local_t;

# Bug 30: StripCatalogName for ColumnRefExpression must require at least 3 parts before stripping.
# A 2-part ref like "rpc.x" is table.column or struct.field, never catalog-qualified.

# (a) 3-part catalog.table.column in SELECT list and WHERE
query I
select rpc.t1.i from rpc.t1 where rpc.t1.i >= 8 order by rpc.t1.i
----
8
9

# (b) 2-part table.column not stripped (t1.i stays as-is)
query I
select t1.i from rpc.t1 t1 where t1.i >= 8 order by t1.i
----
8
9

# "rpc.x" is a 2-part struct field access; old code (size >= 2) incorrectly stripped to "x".
# With fix (size >= 3), rpc.x is preserved as a struct field access.
query II
select id, rpc.x from rpc.t_struct_col order by id
----
1	10
2	20
3	5

# struct field in WHERE: rpc.x > 8 must not be stripped to x > 8
query I
select id from rpc.t_struct_col where rpc.x > 8 order by id
----
1
2

statement ok db1:con1
drop table t_struct_col;

# Bug 30 (extended): deeply nested structs — 5-part ref rpc.t_nested.s.a.b.c correctly strips to t_nested.s.a.b.c.
query II
select id, rpc.t_nested.s.a.b.c from rpc.t_nested order by id
----
1	42
2	7

# 5-part ref in WHERE
query I
select id from rpc.t_nested where rpc.t_nested.s.a.b.c > 10 order by id
----
1

# Bug 31: SubqueryRef with NO_CATALOG_REFERENCED result must NOT be tracked in local_table_names.
# Previously any non-SINGLE_REMOTE SubqueryRef was added to local_table_names, blocking pushdown
# of queries with constant subqueries like (SELECT 1 AS v) in FROM.

# Verify pushed: no SEQ_SCAN in plan
query II
explain
select t1.i from rpc.t1 t1, (select 5 as v) sub
where t1.i < sub.v
order by t1.i
----
physical_plan	<!REGEX>:.*SEQ_SCAN.*

# rpc.t1.i in {0..4} (i < 5), joined with constant sub.v=5
query I
select t1.i from rpc.t1 t1, (select 5 as v) sub
where t1.i < sub.v
order by t1.i
----
0
1
2
3
4

# Bug 32: StripSetOpOrderByExpr did not recurse into composite ORDER BY expressions after individual
# child pushdown; catalog-qualified refs inside functions like coalesce(rpc.t1.i, 0) were not stripped.
# Fix: StripSetOpOrderByExpr now recurses via EnumerateChildren.
# Note: direct testing is not feasible with quack; fix verified by code inspection.

# Bug 33: Rewrite(SelectNode) pending stripping loop handled ORDER_MODIFIER but missed DISTINCT_MODIFIER;
# DISTINCT ON (rpc.t1.i) on a mixed join left the ref unstripped, causing a binder error.
# Fix: add DISTINCT_MODIFIER handling to the pending stripping loop.

statement ok
create table local_bug33(k int);

statement ok
insert into local_bug33 values (2), (5), (8);

# Mixed join: rpc.t1 (pushed individually) + local_bug33.
# t1={0..9}; inner join on t1.i=k gives {2,5,8}; DISTINCT ON t1.i -> 3 rows.
query I
select distinct on (rpc.t1.i) rpc.t1.i
from rpc.t1 join local_bug33 on rpc.t1.i = local_bug33.k
order by rpc.t1.i
----
2
5
8

statement ok
drop table local_bug33;

# Bug 34: PushJoinChild with explicit alias differing from table name; after stripping rpc.t1.i -> t1.i,
# the binder only sees the alias "rt1", so t1.i cannot be resolved.

statement ok
create table local_bug34(k int);

statement ok
insert into local_bug34 values (2), (5), (8);

# Mixed join: rpc.t1 AS rt1 pushed individually; ON condition uses catalog-qualified rpc.t1.i.
# After stripping rpc.t1.i -> t1.i, the binder still fails because alias "rt1" != "t1".
statement error
select rt1.i
from rpc.t1 AS rt1 join local_bug34 on rpc.t1.i = local_bug34.k
order by rt1.i
----
not found

statement ok
drop table local_bug34;

# Bug 35: pending_outer_strip_catalogs missing RenameTableInExpr; after stripping rpc.t1.col -> t1.col
# in SELECT/WHERE, the result t1.col cannot be resolved when only the alias rt1 is in scope.

statement ok
create table local_bug35(k int);

statement ok
insert into local_bug35 values (2), (5), (8);

# SELECT uses catalog-qualified rpc.t1.i; after stripping -> t1.i; binder fails (only rt1 in scope).
statement error
select rpc.t1.i
from rpc.t1 AS rt1 join local_bug35 on rt1.i = local_bug35.k
order by rpc.t1.i
----
not found

# WHERE also uses catalog-qualified form
statement error
select rpc.t1.i
from rpc.t1 AS rt1 join local_bug35 on rt1.i = local_bug35.k
where rpc.t1.i > 3
order by rpc.t1.i
----
not found

statement ok
drop table local_bug35;

# Enhancement: PushJoinChild for SubqueryRef — fully-remote SubqueryRef on one side of a mixed JOIN
# is individually pushed so the filter executes on the remote server.

statement ok
create table local_sq(k int);

statement ok
insert into local_sq from range(10);

# Remote subquery with filter in mixed JOIN is pushed individually
query I
select sub.i from local_sq join (select i from rpc.t1 where i > 5) sub on local_sq.k = sub.i
order by sub.i
----
6
7
8
9

# Remote subquery with aggregation in mixed JOIN is pushed individually
query I
select count(*) from local_sq join (select i from rpc.t1 where i between 3 and 7) sub on local_sq.k = sub.i
----
5

# DELETE USING with remote subquery USING clause is pushed individually
statement ok
delete from local_sq using (select i from rpc.t1 where i >= 7) sub where local_sq.k = sub.i

# rows 7-9 deleted; local_sq = {0..6}, count = 7
query I
select count(*) from local_sq
----
7

# UPDATE FROM with remote subquery FROM clause is pushed individually
statement ok
update local_sq set k = sub.v from (select i, i * 10 as v from rpc.t1 where i < 3) sub where local_sq.k = sub.i

# rows 0,1,2 become 0,10,20; count where k > 9 = 2 (values 10 and 20)
query I
select count(*) from local_sq where k > 9
----
2

statement ok
drop table local_sq;

# Bug 36: pending_outer_strip_catalogs was not applied to DELETE WHERE / UPDATE SET when the USING/FROM
# clause was a mixed JoinRef. Fix: apply accumulated pending entries to WHERE/SET/RETURNING.

statement ok
create table local_del_jref(k int);

statement ok
insert into local_del_jref from range(10);

statement ok
create table local_del_jref_aux(m int);

statement ok
insert into local_del_jref_aux values (3), (5), (7);

# DELETE with USING (local JOIN rpc.t1): WHERE uses rpc.t1.i which must be stripped.
# t1={0..9}, aux={3,5,7}: condition rpc.t1.i > 4 matches {5,7}; rows 5 and 7 deleted.
statement ok
delete from local_del_jref
using local_del_jref_aux join rpc.t1 on local_del_jref_aux.m = rpc.t1.i
where local_del_jref.k = rpc.t1.i and rpc.t1.i > 4

# {0..9} minus {5,7} = 8 rows
query I
select count(*) from local_del_jref
----
8

statement ok
drop table local_del_jref;

statement ok
drop table local_del_jref_aux;

statement ok
create table local_upd_jref(k int);

statement ok
insert into local_upd_jref from range(5);

statement ok
create table local_upd_jref_aux(m int);

statement ok
insert into local_upd_jref_aux values (1), (3);

# UPDATE with FROM (local JOIN rpc.t1): SET uses rpc.t1.i which must be stripped.
# With fix: k=1 -> 10, k=3 -> 30.
statement ok
update local_upd_jref set k = rpc.t1.i * 10
from local_upd_jref_aux join rpc.t1 on local_upd_jref_aux.m = rpc.t1.i
where local_upd_jref.k = rpc.t1.i

# rows with original k=1 and k=3 updated to 10 and 30; count >= 10 = 2
query I
select count(*) from local_upd_jref where k >= 10
----
2

statement ok
drop table local_upd_jref;

statement ok
drop table local_upd_jref_aux;

# Bug 36 addendum: symmetric coverage — remote table on the LEFT of a JoinRef inside DELETE USING / UPDATE FROM.

statement ok
create table local_del_jref2(k int);

statement ok
insert into local_del_jref2 from range(10);

statement ok
create table local_del_jref2_aux(m int);

statement ok
insert into local_del_jref2_aux values (3), (5), (7);

# DELETE with USING (rpc.t1 JOIN local) — remote LEFT, local RIGHT; rpc.t1.i > 4 matches {5,7}.
statement ok
delete from local_del_jref2
using rpc.t1 join local_del_jref2_aux on rpc.t1.i = local_del_jref2_aux.m
where local_del_jref2.k = rpc.t1.i and rpc.t1.i > 4

# rows 5 and 7 deleted; {0..9} minus {5,7} = 8 rows
query I
select count(*) from local_del_jref2
----
8

statement ok
drop table local_del_jref2;

statement ok
drop table local_del_jref2_aux;

statement ok
create table local_upd_jref2(k int);

statement ok
insert into local_upd_jref2 from range(5);

statement ok
create table local_upd_jref2_aux(m int);

statement ok
insert into local_upd_jref2_aux values (1), (3);

# UPDATE with FROM (rpc.t1 JOIN local) — remote LEFT, local RIGHT; k=1 -> 10, k=3 -> 30.
statement ok
update local_upd_jref2 set k = rpc.t1.i * 10
from rpc.t1 join local_upd_jref2_aux on rpc.t1.i = local_upd_jref2_aux.m
where local_upd_jref2.k = rpc.t1.i

# rows with original k=1 and k=3 updated to 10 and 30; count >= 10 = 2
query I
select count(*) from local_upd_jref2 where k >= 10
----
2

statement ok
drop table local_upd_jref2;

statement ok
drop table local_upd_jref2_aux;

# Bug 37: FinishPushdown(QueryNode) and PushJoinChild(SubqueryRef) CTE guards did not block
# NO_CATALOG_REFERENCED outer CTEs; remote failed with "Table 'zero' not found".
# Fix: extend guards to also return early for NO_CATALOG_REFERENCED outer CTEs.

statement ok
create table local_bug37(k int);

statement ok
insert into local_bug37 from range(10);

# Bug 37a (FinishPushdown): UNION ALL arm1 references rpc.t1 CROSS JOIN outer NO_CATALOG CTE (zero).
# Without fix: arm1 pushed standalone, remote fails on "Table 'zero' not found".
# zero.n=0 so i >= 0 matches all of rpc.t1={0..9}; arm2 has no rows (k<0); total=10.
query I
with zero as (select 0 as n)
select count(*) from (
    select i from rpc.t1 cross join zero where i >= zero.n
    union all
    select k from local_bug37 where k < 0
)
----
10

# Bug 37b (PushJoinChild SubqueryRef): mixed JOIN where subquery references rpc.t1 CROSS JOIN outer CTE.
# local_bug37={0..9}, sub.i={0..9} (i>=0) -> 10 rows.
query I
with zero as (select 0 as n)
select count(*)
from local_bug37
join (select i from rpc.t1 cross join zero where i >= zero.n) sub
    on local_bug37.k = sub.i
----
10

statement ok
drop table local_bug37;

# Bug 38: RenameTableInExpr only handled 2-part column refs; schema-qualified refs like main.t1.col
# (3-part after catalog stripping) were left unmodified, causing binder errors.
# Fix: extend RenameTableInExpr to reduce 3-part schema.table.col -> alias.col.

statement ok
create table local_t(local_col int);

statement ok
insert into local_t from range(10);

# Bug 38a: schema-qualified ON condition — no alias; rpc.main.t1={0..9}, local_t={0..9}: 10 rows match
query I
select count(*) from rpc.main.t1 join local_t on (rpc.main.t1.i = local_t.local_col)
----
10

# Bug 38b: schema-qualified ON condition — with explicit alias (rt1)
statement error
select count(*) from rpc.main.t1 as rt1 join local_t on (rpc.main.t1.i = local_t.local_col)
----
not found

# Bug 38c: schema-qualified column ref in WHERE; 4 rows with local_col > 5
query I
select count(*) from rpc.main.t1 join local_t on (i = local_col) where rpc.main.t1.i > 5
----
4

# Bug 38d: schema-qualified column ref in SELECT list
query I
select count(rpc.main.t1.i) from rpc.main.t1 join local_t on (i = local_col)
----
10

statement ok
drop table local_t;

# Bug 39: RenameTableInExpr did not handle struct field access in 3+-part refs after catalog stripping;
# t1.info.val (3-part) was not renamed to alias.info.val.
# Fix: Case 3 in RenameTableInExpr renames col[0] when size>=3 and col[0]==old_table.

statement ok
create table local_struct(id int);

statement ok
insert into local_struct values (1), (2), (3);

# Bug 39a: struct field in SELECT of mixed join — no alias
query I
select rpc.t1_struct.info.val from rpc.t1_struct join local_struct on (rpc.t1_struct.id = local_struct.id) order by 1
----
10
20
30

# Bug 39b: struct field in SELECT of mixed join — with explicit alias
statement error
select rpc.t1_struct.info.val from rpc.t1_struct as ts join local_struct on (rpc.t1_struct.id = local_struct.id) order by 1
----
not found

# Bug 39c: struct field in WHERE of mixed join
query I
select rpc.t1_struct.id from rpc.t1_struct join local_struct on (rpc.t1_struct.id = local_struct.id) where rpc.t1_struct.info.val > 15 order by 1
----
2
3

# Bug 40: RenameTableInExpr did not handle schema-qualified struct field access in 4+-part refs;
# main.t1_struct.info.val (4-part after catalog stripping) was left unchanged, causing binder errors.
# Fix: Case 4 strips the schema prefix and renames: main.t1_struct.info.val -> alias.info.val.

# Bug 40a: schema-qualified struct field in SELECT — no alias
query I
select rpc.main.t1_struct.info.val from rpc.main.t1_struct join local_struct on (rpc.main.t1_struct.id = local_struct.id) order by 1
----
10
20
30

# Bug 40b: schema-qualified struct field in SELECT — with alias
statement error
select rpc.main.t1_struct.info.val from rpc.main.t1_struct as ts join local_struct on (rpc.main.t1_struct.id = local_struct.id) order by 1
----
not found

# Bug 40c: schema-qualified struct field in WHERE
query I
select rpc.main.t1_struct.id from rpc.main.t1_struct join local_struct on (rpc.main.t1_struct.id = local_struct.id) where rpc.main.t1_struct.info.val > 15 order by 1
----
2
3

statement ok
drop table local_struct;


# Bug 41: Rewrite(BaseTableRef) Case 2 only checked TABLE_ENTRY in local catalogs, not VIEW_ENTRY.
# A local view without a catalog qualifier was classified as SINGLE_REMOTE and pushed to quack.
# Fix: also check VIEW_ENTRY in the local catalog search loop.

statement ok
create view local_v as select * from range(5) t(i)

# Verify local view is usable locally
query I
select count(*) from local_v
----
5

# Mixed query: local view + remote table; without fix local_v incorrectly pushed -> error.
query I
select count(*) from rpc.t1 join local_v on (rpc.t1.i = local_v.i)
----
5

query I
select local_v.i from rpc.t1 join local_v on (rpc.t1.i = local_v.i) order by 1
----
0
1
2
3
4

statement ok
drop view local_v

statement ok db1:con1
call quack_stop('quack:localhost')
