# name: test/remote_pushdown/remote_pushdown_bugfix.test
# description: Regression tests for specific bugs in RemotePushdownOptimizer
# group: [remote_pushdown]

require quack

require httpfs

statement ok db1:con1
call quack_serve('quack:localhost', token='asdf');

statement ok db1:con1
create table t1(i int);

statement ok db1:con1
insert into t1 from range(10);

statement ok db1:con1
create table t2(i int);

statement ok db1:con1
insert into t2 values (5), (6), (7), (8), (9), (10), (11), (12), (13), (14);

statement ok
attach 'quack:localhost' as rpc (token 'asdf')

statement ok
create table local_t(local_col int);

statement ok
insert into local_t from range(10);

# ============================================================
# Bug 1: StripCatalogName(SetOperationNode) did not strip
# modifiers (ORDER BY expressions).
#
# A fully-remote UNION/INTERSECT/EXCEPT with ORDER BY using
# catalog-qualified column refs (e.g. rpc.t1.i) must have the
# catalog prefix stripped before the SQL is sent to the remote
# server. Without the fix the remote fails with
# "Catalog 'rpc' does not exist".
# ============================================================

# UNION ALL with catalog-qualified ORDER BY: pushed and produces correct order
query II
explain select i from rpc.t1 union all select i from rpc.t1 order by rpc.t1.i
----
physical_plan	<!REGEX>:.*UNION.*

query I
select i from rpc.t1 union all select i from rpc.t1 order by rpc.t1.i limit 4
----
0
0
1
1

# UNION (dedup) with catalog-qualified ORDER BY DESC
query I
select i from rpc.t1 union select i from rpc.t1 order by rpc.t1.i desc limit 3
----
9
8
7

# INTERSECT with catalog-qualified ORDER BY
# t1 ∩ t2 = {5..9}; ascending order
query I
select i from rpc.t1 intersect select i from rpc.t2 order by rpc.t1.i
----
5
6
7
8
9

# EXCEPT with catalog-qualified ORDER BY
# t1 - t2 = {0..4}; ascending order
query I
select i from rpc.t1 except select i from rpc.t2 order by rpc.t1.i
----
0
1
2
3
4

# ============================================================
# Bug 2: StripCatalogName(JoinRef) did not strip the JOIN ON
# condition expressions.
#
# A JOIN ON condition with catalog-qualified column refs (e.g.
# rpc.t1.i = t2.i) must have the catalog prefix stripped
# before the SQL is sent to the remote server.
# ============================================================

# JOIN ON with catalog-qualified left column: rpc.t1.i stripped to t1.i
query II
explain select count(*) from rpc.t1 join rpc.t1 t2 on rpc.t1.i = t2.i
----
physical_plan	<!REGEX>:.*JOIN.*

query I
select count(*) from rpc.t1 join rpc.t1 t2 on rpc.t1.i = t2.i
----
10

# JOIN ON with both sides catalog-qualified: rpc.t1.i and rpc.t2.i both stripped
# t1={0..9}, t2={5..14}: join on equal values gives {5,6,7,8,9} -> 5 rows
query II
explain select count(*) from rpc.t1 join rpc.t2 on rpc.t1.i = rpc.t2.i
----
physical_plan	<!REGEX>:.*JOIN.*

query I
select count(*) from rpc.t1 join rpc.t2 on rpc.t1.i = rpc.t2.i
----
5

# JOIN ON with catalog-qualified filter: rpc.t1.i < 5 and rpc.t1.i = t2.i
# t1 rows where i < 5: {0,1,2,3,4}; t2 has i in {5..14}: no overlap -> 0 rows
query I
select count(*) from rpc.t1 join rpc.t2 on rpc.t1.i = rpc.t2.i and rpc.t1.i < 5
----
0

# ============================================================
# Bug 3: Rewrite(JoinRef) did not analyze the JOIN ON condition.
#
# A local macro in a JOIN ON condition must block pushdown of
# the join so that the macro executes locally.
# Without the fix the whole join is pushed to remote where the
# macro doesn't exist, causing an error.
# ============================================================

statement ok
create macro double_it(x) as x * 2;

# Local macro in JOIN ON blocks full pushdown; but two separately-scanned remote tables
# hit the "multiple streaming scans" limitation, so the query errors rather than returning results
statement error
select count(*) from rpc.t1 a join rpc.t2 b on double_it(a.i) = b.i
----
Multiple streaming scans

# Functional: local macro in WHERE on single remote table (avoids multiple-streaming-scan limitation)
# double_it(i) > 10 -> i > 5 -> {6,7,8,9} = 4 rows
query I
select count(*) from rpc.t1 where double_it(i) > 10
----
4

# Local macro with compound filter: double_it(i) in [10,14] -> i in {5,6,7} = 3 rows
query I
select count(*) from rpc.t1 where double_it(i) >= 10 and double_it(i) <= 14
----
3

statement ok
drop macro double_it;

# ============================================================
# Bug 4 (join duplicate column names):
# Pushing a SELECT with a JOIN in FROM whose output column list
# contains two items with the same name (e.g. a.i and b.i both
# resolve to "i") previously crashed with an internal
# "duplicate column name" binding error inside quack_query_by_name.
#
# The fix: FinishPushdown detects that the SELECT list would
# expose duplicate names and skips the pushdown.  The query then
# falls back to native remote scanning, which in quack results in
# the documented "Multiple streaming scans" limitation rather than
# an unexpected internal error.
# ============================================================

# Explicit duplicate output names from a self-join: skip pushdown, fail gracefully
statement error
select a.i, b.i from rpc.t1 a join rpc.t1 b on a.i + 1 = b.i
----
Multiple streaming scans

# Verify that the alias-based workaround still works correctly
query II
select a.i as ai, b.i as bi from rpc.t1 a join rpc.t1 b on a.i + 1 = b.i where a.i < 3 order by ai
----
0	1
1	2
2	3

# ============================================================
# Bug 6: FinishPushdown(TableRef&) with a JoinRef loses table aliases.
#
# When the FROM clause is an all-remote join but the SELECT list
# has a local expression (e.g. a local macro), the optimizer used
# to wrap the JoinRef in SELECT * FROM quack_query_by_name(...)
# and put the local expression in an outer SELECT. The wrapping
# strips all table aliases, so "a.i" in the outer SELECT could not
# be resolved, crashing with an internal "table not found" error.
#
# The fix: skip JoinRef pushdown in FinishPushdown(TableRef&);
# the join falls back to native remote scanning which hits
# "Multiple streaming scans" (the documented limitation) instead
# of an unexpected internal error.
# ============================================================

statement ok
create macro double_it(x) as x * 2;

# Local macro in SELECT over a 2-table remote join: must produce
# "Multiple streaming scans", NOT an internal "table a not found"
statement error
select double_it(a.i) from rpc.t1 a join rpc.t2 b on a.i = b.i
----
Multiple streaming scans

statement ok
drop macro double_it;

# ============================================================
# Bug 5: PushdownSubqueries was not called for GROUP BY
# expressions and ORDER BY modifiers when the whole query
# could not be pushed.
#
# When a query mixes local and remote, any remote subqueries
# in GROUP BY or ORDER BY should still be pushed to the remote
# individually for efficiency.
# ============================================================

# Scalar subquery in ORDER BY: query is mixed (local_t + remote subquery in ORDER BY)
# local_t has {0..9}; order by (max(rpc.t1.i) - local_col) = (9 - local_col) ASC
# smallest sort key first: local_col=9 → key=0 (first), local_col=8 → key=1, local_col=7 → key=2
query I
select local_col from local_t
order by (select max(i) from rpc.t1) - local_col
limit 3
----
9
8
7

# Scalar subquery in ORDER BY ascending
query I
select local_col from local_t
order by local_col - (select min(i) from rpc.t1)
limit 3
----
0
1
2

# Scalar subquery in GROUP BY: mixed query with remote scalar in GROUP BY expression
# local_t has {0..9}; group by (local_col % (select max(i) from rpc.t1))
# max(i) = 9; local_col % 9 for {0..9}: {0,1,2,3,4,5,6,7,8,0} -> 9 distinct buckets (0..8)
query I
select count(distinct bucket) from (
  select local_col % (select max(i) from rpc.t1) as bucket from local_t
) sub
----
9

# ============================================================
# Bug 7: Rewrite(DML) did not guard on target-table locality.
#
# When the DML target table is LOCAL but the condition or source
# contains a remote subquery, Merge(NO_CATALOG, SINGLE_REMOTE)
# previously returned SINGLE_REMOTE, causing the optimizer to push
# the whole DML to the remote server where the local table does not
# exist (resulting in "table not found" or similar errors).
#
# The fix: check the target table result first; if not remote,
# return UNKNOWN immediately and push only individual remote
# subqueries inside condition/FROM for efficiency.
# ============================================================

# DELETE FROM local table with remote scalar subquery in WHERE:
# Optimizer must NOT push the DELETE, but the subquery should be
# pushed individually. local_t = {0..9}; max(rpc.t1.i) = 9;
# delete where local_col > 9 -> deletes 0 rows; count stays 10.
query I
select count(*) from local_t
----
10

statement ok
delete from local_t where local_col > (select max(i) from rpc.t1)

query I
select count(*) from local_t
----
10

# Deleting rows that DO exist: local_col IN (SELECT ... FROM rpc.t1)
# t1={0..9}; delete local_col in {0,1,2} -> 3 rows removed; 7 remain
statement ok
delete from local_t where local_col in (select i from rpc.t1 where i < 3)

query I
select count(*) from local_t
----
7

statement ok
insert into local_t from range(3)

# UPDATE local table with remote scalar subquery in SET:
# local_t={0..9}; set local_col = local_col + max(rpc.t1.i)
# max = 9; so all values increase by 9; first 3 become {9,10,11}
statement ok
update local_t set local_col = local_col + (select max(i) from rpc.t1) where local_col < 3

query I
select count(*) from local_t where local_col >= 9
----
4

# Restore
statement ok
update local_t set local_col = local_col - (select max(i) from rpc.t1) where local_col >= 9 and local_col <= 11

# INSERT into local table from remote SELECT:
# INSERT INTO local_t SELECT i+100 FROM rpc.t1 WHERE i < 3 -> 3 rows {100,101,102}
statement ok
insert into local_t select i + 100 from rpc.t1 where i < 3

query I
select count(*) from local_t where local_col >= 100
----
3

statement ok
delete from local_t where local_col >= 100

# ============================================================
# Bug 8: Rewrite(BaseTableRef) returned NO_CATALOG_REFERENCED
# for local tables with an explicit catalog prefix.
#
# Merge(NO_CATALOG, SINGLE_REMOTE) = SINGLE_REMOTE, so a query
# like `SELECT * FROM memory.main.local_t WHERE local_col IN
# (SELECT i FROM rpc.t1)` was misclassified as all-remote and
# pushed to the remote server where memory.main.local_t does
# not exist (crash / "table not found").
#
# The fix: local BaseTableRefs in Case 1 (explicit catalog) now
# return UNKNOWN_CATALOG_REFERENCE so Merge correctly produces
# UNKNOWN instead of SINGLE_REMOTE.
# ============================================================

# Reset local_t to a known state
statement ok
drop table local_t

statement ok
create table local_t(local_col int);

statement ok
insert into local_t from range(10);

# Scalar subquery in WHERE with explicit local catalog: must NOT push
# local_t = {0..9}; local_col IN {0..4} -> 5 rows
query I
select count(*) from memory.main.local_t where local_col in (select i from rpc.t1 where i < 5)
----
5

# Result sanity: count with explicit-catalog subquery produces same result as unqualified
query I
select count(*) from local_t where local_col >= (select min(i) from rpc.t1)
----
10

statement ok
drop table local_t

# ============================================================
# Bug 9: Rewrite(SubqueryRef) did not save/restore
# local_table_names / local_table_column_names, so column names
# of inner local tables leaked into the outer scope.
#
# Symptom: a WHERE scalar subquery that is purely remote was
# blocked from pushdown when a preceding FROM-clause subquery
# contained a local table whose column names matched an
# unqualified column ref inside the scalar subquery.
# HasLocalTableReference would find the leaked name in
# local_table_column_names and (incorrectly) report the
# scalar subquery as correlated, preventing its pushdown.
# Correctness was preserved but performance degraded.
#
# The fix: save/restore the tracking sets around the inner
# Rewrite call in Rewrite(SubqueryRef&), mirroring the same
# pattern used in Rewrite(ParsedExpression&) for SUBQUERY.
# ============================================================

# Create a local table whose column name ('i') collides with the remote table's column.
# After the fix the FROM-clause subquery's inner 'i' no longer leaks into the outer scope.
statement ok
create table local_i(i int);

statement ok
insert into local_i from range(5);

# FROM clause has a local SubqueryRef (wrapping local_i with column 'i').
# WHERE has a purely-remote IN subquery that also uses unqualified 'i'.
# With the bug: processing (select * from local_i) sq adds 'i' to local_table_column_names,
# which leaks into the outer scope; HasLocalTableReference then incorrectly reports the IN
# subquery as correlated, preventing its individual pushdown.
# With the fix: save/restore clears the leaked 'i' after processing sq, so the IN subquery
# is correctly identified as uncorrelated and pushed to the remote.
# local_i={0..4}; IN filter keeps i in {0,1,2} → 3 rows; count(*) = 3.
query I
select count(*) from (select * from local_i) sq
where sq.i in (select i from rpc.t1 where i < 3)
----
3

statement ok
drop table local_i

# ============================================================
# Bug 10: Rewrite/StripCatalogName for DML (INSERT/DELETE/UPDATE)
# did not process the node's own cte_map.
#
# When a DML statement has a WITH clause (e.g. WITH cte AS (...) DELETE ...),
# the CTE body was invisible to the optimizer. A CTE whose body references a
# local table was not detected as local, so a CTE name not found in any local
# catalog would be misclassified as SINGLE_REMOTE (when exactly one remote is
# in the search path). The whole DML was then pushed to the remote, which
# failed with "table <local_t> not found" when the CTE body referenced it.
#
# Similarly, StripCatalogName did not strip catalog names from CTE bodies in
# DML statements, so catalog-qualified refs inside the CTE were sent verbatim
# to the remote server, causing "Catalog 'rpc' does not exist" errors.
# ============================================================

# Restore local_t for DML CTE tests
statement ok
create table local_t(local_col int);

statement ok
insert into local_t from range(10);

# DELETE with all-remote CTE: CTE body from rpc.t1, should be pushed.
# t1={0..9}; cte = rows where i > 7 = {8,9}; delete local_col in {8,9} -> 2 removed; 8 remain.
statement ok
with remote_cte as (select i from rpc.t1 where i > 7)
delete from local_t where local_col in (select i from remote_cte)

query I
select count(*) from local_t
----
8

statement ok
insert into local_t values (8), (9)

# DELETE with local CTE: must NOT be pushed to remote.
# cte body references local_t2 (local); delete local_col in {0,1,2} -> 3 removed; 7 remain.
statement ok
create table local_t2(v int);

statement ok
insert into local_t2 values (0), (1), (2);

statement ok
with local_cte as (select v from local_t2)
delete from local_t where local_col in (select v from local_cte)

query I
select count(*) from local_t
----
7

statement ok
insert into local_t values (0), (1), (2)

# INSERT with all-remote CTE: CTE body from rpc.t1, source SELECT from CTE.
# cte = {0..4}; insert {100,101,102,103,104} into local_t -> 5 new rows added.
statement ok
with remote_cte as (select i from rpc.t1 where i < 5)
insert into local_t select local_col + 100 from (select i as local_col from remote_cte) sub

query I
select count(*) from local_t where local_col >= 100
----
5

statement ok
delete from local_t where local_col >= 100

# UPDATE with all-remote CTE: CTE provides max value from remote, applied to local table.
# max(rpc.t1.i) = 9; update local_t set local_col = local_col + 9 where local_col < 3
# -> local_col {0,1,2} become {9,10,11}; count of local_col >= 9 was 1 (the 9 already there)
# now becomes 4 ({9,9,10,11})
statement ok
with remote_max as (select max(i) as m from rpc.t1)
update local_t set local_col = local_col + (select m from remote_max) where local_col < 3

query I
select count(*) from local_t where local_col >= 9
----
4

statement ok
drop table local_t

statement ok
drop table local_t2

statement ok db1:con1
call quack_stop('quack:localhost')
