# name: test/remote_pushdown/remote_pushdown_dml.test
# description: INSERT/UPDATE/DELETE pushdown for remote catalogs
# group: [remote_pushdown]

require quack

require httpfs

statement ok db1:con1
call quack_serve('quack:localhost', token='asdf');

statement ok db1:con1
create table t1(i int);

statement ok db1:con1
insert into t1 from range(10);

statement ok db1:con1
create table t2(j int);

statement ok db1:con1
insert into t2 values (3), (4), (5), (6);

statement ok
attach 'quack:localhost' as rpc (token 'asdf')

# Initial state: t1 = {0..9}
query I
select count(*) from rpc.t1
----
10

# --- INSERT ---

statement ok
insert into rpc.t1 select i + 10 from rpc.t1

# t1 now has {0..19}
query I
select count(*) from rpc.t1
----
20

query II
select min(i), max(i) from rpc.t1
----
0	19

statement ok
insert into rpc.t1 select i + 100 from rpc.t1 where i < 5

# adds {100,101,102,103,104} → total 25 rows
query I
select count(*) from rpc.t1
----
25

query I
select count(*) from rpc.t1 where i >= 100
----
5

statement ok
insert into rpc.t1 select i + 200 from (select i from rpc.t1 where i >= 100) sub

# adds {300,301,302,303,304} → total 30 rows
query I
select count(*) from rpc.t1
----
30

# --- DELETE ---

statement ok
delete from rpc.t1 where i >= 200

query I
select count(*) from rpc.t1
----
25

statement ok
delete from rpc.t1 where i >= 100

# t1 = {0..19}
query I
select count(*) from rpc.t1
----
20

# DELETE with subquery: max(i) where i < 15 = 14; removes {15..19}
statement ok
delete from rpc.t1 where i > (select max(i) from rpc.t1 where i < 15)

query I
select count(*) from rpc.t1
----
15

# DELETE with IN subquery: removes {10..14}
statement ok
delete from rpc.t1 where i in (select i from rpc.t1 where i >= 10)

# t1 = {0..9}
query I
select count(*) from rpc.t1
----
10

query II
select min(i), max(i) from rpc.t1
----
0	9

# --- UPDATE ---

statement ok
update rpc.t1 set i = i + 100

# t1 = {100..109}
query II
select min(i), max(i) from rpc.t1
----
100	109

statement ok
update rpc.t1 t1 set i = t1.i where t1.i in (select i from rpc.t1 where i >= 105)

query I
select count(*) from rpc.t1 where i >= 105
----
5

statement ok
update rpc.t1 set i = i - 100

query II
select min(i), max(i) from rpc.t1
----
0	9

# i=3 → 7; t1 now has two rows where i=7
statement ok
update rpc.t1 set i = i * 2 + 1 where i = 3

query I
select count(*) from rpc.t1 where i = 7
----
2

# --- Mixed DML: local target with remote USING / FROM ---

statement ok db1:con1
delete from t1 where true

statement ok db1:con1
insert into t1 from range(10);

statement ok
create table local_t(i int);

statement ok
insert into local_t from range(10);

# DELETE USING: catalog-qualified ref rpc.t1.i stripped to t1.i after individual pushdown
statement ok
delete from local_t using rpc.t1 where local_t.i = rpc.t1.i and rpc.t1.i > 5

# rows 6-9 deleted; local_t = {0..5}
query I
select count(*) from local_t
----
6

statement ok
insert into local_t from range(6, 10);

# UPDATE FROM: catalog-qualified ref rpc.t1.i stripped in SET expression
statement ok
update local_t set i = rpc.t1.i * 2 from rpc.t1 where local_t.i = rpc.t1.i

# local_t = {0,2,4,6,8,10,12,14,16,18}; rows > 10: {12,14,16,18} = 4
query I
select count(*) from local_t where i > 10
----
4

statement ok
drop table local_t

# Explicit-alias forms: catalog-qualified refs must resolve via the alias after stripping
statement ok
create table local_alias(k int);

statement ok
insert into local_alias from range(10);

# DELETE USING with explicit alias: rpc.t1.i in WHERE must resolve to rt1.i
statement error
delete from local_alias using rpc.t1 AS rt1 where local_alias.k = rpc.t1.i and rpc.t1.i > 5
----
not found

statement ok
delete from local_alias using rpc.t1 AS rt1 where local_alias.k = rt1.i and rt1.i > 5

# rows 6-9 deleted; local_alias = {0..5}
query I
select count(*) from local_alias
----
6

statement ok
insert into local_alias select k + 4 from local_alias where k > 1;

# UPDATE FROM with explicit alias: rpc.t1.i must resolve to rt1.i
statement error
update local_alias set k = rpc.t1.i * 2 from rpc.t1 AS rt1 where local_alias.k = rpc.t1.i
----
not found

statement ok
update local_alias set k = rt1.i * 2 from rpc.t1 AS rt1 where local_alias.k = rt1.i

# each row k→k*2; rows > 10: {12,14,16,18} = 4
query I
select count(*) from local_alias where k > 10
----
4

statement ok
drop table local_alias

# --- DELETE USING with mixed JoinRef (remote + local) in USING clause ---
# rpc.t1 is pushed individually; JoinRef result is UNKNOWN; DELETE runs locally.

statement ok
create table local_del(val int);

statement ok
insert into local_del from range(10);

statement ok
create table local_j(val int);

statement ok
insert into local_j values (3), (4), (5), (6);

# rpc.t1={0..9}, local_j={3,4,5,6}; removes {3,4,5,6} from local_del
statement ok
delete from local_del
    using rpc.t1 join local_j on (rpc.t1.i = local_j.val)
    where local_del.val = rpc.t1.i

query I
select count(*) from local_del
----
6

query II
select min(val), max(val) from local_del
----
0	9

statement ok
drop table local_del

statement ok
drop table local_j

# --- All-remote DELETE USING (same remote catalog) ---

# rpc.t1={0..9}, rpc.t2.j={3,4,5,6}; removes {3,4,5,6} from t1
statement ok
delete from rpc.t1 using rpc.t2 where rpc.t1.i = rpc.t2.j

query I
select count(*) from rpc.t1
----
6

query II
select min(i), max(i) from rpc.t1
----
0	9

statement ok db1:con1
delete from t1 where true

statement ok db1:con1
insert into t1 from range(10);

# --- All-remote UPDATE FROM (same remote catalog) ---

# rpc.t2.j={3,4,5,6}; rows 3,4,5,6 become 13,14,15,16
statement ok
update rpc.t1 set i = rpc.t1.i + 10 from rpc.t2 where rpc.t1.i = rpc.t2.j

query I
select count(*) from rpc.t1 where i >= 10
----
4

query II
select min(i), max(i) from rpc.t1 where i >= 10
----
13	16

statement ok db1:con1
drop table t2;

statement ok db1:con1
delete from t1 where true

statement ok db1:con1
insert into t1 from range(10);

statement ok db1:con1
call quack_stop('quack:localhost')
