# name: test/remote_pushdown/remote_pushdown_returning_local.test
# description: Regression tests for DML RETURNING with local expressions in RemotePushdownOptimizer
# group: [remote_pushdown]

require quack

require httpfs

statement ok db1:con1
call quack_serve('quack:localhost', token='asdf');

statement ok db1:con1
create table t1(i int);

statement ok db1:con1
insert into t1 from range(10);

statement ok db1:con1
create table t3(i int, j int);

statement ok db1:con1
insert into t3 values (1, 10), (2, 20), (3, 30);

statement ok
attach 'quack:localhost' as rpc (token 'asdf')

# Bug 18: TryPushDMLWithLocalReturning — DML on remote table with local-only expression in RETURNING
# must split: push DML with raw column RETURNING, evaluate local expressions over results locally.

mode skip unsupported_returning

statement ok
CREATE OR REPLACE MACRO local_double(x) AS (x * 2);

# INSERT into remote table with mixed RETURNING: remote returns i=77, local applies local_double(77)=154.
query II
INSERT INTO rpc.t1 VALUES (77) RETURNING i, local_double(i) AS doubled
----
77	154

# Verify the row was actually inserted on the remote.
query I
SELECT i FROM rpc.t1 WHERE i = 77
----
77

statement ok
DELETE FROM rpc.t1 WHERE i = 77

statement ok db1:con1
INSERT INTO t1 VALUES (88);

# DELETE from remote table with mixed RETURNING: remote returns i=88, local applies local_double(88)=176.
query II
DELETE FROM rpc.t1 WHERE i = 88 RETURNING i, local_double(i) AS doubled
----
88	176

query I
SELECT count(*) FROM rpc.t1 WHERE i = 88
----
0

statement ok db1:con1
INSERT INTO t1 VALUES (99);

# UPDATE on remote table with mixed RETURNING: remote returns i=100, local applies local_double(100)=200.
query II
UPDATE rpc.t1 SET i = i + 1 WHERE i = 99 RETURNING i, local_double(i) AS doubled
----
100	200

query I
SELECT i FROM rpc.t1 WHERE i = 100
----
100

statement ok
DELETE FROM rpc.t1 WHERE i = 100

statement ok
DROP MACRO local_double;

# Bug 19: TryPushDMLWithLocalReturning with RETURNING * — remote RETURNING must use * so all columns
# are returned; without the fix only macro-argument columns were returned, silently dropping others.

statement ok
CREATE OR REPLACE MACRO local_double(x) AS (x * 2);

# INSERT with RETURNING * + local macro: remote returns (77, 770), local adds doubled=154.
query III
INSERT INTO rpc.t3 VALUES (77, 770) RETURNING *, local_double(i) AS doubled
----
77	770	154

# DELETE with RETURNING * + local macro: remote returns (77, 770), local adds doubled=154.
query III
DELETE FROM rpc.t3 WHERE i = 77 RETURNING *, local_double(i) AS doubled
----
77	770	154

query I
SELECT count(*) FROM rpc.t3 WHERE i = 77
----
0

statement ok
DROP MACRO local_double;

# Bug 20: TryPushDMLWithLocalReturning with table-qualified star (t.*) — StripAllTableQualifiers must
# clear StarExpression::relation_name so "t3.*" becomes "*" in the outer SELECT.

statement ok
CREATE OR REPLACE MACRO local_double(x) AS (x * 2);

# INSERT with table-qualified star: remote executes "INSERT ... RETURNING *", outer strips "t3.*" -> "*".
query III
INSERT INTO rpc.t3 VALUES (88, 880) RETURNING t3.*, local_double(i) AS doubled
----
88	880	176

# DELETE with table-qualified star.
query III
DELETE FROM rpc.t3 WHERE i = 88 RETURNING t3.*, local_double(i) AS doubled
----
88	880	176

query I
SELECT count(*) FROM rpc.t3 WHERE i = 88
----
0

statement ok
DROP MACRO local_double;

mode unskip

statement ok db1:con1
call quack_stop('quack:localhost')
