# name: test/remote_pushdown/remote_pushdown_advanced.test
# description: Advanced edge cases: window functions, QUALIFY, HAVING, DISTINCT ON, set ops, INSERT ON CONFLICT
# group: [remote_pushdown]

require quack

require httpfs

statement ok db1:con1
call quack_serve('quack:localhost', token='asdf');

# t1 = {0..9}, t2 = {5..14}
statement ok db1:con1
create table t1(i int);

statement ok db1:con1
insert into t1 from range(10);

statement ok db1:con1
create table t2(i int);

statement ok db1:con1
insert into t2 values (5), (6), (7), (8), (9), (10), (11), (12), (13), (14);

# t3: table with a primary key for ON CONFLICT tests
statement ok db1:con1
create table t3(i int primary key, v int);

statement ok db1:con1
insert into t3 values (1, 10), (2, 20), (3, 30);

statement ok
attach 'quack:localhost' as rpc (token 'asdf')

statement ok
create table local_t(i int);

statement ok
insert into local_t from range(10);

# --- Window functions ---

# Running sum pushed to remote (no SEQ_SCAN in local plan)
query II
explain select i, sum(i) over (order by i) from rpc.t1 where i < 5
----
physical_plan	<!REGEX>:.*SEQ_SCAN.*

# running sum: 0, 1, 3, 6, 10
query II
select i, sum(i) over (order by i) as running_sum
from rpc.t1 where i < 5
order by i
----
0	0
1	1
2	3
3	6
4	10

query II
select i, row_number() over (order by i) as rn
from rpc.t1 where i >= 7
order by i
----
7	1
8	2
9	3

# Catalog-qualified column refs inside window spec stripped before push
query II
explain select rpc.t1.i, rank() over (order by rpc.t1.i) from rpc.t1 where rpc.t1.i < 5
----
physical_plan	<!REGEX>:.*SEQ_SCAN.*

query II
select rpc.t1.i, rank() over (order by rpc.t1.i) as rnk
from rpc.t1 where rpc.t1.i < 5
order by rpc.t1.i
----
0	1
1	2
2	3
3	4
4	5

# PARTITION BY in window function
query III
select i % 2 as parity, i, row_number() over (partition by i % 2 order by i) as rn
from rpc.t1
where i < 6
order by i
----
0	0	1
1	1	1
0	2	2
1	3	2
0	4	3
1	5	3

# --- QUALIFY clause ---

# QUALIFY to keep only the row with max i per parity group
query II
explain select i, row_number() over (partition by i % 2 order by i desc) as rn
from rpc.t1
qualify rn = 1
----
physical_plan	<!REGEX>:.*SEQ_SCAN.*

# even parity max=8, odd parity max=9
query I
select i from rpc.t1
qualify row_number() over (partition by i % 2 order by i desc) = 1
order by i
----
8
9

# QUALIFY with catalog-qualified column ref stripped before push
query I
select rpc.t1.i from rpc.t1
qualify row_number() over (order by rpc.t1.i) <= 3
order by rpc.t1.i
----
0
1
2

# --- HAVING with catalog-qualified column refs ---

query II
explain select i % 3 as bucket, count(*) from rpc.t1 group by bucket having count(*) > 3
----
physical_plan	<!REGEX>:.*SEQ_SCAN.*

# bucket 0→4 rows, buckets 1,2→3 rows each; only bucket 0 passes count>3
query II
select i % 3 as bucket, count(*) as cnt
from rpc.t1
group by bucket
having count(*) > 3
order by bucket
----
0	4

# HAVING with catalog-qualified ref
query II
select rpc.t1.i % 2 as parity, count(*)
from rpc.t1
group by parity
having count(*) >= 5
order by parity
----
0	5
1	5

# --- DISTINCT ON: catalog-qualified refs in DISTINCT modifier stripped before push ---

query II
explain select distinct on (rpc.t1.i) rpc.t1.i from rpc.t1 order by rpc.t1.i
----
physical_plan	<!REGEX>:.*SEQ_SCAN.*

# t1={0..9}: 10 distinct values
query I
select count(*) from (
  select distinct on (rpc.t1.i) rpc.t1.i from rpc.t1
) sub
----
10

query I
select distinct on (rpc.t1.i % 3) rpc.t1.i
from rpc.t1
order by rpc.t1.i % 3, rpc.t1.i
----
0
1
2

# --- LIMIT with scalar subquery: catalog-qualified refs in LIMIT modifier stripped before push ---

# LIMIT = count of t1 rows where i < 3 = 3
query I
select i from rpc.t1
order by i
limit (select count(*) from rpc.t1 where rpc.t1.i < 3)
----
0
1
2

# LIMIT with catalog-qualified ref in subquery filter
query I
select count(*) from (
  select i from rpc.t1
  order by i desc
  limit (select max(rpc.t1.i) from rpc.t1 where rpc.t1.i < 5)
) sub
----
4

# OFFSET with catalog-qualified ref in subquery
query I
select i from rpc.t1
order by i
limit 3 offset (select min(rpc.t1.i) from rpc.t1 where rpc.t1.i > 2)
----
3
4
5

# --- EXCEPT ALL / INTERSECT ALL ---

# INTERSECT ALL: all remote → pushed
query II
explain select i from rpc.t1 intersect all select i from rpc.t2
----
physical_plan	<!REGEX>:.*INTERSECT.*

# t1∩t2 = {5,6,7,8,9} → 5 rows
query I
select count(*) from (select i from rpc.t1 intersect all select i from rpc.t2)
----
5

# EXCEPT ALL: all remote → pushed
query II
explain select i from rpc.t1 except all select i from rpc.t2
----
physical_plan	<!REGEX>:.*EXCEPT.*

# t1-t2 = {0,1,2,3,4} → 5 rows
query I
select count(*) from (select i from rpc.t1 except all select i from rpc.t2)
----
5

query I
select sum(i) from (select i from rpc.t1 except all select i from rpc.t2)
----
10

# --- INSERT ON CONFLICT (UPSERT) ---

# conflict on i=1 → update v to 999
statement ok
insert into rpc.t3 values (1, 999) on conflict (i) do update set v = excluded.v

query II
select i, v from rpc.t3 where i = 1
----
1	999

statement ok
update rpc.t3 set v = 10 where i = 1

# ON CONFLICT DO NOTHING: duplicate i=2 silently ignored
statement ok
insert into rpc.t3 values (2, 999) on conflict (i) do nothing

query II
select i, v from rpc.t3 where i = 2
----
2	20

statement ok
insert into rpc.t3 values (4, 40) on conflict (i) do nothing

query I
select count(*) from rpc.t3
----
4

statement ok
delete from rpc.t3 where i = 4

# --- Correlated subquery in SELECT list ---

query II
explain select i, (select count(*) from rpc.t2 where rpc.t2.i > rpc.t1.i) as cnt from rpc.t1 where i >= 8
----
physical_plan	<!REGEX>:.*SEQ_SCAN.*

# i=8: 6 rows in t2 where j>8; i=9: 5 rows
query II
select i, (select count(*) from rpc.t2 where rpc.t2.i > rpc.t1.i) as cnt
from rpc.t1
where i >= 8
order by i
----
8	6
9	5

# --- Mixed: remote subquery in LIMIT of a local+remote query ---

# local_t={0..9}; LIMIT = count of t1 rows where i < 4 = 4
query I
select count(*) from (
  select i from local_t order by i
  limit (select count(*) from rpc.t1 where i < 4)
) sub
----
4

# --- VALUES list in FROM clause ---

query II
explain select * from rpc.t1 where i in (values (3), (7), (9))
----
physical_plan	<!REGEX>:.*SEQ_SCAN.*

query I
select i from rpc.t1 where i in (values (3), (7), (9)) order by i
----
3
7
9

# --- Multiple aggregates and complex GROUP BY ---

query III
select i % 3 as bucket, min(i), max(i)
from rpc.t1
group by bucket
order by bucket
----
0	0	9
1	1	7
2	2	8

# --- Subquery in FROM with alias used in outer WHERE ---

query I
select count(*) from (select i * 2 as doubled from rpc.t1) sub where doubled > 10
----
4

# --- Self-join with filter ---

query II
explain select count(*) from rpc.t1 a join rpc.t1 b on a.i + 1 = b.i where a.i < 5
----
physical_plan	<!REGEX>:.*SEQ_SCAN.*

# a.i∈{0..4}, b.i=a.i+1: 5 pairs
query I
select count(*) from rpc.t1 a join rpc.t1 b on a.i + 1 = b.i where a.i < 5
----
5

query II
select a.i as ai, b.i as bi from rpc.t1 a join rpc.t1 b on a.i + 1 = b.i where a.i < 3 order by ai
----
0	1
1	2
2	3

# --- Three-table JOIN ---

query II
explain
select count(*) from rpc.t1 a
join rpc.t1 b on a.i = b.i
join rpc.t2 c on b.i = c.i
----
physical_plan	<!REGEX>:.*SEQ_SCAN.*

# a=b always; b∈t2∩t1={5..9} → 5 rows
query I
select count(*) from rpc.t1 a
join rpc.t1 b on a.i = b.i
join rpc.t2 c on b.i = c.i
----
5

# --- CROSS JOIN ---

query I
select count(*) from rpc.t1 cross join (select 1 as x) v
----
10

# --- NATURAL JOIN ---

# t1(i)={0..9}, t2(i)={5..14}: NATURAL JOIN → {5,6,7,8,9} → 5 rows
query II
explain select count(*) from rpc.t1 natural join rpc.t2
----
physical_plan	<!REGEX>:.*SEQ_SCAN.*

query I
select count(*) from rpc.t1 natural join rpc.t2
----
5

# mixed: remote t1 and local local_t (both have column i) → stays local
query II
explain select count(*) from rpc.t1 natural join local_t
----
physical_plan	<REGEX>:.*SEQ_SCAN.*

query I
select count(*) from rpc.t1 natural join local_t
----
10

# --- Lambda expressions ---

# list_transform([1,2,3], x→x+2)=[3,4,5]; i∈{3,4,5} → 3 rows
query I
select count(*) from rpc.t1 where list_contains(list_transform([1, 2, 3], lambda x: x + 2), i)
----
3

# local macro inside lambda forces individual table push
statement ok
create macro my_double(x) as x * 2;

# list_contains([4,6,8], i): i∈{4,6,8} → 3 rows
query I
select count(*) from rpc.t1 where list_contains(list_transform([2, 3, 4], lambda x: my_double(x)), i)
----
3

statement ok
drop macro my_double;

# --- NULL handling ---

statement ok db1:con1
create table nulls(i int);

statement ok db1:con1
insert into nulls values (1), (NULL), (3), (NULL), (5);

# COUNT(*) counts nulls, COUNT(i) skips them
query II
select count(*), count(i) from rpc.nulls
----
5	3

query I
select sum(coalesce(i, 0)) from rpc.nulls
----
9

statement ok db1:con1
drop table nulls

# --- Aggregate without GROUP BY ---

query IIII
select min(i), max(i), sum(i), count(*) from rpc.t1
----
0	9	45	10

# --- FILTER clause on aggregate ---

query II
select
  count(*) filter (where i < 5) as below_5,
  count(*) filter (where i >= 5) as above_eq_5
from rpc.t1
----
5	5

statement ok
drop table local_t

statement ok db1:con1
call quack_stop('quack:localhost')
