# name: test/sql/index/art/create_drop/test_art_create_unique.test
# description: Test unique ART creation
# group: [create_drop]

statement ok
CREATE TABLE t0(c0 INTEGER);

statement ok
CREATE UNIQUE INDEX i0 ON t0(c0);

statement ok
INSERT INTO t0(c0) VALUES (1);

statement error
INSERT INTO t0(c0) VALUES (1);
----
<REGEX>:.*Constraint Error.*Duplicate key.*

query I
SELECT * FROM t0 WHERE t0.c0 = 1;
----
1

statement ok
CREATE TABLE merge_violation (id INT);

statement ok
INSERT INTO merge_violation SELECT range FROM range(2048);

statement ok
INSERT INTO merge_violation SELECT range + 10000 FROM range(2048);

statement ok
INSERT INTO merge_violation VALUES (2047);

statement error
CREATE UNIQUE INDEX idx ON merge_violation(id);
----
<REGEX>:.*Constraint Error.*contains duplicates on indexed column.*

# CREATE UNIQUE INDEX should build over the rows visible to the current transaction.
# A row deleted earlier in the transaction must not participate in duplicate validation.
statement ok
CREATE TABLE tx_delete_unique_index (id INT, x INT);

statement ok
INSERT INTO tx_delete_unique_index VALUES (1, 10), (2, 10);

statement ok
BEGIN TRANSACTION;

statement ok
DELETE FROM tx_delete_unique_index WHERE id = 1;

query I
SELECT COUNT(*) FROM tx_delete_unique_index;
----
1

statement ok
CREATE UNIQUE INDEX tx_delete_unique_index_u ON tx_delete_unique_index(x);

statement ok
COMMIT;
