# name: test/sql/index/art/test_art_node_duplicates.test
# description: ART Node Leaf with remove duplicated keys
# group: [art]

statement ok
CREATE TABLE integers(i integer)

statement ok
CREATE INDEX i_index ON integers(i)

# insert 4 elements
loop i 0 4

statement ok
INSERT INTO integers VALUES (1);

endloop

# verify counts

query I
SELECT COUNT(*) FROM integers WHERE i = 1
----
4

# verify sums

query I
SELECT sum(i) FROM integers WHERE i <= 2
----
4

# now delete all elements

statement ok
DELETE FROM integers WHERE i = 1

# verify counts

query I
SELECT COUNT(*) FROM integers WHERE i = 1
----
0

query I
SELECT COUNT(*) FROM integers
----
0

# insert 1024 elements
loop i 0 1024

statement ok
INSERT INTO integers VALUES (1);

endloop

# verify counts

query I
SELECT COUNT(*) FROM integers WHERE i = 1
----
1024

# verify sums

query I
SELECT sum(i) FROM integers WHERE i <= 2
----
1024

# now delete all elements

statement ok
DELETE FROM integers WHERE i = 1

# verify counts

query I
SELECT COUNT(*) FROM integers WHERE i = 1
----
0

query I
SELECT COUNT(*) FROM integers
----
0

# insert 3000 elements
loop i 0 3000

statement ok
INSERT INTO integers VALUES (1);

endloop

# verify counts

query I
SELECT COUNT(*) FROM integers WHERE i = 1
----
3000

# verify sums

query I
SELECT sum(i) FROM integers WHERE i <= 2
----
3000

# now delete all elements

statement ok
DELETE FROM integers WHERE i = 1

# verify counts

query I
SELECT COUNT(*) FROM integers WHERE i = 1
----
0

query I
SELECT COUNT(*) FROM integers
----
0

statement ok
DROP INDEX i_index

statement ok
DROP TABLE integers
