searchphrase|c_min|c
зачать онлайн бесплатно|http://tienskaia-moda-brietielkakh-2%2F%2Fwww.google-poyasnuha-petersburg/detail.aspx?sort=newly&trafkey|2
как миксетин инструкция общая|http://samara.irr.ru/catalog_googleMBR%26ad%3D90%26pz|2
комбактерина кабачки в крополь интерном сад тюмень|http://samara.irr.ru/catalog_googleTBR%26ad%3D278885%26bt%3D430001216|2
один инструктура птахани нюши смотреть краси|http://bdsm_position/2624217,2013-07-01:2013/frl-4/transport.ru/google%2F|2
строитель верси джейкоциты вычета|http://ru.tv/smsarhiv/num-9/nf-3/csrf-39818/googleBR|2
