# name: test/sql/constraints/primarykey/test_pk_updel_multi_column.test
# description: PRIMARY KEY and update/delete on multiple columns
# group: [primarykey]

statement ok
PRAGMA enable_verification;

statement ok
CREATE TABLE test (a INTEGER, b VARCHAR, PRIMARY KEY(a, b));

statement ok
INSERT INTO test VALUES (11, 'hello'), (12, 'world'), (13, 'blablabla');

statement ok
UPDATE test SET b = 'pandas';

query IT
SELECT * FROM test ORDER BY ALL;
----
11	pandas
12	pandas
13	pandas

statement ok
UPDATE test SET a = a + 3;

query IT
SELECT * FROM test ORDER BY ALL;
----
14	pandas
15	pandas
16	pandas

statement error
UPDATE test SET a = 15 WHERE a = 14;
----
<REGEX>:Constraint Error.*violates primary key constraint.*

statement error
UPDATE test SET a = 4;
----
<REGEX>:Constraint Error.*PRIMARY KEY or UNIQUE constraint violation.*

query IT
SELECT * FROM test ORDER BY a;
----
14	pandas
15	pandas
16	pandas

statement ok
UPDATE test SET a = a - 3;

query IT
SELECT * FROM test ORDER BY ALL;
----
11	pandas
12	pandas
13	pandas

statement ok
DELETE FROM test WHERE a = 12;

query IT
SELECT * FROM test ORDER BY a;
----
11	pandas
13	pandas

statement ok
INSERT INTO test VALUES (12, 'pandas');

query IT
SELECT * FROM test ORDER BY a;
----
11	pandas
12	pandas
13	pandas

statement error
INSERT INTO test VALUES (12, 'pandas');
----
<REGEX>:Constraint Error.*violates primary key constraint.*

statement ok
DELETE FROM test WHERE a = 12;

query IT
SELECT * FROM test ORDER BY a;
----
11	pandas
13	pandas

statement ok
INSERT INTO test VALUES (12, 'other pandas');

statement ok
UPDATE test SET a = 4 WHERE a = 42;

statement ok
UPDATE test SET a = 4 WHERE a = 12;

query IT
SELECT * FROM test ORDER BY a;
----
4	other pandas
11	pandas
13	pandas

statement error
UPDATE test SET b = NULL WHERE a = 13;
----
<REGEX>:Constraint Error.*NOT NULL constraint failed.*
