# name: test/sql/index/art/insert_update_delete/test_art_sel_vector.test
# description: Test ART usage with selection vectors
# group: [insert_update_delete]

statement ok
PRAGMA enable_verification

statement ok
CREATE TABLE source(i INTEGER)

statement ok
INSERT INTO source VALUES (1), (2), (3), (4), (5), (6)

statement ok
CREATE TABLE integers(i INTEGER)

statement ok
CREATE INDEX i_index ON integers using art(i)

# insert with selection vector
statement ok
INSERT INTO integers SELECT * FROM source WHERE i % 2 = 0

query I
SELECT * FROM integers WHERE i<3 ORDER BY 1
----
2

query I
SELECT * FROM integers ORDER BY 1
----
2
4
6

query I
SELECT * FROM integers WHERE i>3 ORDER BY 1
----
4
6

query I
SELECT * FROM integers WHERE i<=3 ORDER BY 1
----
2

query I
SELECT * FROM integers WHERE i>=3 ORDER BY 1
----
4
6

# update with selection vector
statement ok
UPDATE integers SET i=3 WHERE i=4

query I
SELECT * FROM integers WHERE i<3 ORDER BY 1
----
2

query I
SELECT * FROM integers WHERE i<=3 ORDER BY 1
----
2
3

query I
SELECT * FROM integers WHERE i>3 ORDER BY 1
----
6

query I
SELECT * FROM integers WHERE i>=3 ORDER BY 1
----
3
6

# delete with selection vector
statement ok
DELETE FROM integers WHERE i>3

query I
SELECT * FROM integers WHERE i > 0 ORDER BY 1
----
2
3

query I
SELECT * FROM integers WHERE i < 3 ORDER BY 1
----
2

