# name: test/sql/types/union/union_cast.test
# description: Test union to union casts
# group: [union]

statement ok
SET default_null_order='nulls_first';

# Test value -> union casts
statement ok
create table tbl1(u UNION(i32 INT, str VARCHAR));

statement ok
insert into tbl1 values (1) , ('two') , ('three')

query I
SELECT * FROM tbl1;
----
1
two
three


# Test union -> value cast

# cannot cast union to value in the general case 
statement error
SELECT u::int FROM tbl1;

# but we can cast to VARCHAR
query I
SELECT u::varchar FROM tbl1;
----
1
two
three


# Test union -> union cast
statement ok
create table tbl2(u UNION(str VARCHAR, i32 INT, f32 FLOAT));

statement ok
insert into tbl2 values ('five'), (4), (6.0);

query I
SELECT * FROM tbl2;
----
five
4
6.0

query III
SELECT u.i32, u.str, u.f32 FROM tbl2;
----
NULL	five	NULL
4		NULL	NULL
NULL	NULL	6.0

query I
SELECT * FROM tbl2 UNION ALL SELECT * FROM tbl1;
----
five
4
6.0
1
two
three

query I
SELECT * FROM tbl1 UNION ALL SELECT * FROM tbl2;
----
1
two
three
five
4
6.0

query III
SELECT u.i32, u.str, u.f32 FROM tbl2 UNION ALL SELECT u.i32, u.str, NULL FROM tbl1 ORDER BY ALL;
----
NULL	NULL	6.0
NULL	five	NULL
NULL	three	NULL
NULL	two		NULL
1		NULL	NULL
4		NULL	NULL


query I
SELECT * FROM tbl2
----
five
4
6.0

statement ok
INSERT INTO tbl2 SELECT * FROM tbl1;

query I
SELECT * FROM tbl2;
----
five
4
6.0
1
two
three

query I
SELECT u.f32 FROM tbl2;
----
NULL
NULL
6.0
NULL
NULL
NULL


query IIII
SELECT union_tag(u), u.i32, u.str, u.f32 FROM tbl2;
----
str		NULL	five	NULL
i32		4		NULL	NULL
f32		NULL	NULL	6.0
i32		1		NULL	NULL
str		NULL	two		NULL
str		NULL	three	NULL

# Allow explict casts
statement ok
CREATE TABLE tbl3 (u UNION(i INT));

statement ok
INSERT INTO tbl3 VALUES (1), (2), (3);

query I
SELECT u::UNION(i SMALLINT) FROM tbl3 ORDER BY ALL;;
----
1
2
3

statement ok
CREATE TABLE tbl4 (u UNION(i INT, b BLOB));

statement ok
INSERT INTO tbl4 VALUES (1), ('010203'::BLOB), (3), ('070809'::BLOB);

# fails since b is missing
statement error
SELECT u::UNION(i SMALLINT, v VARCHAR) FROM tbl4;

# succeeds since b is present
query I
SELECT u::UNION(i SMALLINT, b VARCHAR) FROM tbl4 ORDER BY ALL;;
----
1
3
010203
070809

# fails since b is not compatible
statement error
SELECT u::UNION(i SMALLINT, b INT) FROM tbl4;

statement ok
DELETE FROM tbl4 WHERE union_tag(u) == 'b';

statement ok
INSERT INTO tbl4 VALUES (union_value(b := NULL::BLOB)), (union_value(b := NULL)), (NULL), (NULL::BLOB);

# succeeds since all members of b is null, therefore TryNullCast allows to cast blob -> int.
query III
SELECT union_tag(u), union_tag(u::UNION(i SMALLINT, b INT)), u::UNION(i SMALLINT, b INT) FROM tbl4 ORDER BY ALL;;
----
NULL	NULL	NULL
NULL	NULL	NULL
i		i		1
i		i		3
b		b		NULL
b		b		NULL
