# name: test/sql/storage/vacuum/test_truncate_after_delete.test_slow
# description: Test truncating of the database file after data is deleted
# group: [vacuum]

load __TEST_DIR__/truncate_after_delete.db

statement ok
CREATE TABLE uuids (i VARCHAR);

# for smaller block sizes (16KB) the total blocks alternate between a few values in the loop,
# therefore, we need to compare to a range of total block counts
statement ok
CREATE TABLE total_blocks_tbl AS SELECT total_blocks FROM pragma_database_size();

loop i 0 10

statement ok
DROP TABLE IF EXISTS integers;

statement ok
INSERT INTO uuids SELECT uuid()::varchar FROM range(1000000);

statement ok
CHECKPOINT;

# note that just deleting does not free the space yet
# that is because deleting + checkpointing causes the metadata to be written at the END of the file
# as we cannot override the deleted data yet
statement ok
DELETE FROM uuids;

statement ok
CHECKPOINT;

# doing ANOTHER action and checkpointing again causes the data to be truncated
# since the metadata can then overwrite the previously written data
statement ok
CREATE TABLE integers(i INTEGER);

statement ok
INSERT INTO integers VALUES (1), (2), (3);

statement ok
CHECKPOINT;

# ensure that the total blocks don't exceed the total blocks after the first iteration
# by more than 1.2

query I
SELECT CASE WHEN ${i} = 0 THEN True
	WHEN current.total_blocks <= total_blocks_tbl.total_blocks * 1.2 THEN True
	ELSE False END
FROM pragma_database_size() AS current, total_blocks_tbl;
----
1

# adjust total_blocks_tbl once to the count after the first iteration

statement ok
UPDATE total_blocks_tbl SET total_blocks = (
	SELECT CASE WHEN ${i} = 0 THEN (SELECT current.total_blocks FROM pragma_database_size() AS current)
		ELSE (total_blocks) END);

endloop

restart

query I
FROM integers;
----
1
2
3

query I
FROM uuids;
----

# resume operation after truncation
restart

statement ok
DELETE FROM integers;

statement ok
INSERT INTO integers FROM range(1000000);

query I
SELECT SUM(i) FROM integers;
----
499999500000

restart

query I
SELECT SUM(i) FROM integers;
----
499999500000
