# name: test/sql/storage/vacuum/vacuum_rebuild_indexes_attach_overrides_global.test_slow
# description: Test that setting the ATTACH option vacuum_rebuild_indexes overrides the global setting
# group: [vacuum]

require vacuum_rebuild_indexes

# set threshold at 0
statement ok
ATTACH '__TEST_DIR__/attach_vacuum_indexed.db' AS db1 (vacuum_rebuild_indexes 0)

statement ok
CREATE TABLE db1.t(i INTEGER);

statement ok
CREATE INDEX idx ON db1.t(i);

# insert enough rows for 2 row groups (122880 rows each)
statement ok
INSERT INTO db1.t SELECT i FROM range(245760) t(i);

statement ok
CHECKPOINT db1

query I
SELECT COUNT(DISTINCT row_group_id) FROM pragma_storage_info('db1.t')
----
2

# delete all rows in the first row group
statement ok
DELETE FROM db1.t WHERE i < 122880

statement ok
CHECKPOINT db1

# the empty first row group is not dropped
query I
SELECT COUNT(DISTINCT row_group_id) FROM pragma_storage_info('db1.t')
----
2

# verify index lookups still return the original row IDs
query II
SELECT i, rowid FROM db1.t WHERE i = 122880
----
122880	122880

query II
SELECT i, rowid FROM db1.t WHERE i = 245759
----
245759	245759

statement ok
DETACH db1
