# name: test/sql/storage/vacuum/vacuum_deletes_cleanup.test_slow
# description: Verify that deleting rows and re-appending does not increase storage size
# group: [vacuum]

load __TEST_DIR__/vacuum_deletes_cleanup.db

statement ok
CREATE TABLE integers(i INTEGER);

# verify that deleting an entire table in a loop doesn't increase database size (i.e. deletes are vacuumed correctly)

loop i 0 10

statement ok
INSERT INTO integers SELECT * FROM range(1000000);

query I
SELECT SUM(i) FROM integers;
----
499999500000

statement ok
DELETE FROM integers;

query I
SELECT SUM(i) FROM integers;
----
NULL

# ensure that the expected total storage size is the same as in the first iteration of the loop

query I nosort expected_blocks_delete_table
SELECT total_blocks FROM pragma_database_size();

endloop

# do the same but delete in segments

# for smaller block sizes (16KB) the total blocks alternate between a few values in the loop,
# therefore, we need to compare to a range of total block counts
statement ok
CREATE TABLE total_blocks_tbl AS SELECT total_blocks FROM pragma_database_size();

loop i 0 10

statement ok
INSERT INTO integers SELECT * FROM range(1000000);

query I
SELECT SUM(i) FROM integers;
----
499999500000

statement ok
DELETE FROM integers WHERE i < 200000;

query I
SELECT SUM(i) FROM integers;
----
479999600000

statement ok
DELETE FROM integers WHERE i < 400000;

query I
SELECT SUM(i) FROM integers;
----
419999700000

statement ok
DELETE FROM integers WHERE i < 600000;

query I
SELECT SUM(i) FROM integers;
----
319999800000

statement ok
DELETE FROM integers WHERE i < 800000;

query I
SELECT SUM(i) FROM integers;
----
179999900000

statement ok
DELETE FROM integers;

query I
SELECT SUM(i) FROM integers;
----
NULL

# ensure that the total blocks don't exceed the total blocks after the first iteration
# by more than 1.2

query I
SELECT CASE WHEN ${i} = 0 THEN True
	WHEN current.total_blocks <= total_blocks_tbl.total_blocks * 1.2 THEN True
	ELSE False END
FROM pragma_database_size() AS current, total_blocks_tbl;
----
1

# adjust total_blocks_tbl once to the count after the first iteration

statement ok
UPDATE total_blocks_tbl SET total_blocks = (
	SELECT CASE WHEN ${i} = 0 THEN (SELECT current.total_blocks FROM pragma_database_size() AS current)
		ELSE (total_blocks) END);

endloop
