# name: test/sql/storage/vacuum/vacuum_deletes_cleanup.test_slow
# description: Verify that deleting rows and re-appending does not increase storage size
# group: [vacuum]

load __TEST_DIR__/vacuum_deletes_cleanup.db

statement ok
CREATE TABLE integers(i INTEGER);

# verify that deleting an entire table in a loop doesn't increase database size (i.e. deletes are vacuumed correctly)
loop i 0 10

statement ok
INSERT INTO integers SELECT * FROM range(1000000);

query I
SELECT SUM(i) FROM integers
----
499999500000

statement ok
DELETE FROM integers

query I
SELECT SUM(i) FROM integers
----
NULL

query I
SELECT total_blocks * block_size < 15 * 262144 FROM pragma_database_size()
----
true

endloop

# do the same but delete in segments
loop i 0 10

statement ok
INSERT INTO integers SELECT * FROM range(1000000);

query I
SELECT SUM(i) FROM integers
----
499999500000

statement ok
DELETE FROM integers WHERE i < 200000

query I
SELECT SUM(i) FROM integers
----
479999600000

statement ok
DELETE FROM integers WHERE i < 400000

query I
SELECT SUM(i) FROM integers
----
419999700000

statement ok
DELETE FROM integers WHERE i < 600000

query I
SELECT SUM(i) FROM integers
----
319999800000

statement ok
DELETE FROM integers WHERE i < 800000

query I
SELECT SUM(i) FROM integers
----
179999900000

statement ok
DELETE FROM integers

query I
SELECT SUM(i) FROM integers
----
NULL

query I
SELECT total_blocks * block_size < 15 * 262144 FROM pragma_database_size()
----
true

endloop
