# name: test/sql/storage/vacuum/vacuum_rebuild_indexes.test_slow
# description: Test that vacuum correctly rebuilds indexes when empty row groups are dropped
# group: [vacuum]

load {TEST_DIR}/vacuum_rebuild_indexes.db

statement ok
SET wal_autocheckpoint='100GB'

statement ok
CREATE TABLE t(i INTEGER);

statement ok
CREATE INDEX idx ON t(i);

# insert enough rows for 2 row groups (122880 rows each)
statement ok
INSERT INTO t SELECT i FROM range(245760) tbl(i);

statement ok
CHECKPOINT

query I
SELECT COUNT(DISTINCT row_group_id) FROM pragma_storage_info('t')
----
2

# delete all rows in the first row group
statement ok
DELETE FROM t WHERE i < 122880

statement ok
SET experimental_vacuum_rebuild_indexes = true

statement ok
CHECKPOINT

# the empty first row group is dropped, shifting row IDs of the second group
query I
SELECT COUNT(DISTINCT row_group_id) FROM pragma_storage_info('t')
----
1

# verify index lookups still work after row IDs shifted
query I
SELECT COUNT(*) FROM t WHERE i = 122880
----
1

query I
SELECT COUNT(*) FROM t WHERE i = 245759
----
1

query I
SELECT COUNT(*) FROM t
----
122880
