# name: test/sql/storage/vacuum/vacuum_rebuild_indexes.test_slow
# description: Test that vacuum correctly rebuilds indexes when empty row groups are dropped
# group: [vacuum]

require vacuum_rebuild_indexes

load {TEST_DIR}/vacuum_rebuild_indexes.db

statement ok
SET wal_autocheckpoint='100GB'

statement ok
SET index_scan_percentage = 1.0

statement ok
SET index_scan_max_count = 0

statement ok
CREATE TABLE t(i INTEGER);

statement ok
CREATE INDEX idx ON t(i);

# insert enough rows for 2 row groups (122880 rows each)
statement ok
INSERT INTO t SELECT i FROM range(245760) tbl(i);

statement ok
CHECKPOINT

query I
SELECT COUNT(DISTINCT row_group_id) FROM pragma_storage_info('t')
----
2

# delete all rows in the first row group
statement ok
DELETE FROM t WHERE i < 122880

statement ok
CHECKPOINT

# the empty first row group is dropped, shifting row IDs of the second group
query I
SELECT COUNT(DISTINCT row_group_id) FROM pragma_storage_info('t')
----
1

# verify index scan is used after rebuild
query II
EXPLAIN ANALYZE SELECT i, rowid FROM t WHERE i = 122880
----
analyzed_plan	<REGEX>:.*Type: Index Scan.*

# verify index lookups return correct row IDs after shift
# RG0 dropped, RG1 shifts to rowid 0
query II
SELECT i, rowid FROM t WHERE i = 122880
----
122880	0

query II
SELECT i, rowid FROM t WHERE i = 245759
----
245759	122879

query I
SELECT COUNT(*) FROM t
----
122880

# verify that indexed appends honor SUGGEST_NEW when vacuum_rebuild_indexes is enabled
statement ok
CREATE TABLE append_test(i INTEGER);

statement ok
CREATE INDEX append_idx ON append_test(i);

statement ok
INSERT INTO append_test SELECT i FROM range(100000) tbl(i);

statement ok
CHECKPOINT

query II
SELECT row_group_id, max(count) FROM pragma_storage_info('append_test') GROUP BY row_group_id ORDER BY row_group_id
----
0	100000

statement ok
INSERT INTO append_test SELECT i FROM range(100000, 100100) tbl(i);

statement ok
CHECKPOINT

# the append starts a new row group instead of filling the existing indexed row group
query II
SELECT row_group_id, max(count) FROM pragma_storage_info('append_test') GROUP BY row_group_id ORDER BY row_group_id
----
0	100000
1	100

statement ok
DELETE FROM append_test WHERE i < 100000

statement ok
CHECKPOINT

# vacuum drops the deleted row group and rebuilds the index with shifted row IDs
query II
SELECT row_group_id, max(count) FROM pragma_storage_info('append_test') GROUP BY row_group_id ORDER BY row_group_id
----
0	100

query II
EXPLAIN ANALYZE SELECT i, rowid FROM append_test WHERE i = 100000
----
analyzed_plan	<REGEX>:.*Type: Index Scan.*

query II
SELECT i, rowid FROM append_test WHERE i = 100000
----
100000	0

query II
SELECT i, rowid FROM append_test WHERE i = 100099
----
100099	99

# verify that the setting cannot be changed while the database is running
statement error
SET vacuum_rebuild_indexes = 100
----
Cannot change vacuum_rebuild_indexes setting while database is running
