# name: test/sql/delete/test_delete_indexed.test
# description: Test deletions on tables with indexes
# group: [delete]

statement ok
CREATE TABLE t (id INT PRIMARY KEY, s TEXT, j BIGINT);

statement ok
CREATE INDEX idx ON t(j);

statement ok
INSERT INTO t VALUES (1, 'a', 10), (2, 'b', 20), (3, 'c', 30);

# verify initial state
query III
SELECT * FROM t ORDER BY id;
----
1	a	10
2	b	20
3	c	30

# delete using primary key
statement ok
DELETE FROM t WHERE id = 2;

query III
SELECT * FROM t ORDER BY id;
----
1	a	10
3	c	30

# delete using indexed column
statement ok
DELETE FROM t WHERE j = 30;

query III
SELECT * FROM t ORDER BY id;
----
1	a	10

# insert more data
statement ok
INSERT INTO t VALUES (4, 'd', 40), (5, 'e', 50);

# test transaction rollback
statement ok
BEGIN TRANSACTION

statement ok
DELETE FROM t WHERE j > 10;

query III
SELECT * FROM t ORDER BY id;
----
1	a	10

statement ok
ROLLBACK

query III
SELECT * FROM t ORDER BY id;
----
1	a	10
4	d	40
5	e	50

# delete everything
statement ok
DELETE FROM t;

query I
SELECT COUNT(*) FROM t;
----
0

# test delete and insert in same transaction with overlapping values
statement ok
INSERT INTO t VALUES (1, 'a', 10), (2, 'b', 20), (3, 'c', 30);

statement ok
BEGIN TRANSACTION;

# delete rows with j=20,30
statement ok
DELETE FROM t WHERE j >= 20;

# insert new rows with same ids and j values
statement ok
INSERT INTO t VALUES (2, 'new_20', 20), (3, 'new_30', 30);

# verify index lookup during transaction
query III
SELECT * FROM t WHERE j = 20;
----
2	new_20	20

query III
SELECT * FROM t WHERE j = 30;
----
3	new_30	30

statement ok
COMMIT;

# verify index lookups after commit
query III
SELECT * FROM t WHERE j = 20;
----
2	new_20	20

query III
SELECT * FROM t WHERE j = 30;
----
3	new_30	30

# test rollback with overlapping values
statement ok
BEGIN TRANSACTION;

# delete rows with j=20,30
statement ok
DELETE FROM t WHERE j >= 20;

# insert rows with same ids and j values again
statement ok
INSERT INTO t VALUES (2, 'tmp_20', 20), (3, 'tmp_30', 30);

# verify index lookup during transaction
query III
SELECT * FROM t WHERE j = 20;
----
2	tmp_20	20

query III
SELECT * FROM t WHERE j = 30;
----
3	tmp_30	30

statement ok
ROLLBACK;

# verify index lookups after rollback
query III
SELECT * FROM t WHERE j = 20;
----
2	new_20	20

query III
SELECT * FROM t WHERE j = 30;
----
3	new_30	30

# verify range queries on index
query III
SELECT * FROM t WHERE j >= 20 ORDER BY j;
----
2	new_20	20
3	new_30	30

# -----------------------------------------------------------------------------
# MERGE INTO DELETE with indexed table
# -----------------------------------------------------------------------------

# reset table
statement ok
DELETE FROM t;

statement ok
INSERT INTO t VALUES (1, 'a', 10), (2, 'b', 20), (3, 'c', 30);

# create source table for merge
statement ok
CREATE TABLE source (id INT, s TEXT, j BIGINT);

statement ok
INSERT INTO source VALUES (2, 'x', 200), (3, 'y', 300);

# MERGE INTO DELETE using primary key
statement ok
MERGE INTO t USING source ON t.id = source.id
WHEN MATCHED THEN DELETE;

query III
SELECT * FROM t ORDER BY id;
----
1	a	10

# verify we can insert rows with the deleted primary keys
statement ok
INSERT INTO t VALUES (2, 'new_b', 25), (3, 'new_c', 35);

query III
SELECT * FROM t ORDER BY id;
----
1	a	10
2	new_b	25
3	new_c	35

# verify index lookup works
query III
SELECT * FROM t WHERE j = 25;
----
2	new_b	25

# -----------------------------------------------------------------------------
# MERGE INTO DELETE and INSERT in same transaction with overlapping values
# -----------------------------------------------------------------------------

statement ok
DELETE FROM t;

statement ok
INSERT INTO t VALUES (1, 'a', 10), (2, 'b', 20), (3, 'c', 30);

statement ok
DELETE FROM source;

statement ok
INSERT INTO source VALUES (2, 'x', 200), (3, 'y', 300);

statement ok
BEGIN TRANSACTION;

# MERGE INTO DELETE rows with id=2,3
statement ok
MERGE INTO t USING source ON t.id = source.id
WHEN MATCHED THEN DELETE;

# insert new rows with same ids
statement ok
INSERT INTO t VALUES (2, 'merge_20', 20), (3, 'merge_30', 30);

# verify index lookup during transaction
query III
SELECT * FROM t WHERE j = 20;
----
2	merge_20	20

query III
SELECT * FROM t WHERE j = 30;
----
3	merge_30	30

statement ok
COMMIT;

# verify index lookups after commit
query III
SELECT * FROM t WHERE j = 20;
----
2	merge_20	20

query III
SELECT * FROM t WHERE j = 30;
----
3	merge_30	30

# -----------------------------------------------------------------------------
# MERGE INTO DELETE with rollback
# -----------------------------------------------------------------------------

statement ok
BEGIN TRANSACTION;

# MERGE INTO DELETE rows
statement ok
MERGE INTO t USING source ON t.id = source.id
WHEN MATCHED THEN DELETE;

# insert rows with same ids
statement ok
INSERT INTO t VALUES (2, 'tmp_20', 20), (3, 'tmp_30', 30);

# verify during transaction
query III
SELECT * FROM t WHERE j = 20;
----
2	tmp_20	20

statement ok
ROLLBACK;

# verify index lookups after rollback - should see original values
query III
SELECT * FROM t WHERE j = 20;
----
2	merge_20	20

query III
SELECT * FROM t WHERE j = 30;
----
3	merge_30	30

# cleanup
statement ok
DROP TABLE source;

# DELETE USING with an indexed table

statement ok
CREATE TABLE delete_using_indexed(id INTEGER PRIMARY KEY, payload VARCHAR);

statement ok
INSERT INTO delete_using_indexed SELECT range, range::VARCHAR FROM range(10);

query I
DELETE FROM delete_using_indexed USING range(100) source(i) WHERE source.i = 0;
----
10

query I
SELECT count(*) FROM delete_using_indexed;
----
0

# Verify deleted keys can be inserted again
statement ok
INSERT INTO delete_using_indexed SELECT range, range::VARCHAR FROM range(10);

query I rowsort
DELETE FROM delete_using_indexed USING range(100) source(i) WHERE source.i = 0 RETURNING id;
----
0
1
2
3
4
5
6
7
8
9

# Verify that deduplicated row IDs stay aligned with delete-index keys
statement ok
SET threads=1;

statement ok
PRAGMA disable_optimizer;

statement ok
CREATE TABLE delete_using_duplicate_indexed(id INTEGER PRIMARY KEY, payload VARCHAR);

statement ok
INSERT INTO delete_using_duplicate_indexed VALUES (0, 'zero'), (1, 'one');

statement ok
BEGIN;

query I rowsort
DELETE FROM delete_using_duplicate_indexed
USING (VALUES (0), (0), (1)) AS source(id)
WHERE delete_using_duplicate_indexed.id = source.id
RETURNING delete_using_duplicate_indexed.id;
----
0
1

statement ok
INSERT INTO delete_using_duplicate_indexed VALUES (1, 'replacement');

query IT
SELECT * FROM delete_using_duplicate_indexed;
----
1	replacement

statement ok
ROLLBACK;

statement ok
PRAGMA enable_optimizer;
