i_item_id|i_item_desc|i_category|i_class|i_current_price|itemrevenue|revenueratio
AAAAAAAAOJGAAAAA|NULL|Books|NULL|NULL|6277.86|30.1112144471821309
AAAAAAAAAAKAAAAA|Systematic, good contracts can hear to a leaves; social women seem at a books. Judicial products enable ever old leaders. Aside modest sons extend wome|Books|arts|2.42|0.17|0.000090711001366214399400
AAAAAAAAACKBAAAA|Social factors can report heavily different services. Patient values produce that given officers. Distinctive, am|Books|arts|6.92|18.24|0.00973275685246912144
AAAAAAAAAIJCAAAA|Very british plants increase poor, solid agencies. Small reasons ought to meet. Public institutions should die again central|Books|arts|1.76|6629.06|3.5372274748042190
AAAAAAAAAJIAAAAA|Public, small services wait chemical, private officers. Good, modest sources may vanish continental, corporate representatives. Criminal, relevant rules enable barely still ashamed years. Formidable, |Books|arts|0.43|494.88|0.26406506091830695280
AAAAAAAABFHDAAAA|Still left years require even. Di|Books|arts|2.58|22877.30|12.2071928915017452
AAAAAAAABHDCAAAA|Visible,|Books|arts|3.88|757.00|0.40393075314249588439
AAAAAAAACBACAAAA|Very gross years give even in a fingers. Conflicts finish visibly clear, alone years. Inland thanks strengthen currently causal serv|Books|arts|4.78|6989.37|3.7294867742292820
AAAAAAAACKDBAAAA|Australian boys hear also legal bodies. Severe, white men shall get only local, new seats. Youn|Books|arts|3.82|6760.59|3.6074111101553847
AAAAAAAACKEAAAAA|Physical, local rates cannot explain; quickly lovely horses used to take. Quick, various subjects keep usually; please easy sources ought to thin|Books|arts|35.27|375.96|0.20061004749201156234
AAAAAAAACMDCAAAA|Studies will ask to a issues. Systems remain houses. Likely patients look widely feet. Waters believe of cour|Books|arts|2.75|8455.38|4.5117410984227171
AAAAAAAACNEDAAAA|Fees mean members. Considerable countries travel very; lists threaten however really visible games. |Books|arts|6.89|219.56|0.11715592623509431490
AAAAAAAADCCDAAAA|Already similar lives take perhaps certain islands. Past thin facts find countries. Initial, steep shoulders ought to suggest concerned, hot references. Suitable|Books|arts|7.18|3195.96|1.7053454819198034
AAAAAAAADJFCAAAA|Systematically golden pupils can continue for instance over a cells. Other members assign often so-called, present farmers. British differences gain often|Books|arts|2.74|864.82|0.46146287177370315817
AAAAAAAADPCCAAAA|Bright, happy seconds slow available men; tensions see so mountains. Wo|Books|arts|4.23|156.42|0.08346479313943091973
AAAAAAAAEDKDAAAA|Corporations can see certainly subjects; other, british concentratio|Books|arts|4.24|8836.80|4.7152645698409612
AAAAAAAAEGAEAAAA|Realistic soldiers say at least turkish, economic others. Considerations sound well also evident services. Places can remain at a employees|Books|arts|9.57|1025.35|0.54712073676969373191
AAAAAAAAEPDDAAAA|Able, moral advisers get; premises should wrap terms. So public visits used to pay possible, mathematical duties. Political failures look both; probl|Books|arts|2.84|6.25|0.00333496328552258821
AAAAAAAAEPKAAAAA|Broken members give as subtle, legal lights. Correct years can get e|Books|arts|1.78|11768.01|6.2793410069860277
AAAAAAAAFBMBAAAA|Clinical families cope international newspapers. Again essential principles may not define usually current written books. There poli|Books|arts|4.78|1981.94|1.0575515414573822
AAAAAAAAFCKCAAAA|Here costly books must not correct thus necessary patterns. Other, monetary lovers can convey urgent blocks. Tomorrow recent years woul|Books|arts|2.44|212.58|0.11343143923782268838
AAAAAAAAGAKAAAAA|Genuine assets could say about; states put approximately issues. Bottom features continue local changes. Attacks make left, rural opportu|Books|arts|8.96|6234.03|3.3264417873354209
AAAAAAAAGFHBAAAA|Regular, european iss|Books|arts|1.75|1365.62|0.72868680991605710652
AAAAAAAAGHOBAAAA|Horrible members help immediately fast, heavy opportunities. Numerous, direct views go a|Books|arts|8.66|2706.24|1.4440337666900239
AAAAAAAAGOKBAAAA|Times shall describe public birds. Seconds mean in a stones; changes could not curb in short reasons. Rapidly new thousands may disclose rare|Books|arts|60.94|5088.32|2.7150976615984474
AAAAAAAAHPNCAAAA|Often frequent talks must judge now highly free years. Men match defiantly lovely, good clothes. Hours write also men. Children might not prefer apa|Books|arts|37.98|8364.29|4.4631360095141967
AAAAAAAAIAOAAAAA|Now dependent students know contrary lines; difficult possibilities ought to stay even current, strategic objectives. Advantages might know extremely years. Sensitive fans may take later; popular,|Books|arts|2.40|4806.10|2.5645067274480178
AAAAAAAAIEPCAAAA|Effectively direct years consider well professional adults. Quite current cars let electoral, commercial bonds. Statistical effects ma|Books|arts|0.91|5095.44|2.7188968517733147
AAAAAAAAIHKBAAAA|Large, real ways say by a buses. Whole budgets might not reduce on to a circ|Books|arts|9.19|114.75|0.06122992592219471960
AAAAAAAAIIPDAAAA|Refugees paint ago main, sure pieces. Letters shall not look instead great persons. Short sales drift high accused taxes. Steps know partly. Ashamed, adverse weeks use about. Loc|Books|arts|6.04|904.80|0.48279596491853405046
AAAAAAAAIJGAAAAA|Industrial figures shall not meet still. Live, civil years ought to spend tiny groups. Brief years know again unfortunately present texts. So as prime terms become. Effective sets get other oth|Books|arts|4.10|22562.06|12.0389826793212427
AAAAAAAAJJDBAAAA|Great signals must want developers. Also confident leve|Books|arts|1.20|12152.86|6.4846947062553666
AAAAAAAAKGBAAAAA|Important, scientific words replace sure united friends. Important areas list fresh, gross directions. Mild services leave sadly commercial, appropriate ju|Books|arts|5.60|125.66|0.06705143783340294958
AAAAAAAAKICDAAAA|Countries speak open crews. So special teachers could not go neighbouring, urban impl|Books|arts|1.89|7275.50|3.8821640614111345
AAAAAAAAMFFAAAAA|So tiny sales obtain as ill tons. Constant others increase women. New|Books|arts|8.22|12207.57|6.5138876408715172
AAAAAAAANIBAAAAA|Open, real terms should avoid discussions. Just obvious adults will say strong, poor drawings. Very chains would allow never in the agencies; young, other funds allow|Books|arts|2.72|286.30|0.15276799818321872087
AAAAAAAAOJJCAAAA|Italian, long buildings shall react. Industrial roses see police. Very continuous charges may mean to the tests. Boots should fight regional, nic|Books|arts|6.40|290.80|0.15516917174879498439
AAAAAAAAOKPBAAAA|Silent difficulties know new families. Added, vital rates say short. Others may raise home. Bare subjects shake very alone, modern constraints. Local relations feel i|Books|arts|2.60|2092.06|1.1163109265776617
AAAAAAAAOPKCAAAA|New, international servants form together in a stars. Details must allow respective areas.|Books|arts|9.12|8274.16|4.4150431709663326
AAAAAAAAPIEBAAAA|Across long rela|Books|arts|0.45|1466.70|0.78262250414015682118
AAAAAAAAPLLDAAAA|Strong budgets shall not take small costs; police used to show also twice miserable fields|Books|arts|9.00|4369.46|2.3315181884095245
AAAAAAAAABMBAAAA|Real, mutual fathers cease previously late others. Vital prices go hurriedly perhaps high republics. Medical issues happen victorian sectors. Officials used to attempt also on a campaigns. German, w|Books|business|3.16|1452.82|0.84464908970371934083
AAAAAAAAACEBAAAA|Seats demonstrate however equal eggs; apparent letters seem reluctantly. Different|Books|business|15.17|5252.71|3.0538516264765240
AAAAAAAAADFAAAAA|Good groups steal respective chapters. Components could rely needs. Men need only wide, private courts. New, sudden forms see only. Letters will not find at the faces. Just fascinating humans s|Books|business|78.25|10045.20|5.8401378256713161
AAAAAAAAAKBDAAAA|Rather difficult conclusions brighten in the issues. Days feel plants; games must not tie public, old w|Books|business|3.10|8965.42|5.2123689388991888
AAAAAAAAANHCAAAA|Quickly long lights experiment during a exhibitions. Popular, po|Books|business|4.80|1206.36|0.70136071630000885451
AAAAAAAABIPBAAAA|National, famous weeks become just sufficient women. Humans allow there things.|Books|business|2.57|299.84|0.17432275371812282812
AAAAAAAABKACAAAA|Important, horrible figures may spill single women. Large, used team|Books|business|5.25|4326.89|2.5155929156730539
AAAAAAAACDBCAAAA|Short, white rules used to enjoy as meetings. Complete, great relations will find away powers.|Books|business|1.22|9783.91|5.6882274991004506
AAAAAAAACDIBAAAA|Satisfactory rules provide. Forward solar te|Books|business|9.78|374.08|0.21748484428653744512
AAAAAAAACEACAAAA|Sufficient, national plans will see. Both high differences get togeth|Books|business|0.48|63.18|0.03673196231293690062
AAAAAAAACPODAAAA|Coming others may not imply more young organizations.|Books|business|2.93|7655.25|4.4506545504290948
AAAAAAAADHNCAAAA|Levels shall not|Books|business|45.06|5231.03|3.0412471797695840
AAAAAAAADNDDAAAA|Necessary qualities ask valuable families. Shareholders should ris|Books|business|4.57|9081.96|5.2801236538081737
AAAAAAAAEICAAAAA|Contemporary, signific|Books|business|2.42|1912.80|1.1120749843650792
AAAAAAAAEILDAAAA|Other things illustrate tonight in a opportunities. Parties cannot sustain later almost |Books|business|1.36|1195.15|0.69484338015679861937
AAAAAAAAFGJCAAAA|Repeatedly official users come shoulders. Independent, bri|Books|business|8.59|1401.12|0.81459143773191120911
AAAAAAAAFLMDAAAA|Forward low arrangements must present at the hours. Departments may not believe |Books|business|4.81|4995.43|2.9042726574377078
AAAAAAAAGFDCAAAA|Arguably only cells hurt far excellent details; recent, powerful points shall control. Only small ways will not hold. Small clothes will not take for ever into a men. Extended conclusions see. Interi|Books|business|6.00|251.09|0.14598019020505423197
AAAAAAAAGONBAAAA|Main, experienced stairs appear even never visible designs. Measures would move only on a results. More special interests ought to depend ther|Books|business|2.30|3788.07|2.2023305552194822
AAAAAAAAIBKDAAAA|Cups must not want actually patients. Soviet, other tories remember also financial reports. Strategies will not manage thus large, previous games|Books|business|0.78|841.22|0.48907346212232952733
AAAAAAAAIINDAAAA|Hands must write fo|Books|business|6.97|9813.83|5.7056225657734970
AAAAAAAAIJECAAAA|Minute, important potat|Books|business|4.34|203.00|0.11802134139800871835
AAAAAAAAIJJCAAAA|Eventual, civil companies may not include immediately occasional s|Books|business|3.01|3242.32|1.8850391903526681
AAAAAAAAIKEAAAAA|Complex, complete doubts say as eyes. Desperately general missiles ought |Books|business|9.44|2804.00|1.6302061146798840
AAAAAAAAIPADAAAA|Due eligible workers used to join accessible, loose procedures. Days cannot learn customs. Other lines change to the buildings; things keep signific|Books|business|5.15|2303.55|1.3392515319082906
AAAAAAAAJMEDAAAA|Clear ways could look recently written houses. Courts feel here more other cases; part-time, political readers marry small, complete forms. Especially bitter matters love poten|Books|business|3.06|1295.61|0.75324940950085751516
AAAAAAAAKAJDAAAA|Clearly urban experiences would add sufficiently tanks. Proposals see personally grey, remarkable words. Social goods meet formal campaigns. Areas could not travel days. Liberal, upper wages would|Books|business|4.43|1310.40|0.76184810723128386464
AAAAAAAAKAKAAAAA|Enterprises used to ensure of course intentions; foreign, financial banks shall not wa|Books|business|7.68|9667.46|5.6205251089241052
AAAAAAAAKMAAAAAA|Conservative women ought to beat positions. Agai|Books|business|0.19|10461.97|6.0824420348065284
AAAAAAAALDFAAAAA|Dramatically particular charts used to boost unusually false organisers. I|Books|business|3.68|0.00|0.000000000000000000000000
AAAAAAAALGBBAAAA|Members can crack far conditions. Likely, large students put with a shops; wild r|Books|business|1.94|2008.96|1.1679810542608059
AAAAAAAAMALDAAAA|Charges confront slightly for a friends. Free comments return past very social parts. Easy effects sell creditors|Books|business|91.76|321.28|0.18678766780469084251
AAAAAAAAMIGCAAAA|Qualities shall deal certain figures. Available countries guide versus a buildings. General, reluctant accounts must be|Books|business|6.63|8930.41|5.1920146179024189
AAAAAAAAMIMCAAAA|Very cognitive figures identify never public babies. Large, old gardens ignore. Commercial, little guidelines gain financial, illegal trousers. Jo|Books|business|0.77|8525.90|4.9568382001245445
AAAAAAAAMKHAAAAA|Large, different villages read areas; evident, technical men claim for the assessments.|Books|business|8.90|11279.04|6.5574750270039224
AAAAAAAAMKNDAAAA|Then young feet move. Economic, key habits must not see both white, tall walls. Economic, available keys must play always. Important feet could charge for t|Books|business|1.28|4083.12|2.3738684703893466
AAAAAAAANACBAAAA|Just, level colleag|Books|business|2.95|3241.16|1.8843647826875366
AAAAAAAAPDNAAAAA|Continuous, responsible households like mo|Books|business|5.20|1406.40|0.81766115538009586938
AAAAAAAAPEKCAAAA|Wealthy patterns could lov|Books|business|4.67|5338.57|3.1037694214146178
AAAAAAAAPGDBAAAA|Living, c|Books|business|0.60|4401.20|2.5587957032557437
AAAAAAAAPHJAAAAA|Actual kids take closer; affairs should stay after a prices. Young tiles remove meanwhile there possible reasons. Politicians cannot|Books|business|6.64|3241.08|1.8843182718140793
AAAAAAAAAALDAAAA|Definite, natural words like needs. Right common plans find so parental, traditional forces. All le|Books|computers|17.54|11255.95|4.9755271580295623
AAAAAAAAAHKDAAAA|Steps paint conscious resources. Social, great lips ought to show else clear standards; both far stairs cannot supply then. Feet leave yesterday delightful fr|Books|computers|8.77|3366.39|1.4880631905364841
AAAAAAAAAKGDAAAA|Important, new hands write from a doctors. Probably easy authoritie|Books|computers|0.19|2099.26|0.92794700951631260524
AAAAAAAAAOBCAAAA|Bizarre, old ideas would sit nowadays normal movement|Books|computers|5.23|1962.12|0.86732628941252979097
AAAAAAAABHEEAAAA|Positive women invest carefully easy, ordinary boys; chief, french students may think ever together political meetings. |Books|computers|6.97|7788.55|3.4428139825311188
AAAAAAAABLMBAAAA|So good disputes campaign needs. Outdoor factors proceed in the rooms; surprised rules might re|Books|computers|31.74|148.63|0.06569970562217616804
AAAAAAAACHOCAAAA|Again |Books|computers|6.22|10625.79|4.6969741976926819
AAAAAAAACOHDAAAA|Senior, new factors cannot write. Others live to the negotiations. Friends will balance friends; real, legal styles tell promptly particular degrees. Universities join here military products. Small c|Books|computers|3.56|40.22|0.01777865949084253165
AAAAAAAAEANCAAAA|Australian personnel shall spare jobs. Just substantial fathers make downwards wonderful, noble appeals. Individuals oug|Books|computers|9.75|11345.96|5.0153147547667760
AAAAAAAAEAPAAAAA|Red, international offers would expect further other communities. Barely nervous pupils defend late old companies. Much single walls tell papers. Accurately social increases can |Books|computers|4.01|1635.66|0.72301944760794369248
AAAAAAAAEDMAAAAA|Entire years should look well immensely permanent advertisements. Ever |Books|computers|44.48|2231.55|0.98642385844827577061
AAAAAAAAFEEAAAAA|Directly good effects could not complete. Implications may not investigate individually; electrical husba|Books|computers|3.83|12359.76|5.4634501349710564
AAAAAAAAFLFEAAAA|Huge, alone practitioners announce below in a|Books|computers|2.06|3843.18|1.6988211979616161
AAAAAAAAGENAAAAA|Poor officials should not leave|Books|computers|2.84|1813.32|0.80155143779051664555
AAAAAAAAGHCBAAAA|Classes expect. Apparent, useful particles get closely|Books|computers|9.77|15489.05|6.8467067574996150
AAAAAAAAGNGBAAAA|Exactly main friends ought to explain quite excitedly avail|Books|computers|3.42|4769.31|2.1082033440146742
AAAAAAAAHPADAAAA|Concentrations could reserve so other eyes. Following universities shall try effectively daily companies. Somehow liable beans lower ju|Books|computers|9.19|2148.75|0.94982333617473619776
AAAAAAAAIAMAAAAA|Patients kill; ago similar courts ought to serve |Books|computers|2.00|750.72|0.33184473528009212723
