i_item_id|i_item_desc|i_category|i_class|i_current_price|itemrevenue|revenueratio
AAAAAAAAAAKAAAAA|Systematic, good contracts can hear to a leaves; social women seem at a books. Judicial products enable ever old leaders. Aside modest sons extend wome|Books|arts|0.02|0.00|0.00000000000000000000
AAAAAAAAACKBAAAA|Social factors can report heavily different services. Patient values produce that given officers. Distinctive, am|Books|arts|0.06|0.18|0.00960671188937337553
AAAAAAAAAIJCAAAA|Very british plants increase poor, solid agencies. Small reasons ought to meet. Public institutions should die again central|Books|arts|0.01|66.28|3.5374048001537074
AAAAAAAAAJIAAAAA|Public, small services wait chemical, private officers. Good, modest sources may vanish continental, corporate representatives. Criminal, relevant rules enable barely still ashamed years. Formidable, |Books|arts|0.00|4.94|0.26365087074169152848
AAAAAAAABFHDAAAA|Still left years require even. Di|Books|arts|0.02|228.77|12.2095971051774840
AAAAAAAABHDCAAAA|Visible,|Books|arts|0.03|7.57|0.40401560556975807097
AAAAAAAACBACAAAA|Very gross years give even in a fingers. Conflicts finish visibly clear, alone years. Inland thanks strengthen currently causal serv|Books|arts|0.04|69.88|3.7295390379411749
AAAAAAAACKDBAAAA|Australian boys hear also legal bodies. Severe, white men shall get only local, new seats. Youn|Books|arts|0.03|67.60|3.6078540206757788
AAAAAAAACKEAAAAA|Physical, local rates cannot explain; quickly lovely horses used to take. Quick, various subjects keep usually; please easy sources ought to thin|Books|arts|0.35|3.75|0.20013983102861199024
AAAAAAAACMDCAAAA|Studies will ask to a issues. Systems remain houses. Likely patients look widely feet. Waters believe of cour|Books|arts|0.02|84.54|4.5119523507090287
AAAAAAAACNEDAAAA|Fees mean members. Considerable countries travel very; lists threaten however really visible games. |Books|arts|0.06|2.19|0.11688166132070940230
AAAAAAAADCCDAAAA|Already similar lives take perhaps certain islands. Past thin facts find countries. Initial, steep shoulders ought to suggest concerned, hot references. Suitable|Books|arts|0.07|31.94|1.7046576541476979
AAAAAAAADJFCAAAA|Systematically golden pupils can continue for instance over a cells. Other members assign often so-called, present farmers. British differences gain often|Books|arts|0.02|8.64|0.46112217068992202552
AAAAAAAADPCCAAAA|Bright, happy seconds slow available men; tensions see so mountains. Wo|Books|arts|0.04|1.55|0.08272446349182628930
AAAAAAAAEDKDAAAA|Corporations can see certainly subjects; other, british concentratio|Books|arts|0.04|88.36|4.7158281252501748
AAAAAAAAEGAEAAAA|Realistic soldiers say at least turkish, economic others. Considerations sound well also evident services. Places can remain at a employees|Books|arts|0.09|10.24|0.54651516526212980803
AAAAAAAAEPDDAAAA|Able, moral advisers get; premises should wrap terms. So public visits used to pay possible, mathematical duties. Political failures look both; probl|Books|arts|0.02|0.06|0.00320223729645779184
AAAAAAAAEPKAAAAA|Broken members give as subtle, legal lights. Correct years can get e|Books|arts|0.01|117.66|6.2795873383537298
AAAAAAAAFBMBAAAA|Clinical families cope international newspapers. Again essential principles may not define usually current written books. There poli|Books|arts|0.04|19.81|1.0572720140471476
AAAAAAAAFCKCAAAA|Here costly books must not correct thus necessary patterns. Other, monetary lovers can convey urgent blocks. Tomorrow recent years woul|Books|arts|0.02|2.12|0.11314571780817531182
AAAAAAAAGAKAAAAA|Genuine assets could say about; states put approximately issues. Bottom features continue local changes. Attacks make left, rural opportu|Books|arts|0.08|62.33|3.3265908448035694
AAAAAAAAGFHBAAAA|Regular, european iss|Books|arts|0.01|13.65|0.72850898494414764449
AAAAAAAAGHOBAAAA|Horrible members help immediately fast, heavy opportunities. Numerous, direct views go a|Books|arts|0.08|27.05|1.4436753144863878
AAAAAAAAGOKBAAAA|Times shall describe public birds. Seconds mean in a stones; changes could not curb in short reasons. Rapidly new thousands may disclose rare|Books|arts|0.60|50.87|2.7149635211801312
AAAAAAAAHPNCAAAA|Often frequent talks must judge now highly free years. Men match defiantly lovely, good clothes. Hours write also men. Children might not prefer apa|Books|arts|0.37|83.61|4.4623176726139329
AAAAAAAAIAOAAAAA|Now dependent students know contrary lines; difficult possibilities ought to stay even current, strategic objectives. Advantages might know extremely years. Sensitive fans may take later; popular,|Books|arts|0.02|48.06|2.5649920744626913
AAAAAAAAIEPCAAAA|Effectively direct years consider well professional adults. Quite current cars let electoral, commercial bonds. Statistical effects ma|Books|arts|0.00|50.94|2.7186994646926653
AAAAAAAAIHKBAAAA|Large, real ways say by a buses. Whole budgets might not reduce on to a circ|Books|arts|0.09|1.14|0.06084250863269804503
AAAAAAAAIIPDAAAA|Refugees paint ago main, sure pieces. Letters shall not look instead great persons. Short sales drift high accused taxes. Steps know partly. Ashamed, adverse weeks use about. Loc|Books|arts|0.06|9.04|0.48247041933297397115
AAAAAAAAIJGAAAAA|Industrial figures shall not meet still. Live, civil years ought to spend tiny groups. Brief years know again unfortunately present texts. So as prime terms become. Effective sets get other oth|Books|arts|0.04|225.59|12.0398785284652210
AAAAAAAAJJDBAAAA|Great signals must want developers. Also confident leve|Books|arts|0.01|121.52|6.4855979377591811
AAAAAAAAKGBAAAAA|Important, scientific words replace sure united friends. Important areas list fresh, gross directions. Mild services leave sadly commercial, appropriate ju|Books|arts|0.05|1.25|0.06671327700953733008
AAAAAAAAKICDAAAA|Countries speak open crews. So special teachers could not go neighbouring, urban impl|Books|arts|0.01|72.75|3.8827127219550726
AAAAAAAAMFFAAAAA|So tiny sales obtain as ill tons. Constant others increase women. New|Books|arts|0.08|122.07|6.5149517796433775
AAAAAAAANIBAAAAA|Open, real terms should avoid discussions. Just obvious adults will say strong, poor drawings. Very chains would allow never in the agencies; young, other funds allow|Books|arts|0.02|2.86|0.15263997779782141123
AAAAAAAAOJJCAAAA|Italian, long buildings shall react. Industrial roses see police. Very continuous charges may mean to the tests. Boots should fight regional, nic|Books|arts|0.06|2.90|0.15477480266212660579
AAAAAAAAOKPBAAAA|Silent difficulties know new families. Added, vital rates say short. Others may raise home. Bare subjects shake very alone, modern constraints. Local relations feel i|Books|arts|0.02|20.91|1.1159796978155405
AAAAAAAAOPKCAAAA|New, international servants form together in a stars. Details must allow respective areas.|Books|arts|0.09|82.74|4.4158852318152950
AAAAAAAAPIEBAAAA|Across long rela|Books|arts|0.00|14.66|0.78241331276785380719
AAAAAAAAPLLDAAAA|Strong budgets shall not take small costs; police used to show also twice miserable fields|Books|arts|0.09|43.67|2.3306950456051962
AAAAAAAAABMBAAAA|Real, mutual fathers cease previously late others. Vital prices go hurriedly perhaps high republics. Medical issues happen victorian sectors. Officials used to attempt also on a campaigns. German, w|Books|business|0.03|14.51|0.84375672359553175282
AAAAAAAAACEBAAAA|Seats demonstrate however equal eggs; apparent letters seem reluctantly. Different|Books|business|0.15|52.52|3.0540388093202845
AAAAAAAAADFAAAAA|Good groups steal respective chapters. Components could rely needs. Men need only wide, private courts. New, sudden forms see only. Letters will not find at the faces. Just fascinating humans s|Books|business|0.78|100.42|5.8394245474475051
AAAAAAAAAKBDAAAA|Rather difficult conclusions brighten in the issues. Days feel plants; games must not tie public, old w|Books|business|0.03|89.64|5.2125673813303561
AAAAAAAAANHCAAAA|Quickly long lights experiment during a exhibitions. Popular, po|Books|business|0.04|12.06|0.70128918584163424803
AAAAAAAABIPBAAAA|National, famous weeks become just sufficient women. Humans allow there things.|Books|business|0.02|2.99|0.17386854607516470992
AAAAAAAABKACAAAA|Important, horrible figures may spill single women. Large, used team|Books|business|0.05|43.26|2.5155696666259617
AAAAAAAACDBCAAAA|Short, white rules used to enjoy as meetings. Complete, great relations will find away powers.|Books|business|0.01|97.83|5.6888160075362420
AAAAAAAACDIBAAAA|Satisfactory rules provide. Forward solar te|Books|business|0.09|3.74|0.21748105763248027261
AAAAAAAACEACAAAA|Sufficient, national plans will see. Both high differences get togeth|Books|business|0.00|0.63|0.03663450970814507266
AAAAAAAACPODAAAA|Coming others may not imply more young organizations.|Books|business|0.02|76.53|4.4502206793084800
AAAAAAAADHNCAAAA|Levels shall not|Books|business|0.45|52.30|3.0412458059301386
AAAAAAAADNDDAAAA|Necessary qualities ask valuable families. Shareholders should ris|Books|business|0.04|90.81|5.2806028993597683
AAAAAAAAEICAAAAA|Contemporary, signific|Books|business|0.02|19.12|1.1118282946344981
AAAAAAAAEILDAAAA|Other things illustrate tonight in a opportunities. Parties cannot sustain later almost |Books|business|0.01|11.95|0.69489268414656129884
AAAAAAAAFGJCAAAA|Repeatedly official users come shoulders. Independent, bri|Books|business|0.08|14.01|0.81468171589065471102
AAAAAAAAFLMDAAAA|Forward low arrangements must present at the hours. Departments may not believe |Books|business|0.04|49.94|2.9040117695631189
AAAAAAAAGFDCAAAA|Arguably only cells hurt far excellent details; recent, powerful points shall control. Only small ways will not hold. Small clothes will not take for ever into a men. Extended conclusions see. Interi|Books|business|0.06|2.51|0.14595653867848274980
AAAAAAAAGONBAAAA|Main, experienced stairs appear even never visible designs. Measures would move only on a results. More special interests ought to depend ther|Books|business|0.02|37.88|2.2027225837214847
AAAAAAAAIBKDAAAA|Cups must not want actually patients. Soviet, other tories remember also financial reports. Strategies will not manage thus large, previous games|Books|business|0.00|8.41|0.48904162959603184295
AAAAAAAAIINDAAAA|Hands must write fo|Books|business|0.06|98.12|5.7056795120050707
AAAAAAAAIJECAAAA|Minute, important potat|Books|business|0.04|2.03|0.11804453128180078968
AAAAAAAAIJJCAAAA|Eventual, civil companies may not include immediately occasional s|Books|business|0.03|32.41|1.8846419994301298
AAAAAAAAIKEAAAAA|Complex, complete doubts say as eyes. Desperately general missiles ought |Books|business|0.09|28.04|1.6305264320895045
AAAAAAAAIPADAAAA|Due eligible workers used to join accessible, loose procedures. Days cannot learn customs. Other lines change to the buildings; things keep signific|Books|business|0.05|23.03|1.3391948548866365
AAAAAAAAJMEDAAAA|Clear ways could look recently written houses. Courts feel here more other cases; part-time, political readers marry small, complete forms. Especially bitter matters love poten|Books|business|0.03|12.95|0.75304269955631538242
AAAAAAAAKAJDAAAA|Clearly urban experiences would add sufficiently tanks. Proposals see personally grey, remarkable words. Social goods meet formal campaigns. Areas could not travel days. Liberal, upper wages would|Books|business|0.04|13.10|0.76176520186777849496
AAAAAAAAKAKAAAAA|Enterprises used to ensure of course intentions; foreign, financial banks shall not wa|Books|business|0.07|96.67|5.6213619896609273
AAAAAAAAKMAAAAAA|Conservative women ought to beat positions. Agai|Books|business|0.00|104.61|6.0830731120143747
AAAAAAAALDFAAAAA|Dramatically particular charts used to boost unusually false organisers. I|Books|business|0.03|0.00|0.00000000000000000000
AAAAAAAALGBBAAAA|Members can crack far conditions. Likely, large students put with a shops; wild r|Books|business|0.01|20.08|1.1676523094278620
AAAAAAAAMALDAAAA|Charges confront slightly for a friends. Free comments return past very social parts. Easy effects sell creditors|Books|business|0.91|3.21|0.18666154946531060831
AAAAAAAAMIGCAAAA|Qualities shall deal certain figures. Available countries guide versus a buildings. General, reluctant accounts must be|Books|business|0.06|89.30|5.1927963760910397
AAAAAAAAMIMCAAAA|Very cognitive figures identify never public babies. Large, old gardens ignore. Commercial, little guidelines gain financial, illegal trousers. Jo|Books|business|0.00|85.25|4.9572888136815356
AAAAAAAAMKHAAAAA|Large, different villages read areas; evident, technical men claim for the assessments.|Books|business|0.08|112.76|6.5569957376038705
AAAAAAAAMKNDAAAA|Then young feet move. Economic, key habits must not see both white, tall walls. Economic, available keys must play always. Important feet could charge for t|Books|business|0.01|40.83|2.3742651291802592
AAAAAAAANACBAAAA|Just, level colleag|Books|business|0.02|32.40|1.8840604992760323
AAAAAAAAPDNAAAAA|Continuous, responsible households like mo|Books|business|0.05|14.06|0.81758921666114241520
AAAAAAAAPEKCAAAA|Wealthy patterns could lov|Books|business|0.04|53.37|3.1034663224185754
AAAAAAAAPGDBAAAA|Living, c|Books|business|0.00|44.00|2.5586006780291797
AAAAAAAAPHJAAAAA|Actual kids take closer; affairs should stay after a prices. Young tiles remove meanwhile there possible reasons. Politicians cannot|Books|business|0.06|32.41|1.8846419994301298
AAAAAAAAAALDAAAA|Definite, natural words like needs. Right common plans find so parental, traditional forces. All le|Books|computers|0.17|112.54|4.9756830842691662
AAAAAAAAAHKDAAAA|Steps paint conscious resources. Social, great lips ought to show else clear standards; both far stairs cannot supply then. Feet leave yesterday delightful fr|Books|computers|0.08|33.65|1.4877531169864710
AAAAAAAAAKGDAAAA|Important, new hands write from a doctors. Probably easy authoritie|Books|computers|0.00|20.99|0.92802192943673180653
AAAAAAAAAOBCAAAA|Bizarre, old ideas would sit nowadays normal movement|Books|computers|0.05|19.62|0.86745070297992749138
AAAAAAAABHEEAAAA|Positive women invest carefully easy, ordinary boys; chief, french students may think ever together political meetings. |Books|computers|0.06|77.85|3.4419488902643912
AAAAAAAABLMBAAAA|So good disputes campaign needs. Outdoor factors proceed in the rooms; surprised rules might re|Books|computers|0.31|1.48|0.06543460960297108498
AAAAAAAACHOCAAAA|Again |Books|computers|0.06|106.24|4.6971438677159784
AAAAAAAACOHDAAAA|Senior, new factors cannot write. Others live to the negotiations. Friends will balance friends; real, legal styles tell promptly particular degrees. Universities join here military products. Small c|Books|computers|0.03|0.39|0.01724290388186400212
AAAAAAAAEANCAAAA|Australian personnel shall spare jobs. Just substantial fathers make downwards wonderful, noble appeals. Individuals oug|Books|computers|0.09|113.45|5.0159165266601822
AAAAAAAAEAPAAAAA|Red, international offers would expect further other communities. Barely nervous pupils defend late old companies. Much single walls tell papers. Accurately social increases can |Books|computers|0.04|16.35|0.72287558581660624282
AAAAAAAAEDMAAAAA|Entire years should look well immensely permanent advertisements. Ever |Books|computers|0.44|22.31|0.98638252719073304448
AAAAAAAAFEEAAAAA|Directly good effects could not complete. Implications may not investigate individually; electrical husba|Books|computers|0.03|123.58|5.4637899018480856
AAAAAAAAFLFEAAAA|Huge, alone practitioners announce below in a|Books|computers|0.02|38.43|1.6990892209744451
AAAAAAAAGENAAAAA|Poor officials should not leave|Books|computers|0.02|18.13|0.80157396763639579096
AAAAAAAAGHCBAAAA|Classes expect. Apparent, useful particles get closely|Books|computers|0.09|154.88|6.8476434698028119
AAAAAAAAGNGBAAAA|Exactly main friends ought to explain quite excitedly avail|Books|computers|0.03|47.69|2.1084976567335750
AAAAAAAAHPADAAAA|Concentrations could reserve so other eyes. Following universities shall try effectively daily companies. Somehow liable beans lower ju|Books|computers|0.09|21.48|0.94968609072420196304
AAAAAAAAIAMAAAAA|Patients kill; ago similar courts ought to serve |Books|computers|0.02|7.50|0.33159430542046157927
AAAAAAAAIGCEAAAA|Books ask in a buildings; different, tiny stories like then far considerable principles. Various clothes could take. Obvious sh|Books|computers|0.03|171.21|7.5696348041382969
