s_store_name|i_item_desc|revenue|i_current_price|i_wholesale_cost|i_brand
able|Ago likely posts try too. Equal shareholders place with the days. Real, civil winds start however on a lips. British, concerned women shall occur actually. Globa|29.96|84.88|43.28|corpnameless #1
able|Animals might scan so parents. Long wealthy functions talk here illegal citizens. Electri|7.86|7.10|3.05|amalgunivamalg #3
able|Dangers move above;|21.04|4.37|2.14|importoscholar #2
able|Gold drugs see. General, large subjects prot|30.68|58.24|36.69|importoamalgamalg #8
able|Here clear areas ou|2.72|8.32|3.91|amalgscholar #1
able|Hours would raise highly financial directions. European, favorite characters think largely to a symbols. Here possible steps end difficulties. Normal, new organisations would keep only institutions; |27.81|6.61|2.31|importobrand #7
able|Modern, major bodies join unfortunately wildly public boxes. Necessary nations shall not carry up to the years. Major movements develop yet important, useless arts. Used metres|8.16|40.11|35.69|exportiedu pack #1
able|New, clear days expose workers. Various feelings may want attitudes. New, genetic men know suddenly satisfied, large|9.81|1.88|1.01|importocorp #7
able|Occasionally industrial lawyers will wait. Feet would not give benefits. Evidently large parties shall prevent shops; hard stories should bend long novel patients. Forward sorry police|20.71|4.13|1.94|amalgbrand #8
able|Political, unfair bits put now white events. Needs shall commit here southern marks. Colleges repeat; social members|37.94|2.74|0.95|exportiedu pack #1
able|So narrow commentators stay in a shelves; political brothers must apply terribly international publications. Complete, dear subjects |1.30|5.41|1.62|univnameless #5
able|Solid, new resources preserve. Offences discuss a bit other, gothic cases. Long designs rule so sho|33.96|3.38|2.77|importoimporto #1
able|Therefore important years must not get arts. Well-known children might not believe typical|32.41|9.86|6.60|scholarunivamalg #9
able|Total styles cannot assume companies. Cases may constitute shops. Local years meet still different, superb players. Delicate, peaceful |32.69|2.99|2.15|importoexporti #1
able|Truly secret men must not pay. Intermediate men will confirm depending on a systems. Cheerful, other police defend from a men. However distant homes must say for a|29.72|2.46|1.72|amalgnameless #6
ation|Available, new flowers must drive however subsequent figures; often di|35.98|2.99|2.57|edu packnameless #3
ation|Extremely rural actions relax right; of course natural patients would end as hands. Industries could represent thin needs. Gradua|28.03|3.67|2.60|scholaramalgamalg #8
ation|Familiar, new accidents sleep. So environmental changes may not make only great n|35.45|1.33|0.86|importoedu pack #2
ation|Independent gains appear now new, agricultural things. Neat, high things make now. Dangerous rights will like by a consultants; happy days might make for a|29.19|3.91|2.54|maxinameless #10
ation|Minds should ge|0.19|4.76|1.66|corpcorp #6
ation|Polite banks d|31.36|1.82|1.36|maxiunivamalg #3
ation|Sciences could become soviet figures. Figures must provide deeply democratic, pleasant results; previous days add much with a organisers. Friends create thus|24.48|2.72|1.55|amalgamalg #1
bar|Annual, determined incidents play basic stages. National rates may sing as it wer|35.75|1.63|1.14|edu packexporti #1
bar|Cold, able arms tell very white spirits. Words could see attitudes. Photographs counteract problems. Perfect products ought to believe then able |18.94|1.73|1.47|amalgamalg #1
bar|Complex, a|22.59|4.31|3.87|importounivamalg #9
bar|Elegant years get. Developments must anticipate very important courts; certain forces go still heads. Owners show into a foreigners. Old places imp|39.37|5.46|2.78|importobrand #5
bar|Extra, young tr|23.72|8.51|6.04|corpunivamalg #11
bar|Foods cannot affirm yet across a actions. Complex, light students must not come very full criteria. Serious problems vary in the funds. Old schools must avoid yet main facilities; ago major skills |10.55|6.20|2.04|importoimporto #2
bar|Friends could not circulate simultaneously minds. Electronic, due hours must not produce rather very legal children. Common manufacturers work. New, good |23.30|4.53|2.21|importoedu pack #1
bar|General, constitutional readers can bear later relations. |13.49|8.97|4.03|exportiimporto #1
bar|Labour cases poison countries. Nowhere good arts can get only old alive areas. Generally new women ou|17.91|2.63|1.18|exportiamalg #1
bar|Likely shoulders decide. Early parents disturb thus in a goals. Public, great words may get here c|25.33|5.96|5.06|edu packimporto #1
bar|Massive breasts shall not receive finally at the persons; internal, present women may demand final, typical times. There medical|27.59|3.40|1.70|importoamalg #2
bar|New, normal complaints would push just critical, distinct areas. Ready broad children might sell even level valid organi|40.03|6.93|3.04|importoimporto #1
bar|Of course red meetings shall not take even friends. Dry cups might work with a years. Twins come therefore individ|18.38|9.49|3.79|importoimporto #2
bar|Others will understand now. Broken times like still. Wrong papers develop; relations used to introduce; old laws should not stay slightly to the worlds. Free, particular cases |37.68|6.37|4.84|corpmaxi #3
bar|Welsh, early organisations resp|25.01|0.55|0.19|namelessbrand #5
eing|Christian, special powers will sing drugs. Everyday police seem men. Awful days would deal once then particular players. Very hospitals shall make parts|19.73|2.24|0.85|corpamalgamalg #6
eing|Essential children call alone, safe words. Central initiatives pla|29.11|6.37|5.66|amalgunivamalg #8
eing|International, strong areas ensure above a legs; political, recent advantages shall see more significant, american estates. Members find|35.30|5.43|2.98|edu packedu pack #1
eing|Late applications shall make so. Circumstances find new figures. Directly other arrangements compromise at a horses. Proper, blue men ought to|13.63|1.74|1.07|scholarmaxi #2
eing|Loud awkward years shall describe also; popular roads go far social games; equ|30.03|6.44|3.86|edu packexporti #2
eing|Material problems join as. Political fingers must f|13.38|9.17|6.05|maxinameless #2
eing|Odd, new markets used to fall in a provisions. C|17.55|2.23|0.98|edu packamalg #1
eing|Pensioners used to laugh very northern wounds; contemporary reports cannot lead simultaneously; softly dangerous classes might look usually to a adults; teams cannot|2.56|0.59|0.25|amalgbrand #2
eing|Police ta|38.59|6.16|2.95|importoamalgamalg #4
eing|So british clothes speed in a clothes; representative newspapers|36.94|4.72|1.79|importoexporti #2
eing|Territories settle then in a specimens; important areas spend considerably with the numbers. Social, close men present through a districts. Here suitable students could sell too with a conservativ|32.36|1.26|0.71|edu packscholar #1
eing|Valid, aware details ought to ask to a aspirations. Differences will satisfy very original facts; afraid men could not sit bloody girls; decisions feel |38.92|4.25|2.50|scholarunivamalg #1
ese|Brief models might not influence between a facilities. Social qualifications mi|38.37|2.99|1.37|brandmaxi #5
ese|Bro|34.97|3.82|2.02|importoimporto #1
ese|Comparatively future penalties come adequate arms; women could get at the genes. Primitive, original compa|29.70|9.23|4.79|amalgnameless #7
ese|Contributions may need som|36.45|3.14|1.06|exportischolar #1
ese|Groups must resist over a authorities; ultimate, annual reports shall not use much; visits wonder yet under true applicat|26.24|6.16|4.00|exportibrand #4
ese|Lads would stand; mixed mountains work choices. Indeed old females sign terms; well likely colours confirm more religious, serious modes. |29.98|0.54|0.38|importoscholar #1
ese|Months fight perhaps women. Pounds shall understan|34.89|2.63|0.81|importoimporto #1
ese|Multiple eyes look now great leads. Good things make actually just public signs. Reactions must want over especially soviet girls. Also british pounds hold compatible men; new authori|36.05|2.78|1.66|amalgunivamalg #5
ese|Paintings cannot talk trousers. Momentarily general agents let very. Cost|27.36|0.29|0.25|amalgcorp #1
ese|Points mean merely public points. Personal, actual days ought to light ostensibly with a uses. Young, old divisions get in a subjects. Poor relations might not take recent discussions. Human, |33.34|4.66|1.86|exportiunivamalg #16
ese|Severe, glad plans should not shop due skills. So dif|20.02|68.46|60.24|amalgimporto #1
ought|Carers would follow either. Personal areas would not like professional, orthodox weapons. Considerable words tell unique stran|34.61|5.31|2.17|importoscholar #2
ought|Customers should achieve offices. Rather separate emotions let late from a women. Residential bonds fall particularly consistently different years. Restri|8.76|6.95|3.47|edu packbrand #5
ought|Democratic, frequent miners may give most however small cases. H|34.77|7.15|5.43|exportiimporto #1
ought|Entire, dangerous numbers lose somewhat to a workers. Northern, prime stages open. Classical, public heels look criteria. On|39.21|4.61|3.27|importoedu pack #2
ought|Equal councils prove also mysterious things. Pp. might not exploit int|26.61|88.12|67.85|importonameless #5
ought|Even international efforts pop services. Effectively leading problems shall ensure single, pleasant days. Police might not make yesterday all in|36.97|3.83|2.79|amalgbrand #9
ought|Hap|35.36|0.73|0.64|exportiimporto #1
ought|Large, british yards wait yesterday. Good republics must spread very shor|37.05|3.84|1.34|edu packbrand #3
ought|Most physical hopes con|18.62|1.36|0.55|importoamalgamalg #13
ought|Perhaps opposite years find soon really fine magistrates. Men ask then. Perhaps male opportunities intervene more. Competitive events cons|37.53|2.93|1.23|maxicorp #6
ought|Relevant planes can seem particular months; critical, canadian policies could make; also medical examinations ans|22.40|3.13|1.25|maxinameless #5
ought|Rivers indulge predominantly guests. National, social years might n|33.03|0.46|0.40|scholarcorp #1
ought|True ranks give inherently seldom natural values; nuclear, personal years deny. Fine, hard eggs accept previously electronic nurses. Able, increased reasons shall s|10.85|0.63|0.32|exportimaxi #4
ought|Unable, new members read alternately large families. Extremely british appeals believe with a weaknesses. Necessary, principal drivers used to say strings. Perhaps|29.10|2.06|1.81|amalgamalg #2
ought|Weekends shall say for the estates; themes remind also. Carefully just actions would protect almost public vari|4.11|5.88|1.94|amalgscholar #2
ought|Wonderful, silly businesses staff then themes. C|34.38|1.79|0.62|maximaxi #8
