# name: test/sql/trigger/trigger_update_from_multi_match.test
# description: UPDATE ... FROM multi-match dedup makes AFTER UPDATE transition tables predictable
# group: [trigger]

require noforcestorage

statement ok
CREATE TABLE t (id INTEGER, v INTEGER);

statement ok
INSERT INTO t VALUES (1, 0), (2, 0);

statement ok
CREATE TABLE audit (id INTEGER, old_v INTEGER, new_v INTEGER);

statement ok
CREATE TRIGGER trg AFTER UPDATE ON t
REFERENCING OLD TABLE AS o NEW TABLE AS n
FOR EACH STATEMENT
    INSERT INTO audit SELECT o.id, o.v, n.v FROM o JOIN n ON o.id = n.id;

statement ok
CREATE TABLE src (id INTEGER, v INTEGER);

# each target row matched by two source rows
statement ok
INSERT INTO src VALUES (1, 10), (1, 20), (2, 30), (2, 40);

statement ok
UPDATE t SET v = src.v FROM src WHERE t.id = src.id;

# each target row is updated once, so the transition tables carry exactly one image per row
query I
SELECT count(*) FROM audit;
----
2

# OLD image holds the pre-update values; NEW image holds one of the matching source values
query I
SELECT count(*) FROM audit WHERE old_v = 0 AND (new_v IN (10, 20) AND id = 1 OR new_v IN (30, 40) AND id = 2);
----
2

# the base table also ends up with one row per id, each updated once
query I
SELECT count(*) FROM t WHERE (id = 1 AND v IN (10, 20)) OR (id = 2 AND v IN (30, 40));
----
2

# ── del+insert path + OLD/NEW capture + multi-match ──────────────────────────────
# A LIST column forces the update through the del+insert path, so this exercises the OLD-capture
# selection-vector slicing on that path (AppendReturnRows with a dedup sel) together with multi-match.
statement ok
CREATE TABLE tl (id INTEGER, vals INTEGER[]);

statement ok
INSERT INTO tl VALUES (1, [0]), (2, [0]);

statement ok
CREATE TABLE tl_audit (id INTEGER, old_len INTEGER, new_len INTEGER);

statement ok
CREATE TRIGGER trg_l AFTER UPDATE ON tl
REFERENCING OLD TABLE AS o NEW TABLE AS n
FOR EACH STATEMENT
    INSERT INTO tl_audit SELECT o.id, len(o.vals), len(n.vals) FROM o JOIN n ON o.id = n.id;

statement ok
CREATE TABLE sl (id INTEGER, vals INTEGER[]);

# each target matched by two source rows; per id the matching lists share a length so len is deterministic
# even though which list wins is arbitrary (id=1 -> length 2, id=2 -> length 3)
statement ok
INSERT INTO sl VALUES (1, [9, 9]), (1, [1, 1]), (2, [8, 8, 8]), (2, [7, 7, 7]);

statement ok
UPDATE tl SET vals = sl.vals FROM sl WHERE tl.id = sl.id;

# one transition image per target row; OLD length is the pre-update [0] (len 1), NEW length is the match length
query III rowsort
SELECT id, old_len, new_len FROM tl_audit;
----
1	1	2
2	1	3

# base table updated once per row to a matching list
query II rowsort
SELECT id, len(vals) FROM tl;
----
1	2
2	3
