# name: test/sql/storage/delete/test_store_deletes.test
# description: Test deletes with storage
# group: [delete]

# load the DB from disk
load __TEST_DIR__/test_store_deletes.db

statement ok
BEGIN TRANSACTION;

statement ok
CREATE TABLE test (a INTEGER, b INTEGER);

statement ok
INSERT INTO test VALUES (11, 22), (12, 21), (13, 22), (12, 21)

statement ok
DELETE FROM test WHERE a=12

query II
SELECT a, b FROM test ORDER BY a
----
11	22
13	22

statement ok
COMMIT

statement ok
CHECKPOINT;

restart

query II
SELECT a, b FROM test ORDER BY a
----
11	22
13	22

statement ok
DELETE FROM test WHERE a=11

query II
SELECT a, b FROM test ORDER BY a
----
13	22

statement ok
INSERT INTO test VALUES (11, 24), (12, 25)

query II
SELECT a, b FROM test ORDER BY a
----
11	24
12	25
13	22

statement ok
DELETE FROM test WHERE a=12

query II
SELECT a, b FROM test ORDER BY a
----
11	24
13	22

statement ok
CHECKPOINT;

restart

query II
SELECT a, b FROM test ORDER BY a
----
11	24
13	22
