s_store_name|i_item_desc|revenue|i_current_price|i_wholesale_cost|i_brand
NULL|NULL|7.96|1.24|NULL|NULL
NULL|NULL|5.50|NULL|NULL|NULL
NULL|NULL|1.55|NULL|0.97|NULL
NULL|NULL|7.61|3.61|1.48|exportiedu pack #1
NULL|NULL|7.37|4.53|3.35|amalgmaxi #2
NULL|NULL|4.20|NULL|1.76|importobrand #3
NULL|NULL|3.30|NULL|1.51|NULL
NULL|NULL|2.11|4.38|NULL|NULL
NULL|NULL|2.49|1.10|NULL|namelessunivamalg #10
NULL|NULL|8.52|NULL|3.38|importobrand #2
NULL|NULL|7.49|NULL|NULL|scholarmaxi #9
NULL|NULL|0.99|NULL|NULL|NULL
NULL|NULL|3.04|NULL|NULL|NULL
NULL|NULL|4.01|NULL|NULL|NULL
NULL|NULL|5.92|2.29|NULL|NULL
NULL|NULL|3.20|51.67|NULL|NULL
NULL|A b|1.09|3.07|1.07|edu packbrand #4
NULL|A bit front ideas drink notions. Very great objects prove about up the years; closer financial conditions must|3.56|13.54|7.31|exportiedu pack #1
NULL|A bit new men would not appear somewhere. Relevant, safe prices charge normally black sites; other, other premises shall not try perhaps easily following firms. Periods seem very elsewhere|6.75|3.52|2.42|importoamalg #1
NULL|A little difficult arms permit cuts. Partial months give variously possible cards; too whole thoughts influence already domestic, similar diseases. Major, useful point|5.52|7.00|4.62|amalgscholar #1
NULL|A little likely details build in order ca|3.07|0.72|0.31|scholarcorp #7
NULL|A little middle babies know. Champions must not buy already long studies. New, intellectual banks obstruct always local rights. Giant, late bags ought to seem both likely kilometres. Military, f|1.77|0.32|0.27|univamalgamalg #17
NULL|A little necessary workers resign in a risks; effects justify just local flights. Words revive changes. Meals could suggest ever strongly sorry things. Numbers get loud particular cities. Lit|10.14|7.29|4.73|corpmaxi #11
NULL|A little single exhibitions contribute authorities. Busy police could reach intact, gro|7.62|0.78|0.66|corpcorp #2
NULL|A lot full males must use new councils. No longer ric|10.51|1.69|0.60|scholarunivamalg #5
NULL|Able|0.00|61.27|26.95|edu packimporto #2
NULL|Able amounts must cause now animals. Never large crimes extract fully rich boundaries. Other minutes shall say of course half way open jobs. Here advanced companies|4.48|2.33|1.95|corpmaxi #8
NULL|Able days will steer only. Other things raise schools. Intense, |5.70|9.72|8.26|edu packedu pack #2
NULL|Able months will conclude then other ministers. M|9.42|4.77|2.76|amalgscholar #2
NULL|Able paintings can suggest funds. Relevant, exp|2.91|7.07|3.39|scholarunivamalg #10
NULL|Able police could ensure intermediate results; late borders allow there voluntary costs. New, young waters tell. Words hold|9.03|80.43|38.60|importoamalgamalg #15
NULL|Able services ought to avoid now general, afraid uses. Unduly other instruments used to produce local recordings. Mature, invisible boys hide goods; novels could see of|1.52|6.24|3.30|amalgedu pack #2
NULL|Able theories retire best heavily bitter unions; more english languages should not like much frames. Evil hundreds gain so hard doctors. British, civil results make standards. Again conventio|0.51|0.15|0.06|edu packscholar #1
NULL|Able theories will discuss thus with a women; impressive unions might not kiss against a students. Young conditions find however. Royal fires bear today always true features. Als|1.64|8.64|7.34|edu packscholar #2
NULL|Able windows should sound. Greek, new papers will fetch however from a publications. Thin solicitors might arrive. Tonight improved units sense certainly. Almost good colours m|4.29|10.11|8.49|importoimporto #1
NULL|Able, cold days win|3.76|3.56|1.63|importobrand #9
NULL|Able, dirty versions ought to rely enough h|8.88|3.36|1.17|exportiedu pack #1
NULL|Able, early countries ask smoothly. Companies can decide late operations. Together easy officials exercise owners. Traditional, early holidays shall care therefo|1.91|0.27|0.13|exportischolar #1
NULL|Able, free|5.55|1.42|0.79|edu packexporti #2
NULL|Able, full sounds may contain. As added stories fill sometimes detailed, big ways. Very reluctant elections lie american departments. Manufactur|2.13|3.01|2.04|brandnameless #9
NULL|Able, interesting states ensure in a volunteers; possible, raw things help. Different, roman journalists look n|1.35|9.58|6.13|amalgunivamalg #1
NULL|Able, intern|3.67|2.94|2.32|exportiamalgamalg #4
NULL|Able, international steps come anyway comprehensive, outstanding projects. Fores|9.65|10.01|8.10|amalgbrand #5
NULL|Able, liberal numbers should include local, social indians. National, hostile words take. Beaches see enough on a delegates. E|3.62|3.87|1.78|importoscholar #1
NULL|Able, low days would look loud small a|8.43|4.75|2.94|amalgcorp #8
NULL|Able, only men might attempt efforts. Much preliminary circumstances could not plead totally now different experiences. Deep detailed rocks consist likewise in the service|7.96|2.88|2.10|corpcorp #1
NULL|Able, polish signs r|8.57|1.19|0.38|amalgbrand #3
NULL|Able, political videos must wish today vast winds. High early novels used to return. Fine relations |1.39|3.30|2.17|amalgimporto #1
NULL|Able, possible centuries satisfy eyes. Top cases renounce ever by a areas. Possible vessels ought to try eventually out of a years. Wide members provide. Just married adults buy only |7.42|4.25|3.01|maxiunivamalg #12
NULL|Able, potential changes could not ask well besides a areas; crucial, new thousands could mount ent|10.21|98.39|36.40|edu packbrand #7
NULL|Able, previous wheels deny results. About legal chairs taste very central models; quickly l|1.97|3.57|2.78|edu packscholar #1
NULL|About big years prevent also by a interests. Close vehicles would wonder independent followers. So different councils used to give quite local different telecommunications. So|10.45|9.93|7.24|amalgamalg #1
NULL|About british ideas obtain chief, other hours. At least military kinds can know ever brief local standards. Existing students embrace more formidable, excellent women. Short, social years recommend|1.30|3.83|2.18|edu packamalg #2
NULL|About complex governments give local statements. Changes used to hear genuine, unusual steps. Actions return industrial, regular feet. Members cross political walls. Clients sh|2.32|9.69|7.26|namelessmaxi #8
NULL|About free magazines could not appreciate unfairly new feet; following weapons appropriate much between the facilities. International, important addresses e|10.30|0.24|0.14|exportischolar #1
NULL|About fresh governments can reproduce separately subject individuals. Conclusions draw excitedly advisory, raw references. Hi|7.94|8.90|7.74|edu packunivamalg #3
NULL|About good centres avoid capable, integrated documents. Earlier empty qualifications will get in the networks. Customers may |0.55|6.83|2.45|maxinameless #5
NULL|About intimate soldiers can turn sternly for a rooms. Losses cannot decline outside additional prices. Great questions might use bloody complete, happy members; curren|8.55|0.55|0.48|amalgbrand #5
NULL|About origina|5.92|1.06|0.79|amalgedu pack #1
NULL|About raw targets help main, different services. Loca|1.43|9.28|5.56|scholarbrand #2
NULL|About sharp others will not return now in a areas; fal|4.31|4.94|1.48|edu packamalg #1
NULL|About small arms shou|0.67|0.41|0.19|importoexporti #1
NULL|About white terms drive rather vi|5.54|0.48|0.16|edu packimporto #1
NULL|Above capitalist cases shall take industries. However used chips might not bring best. Medical terms might lick sometimes well overall laws. Sta|1.83|98.74|66.15|corpbrand #5
NULL|Above new rates involve again chip|0.63|8.57|6.68|edu packexporti #1
NULL|Above white months would begin there to a boys. Almost popular |9.23|90.55|53.42|exportinameless #6
NULL|Abroad american faces would not obtain clearly in a deposits. Joint skills would not buy either in a costs. High, distinguished events like so misleading files. Real, pra|0.00|7.96|4.05|corpnameless #3
NULL|Absent, other authorities mention all. Other kind|0.94|1.95|0.99|edu packexporti #1
NULL|Absolute employers would not fight suggestions. Papers perform witnesses. Often formal studies cannot remain yet parties. Particu|7.20|9.75|4.77|amalgmaxi #11
NULL|Absolute ports unravel willing frames. Traditional, political fragments must commit free, advanced members. So new|6.74|3.49|1.46|amalgamalg #1
NULL|Absolute years may allow inhabitants. Sometimes local agents should|9.99|8.11|5.35|exportischolar #2
NULL|Absolute, brief women see moreover immediate walls. Rather content provisions must see officially.|5.04|4.16|1.99|edu packscholar #1
NULL|Absolute, french packages ought to see with an banks. Now practical rules get never so massive players. Affairs pass possibly today specific standards. Basic, traditional exchanges |8.34|0.76|0.53|exportiunivamalg #9
NULL|Absolute, great children break decisions. Medical prices see years. Easily light children know catholic, military metres. Regular milli|2.29|2.71|1.92|importoimporto #1
NULL|Absolute, intense tests may remove faces. Tropical, real characters will go firm,|0.30|5.12|2.35|exportibrand #3
NULL|Absolute, long areas would achieve still from the women. Hard |4.36|2.97|2.10|importomaxi #9
NULL|Absolutely only blues ask new consequences; also reduced risks may shift simply. White, sorry countries establish long despite the devices. Activ|0.53|3.57|2.78|amalgexporti #1
NULL|Absolutely powerful origins used to chew more in the waves; statements might not live major, certain systems. Select, green parents prove various children; years take. J|5.62|9.74|4.77|amalgscholar #1
NULL|Absolutely social makers turn also serious, royal bombs. Just national prices think yet professional, dominant taxes. Whole, separate stores receive. Late remarkable partners prefer still small, mi|4.97|4.39|3.20|edu packamalgamalg #2
NULL|Acad|5.90|4.21|3.28|importoedu pack #1
NULL|Academic, old candidates think true. Friends shal|3.12|2.14|1.17|amalgcorp #4
NULL|Acceptable journals pick teeth. Very real brothers must get fair terms. Whole concentrations could understand other, comp|4.23|3.70|3.29|exportiedu pack #1
NULL|Acceptable, great obligations run worse general roads. Measures shall |7.38|8.59|7.30|brandunivamalg #14
NULL|Acceptable, ready millions proceed consistently severe soldiers. Fine, voluntary classes might give just teachers. Clea|1.06|4.37|2.14|exportiamalg #1
NULL|Accidents preserve; resources stay virtually orders. Eggs would develop eventually for a rates. Distinctive, healthy disciplines|9.80|6.30|5.29|exportiimporto #1
NULL|Accordingly clinical reports should wonder toget|9.82|31.84|24.19|exportibrand #9
NULL|Accounts an|0.68|3.49|2.37|exportiamalg #2
NULL|Accounts come frequently only parties. Top, married centuries miss most new views. Bloody, other envi|10.30|8.90|4.09|edu packbrand #1
NULL|Accu|6.94|0.32|0.16|importoedu pack #2
NULL|Accurate boys care later. Away previous years must agree there secret, british c|10.34|1.00|0.39|importomaxi #8
NULL|Accused elections must rise combined sports; theories cannot repea|9.25|8.17|3.18|exportiexporti #1
NULL|Accused reasons shall not ensure enough facilities. Evident roots come parents. Reasons walk circumstances. Ministers may launch authorities; origins spend so to a trees; parts absorb just g|6.07|3.73|1.97|corpunivamalg #16
NULL|Across significant children include high, notable others. Trousers reflect excessive, british styles. Narro|3.43|6.25|4.06|corpbrand #2
NULL|Actions must go only deliberately wide men. Wide|3.59|3.03|2.69|exportiexporti #1
NULL|Active changes|6.83|4.25|1.74|scholarunivamalg #11
NULL|Active, exceptional ways would produce here white, unnecessary teams. Logical, labour cultures find tear|9.02|95.73|76.58|importoexporti #1
NULL|Active, open structures must conti|4.33|88.94|80.04|importocorp #7
NULL|Active, willing weeks might forget however detailed purposes; more significant factors notice implications. Indians must not create almost hands; compre|5.16|7.89|3.15|scholarbrand #9
NULL|Actively small words act. Sides recognize effects; great, small recommendations take. Police used to make well either special initiatives. Lad|6.49|3.85|2.31|brandnameless #2
NULL|Activities act. Programmes must not like pleasantly very witnesses. Definite, religious policies open about in the programmes. Long numbers occur later central|8.39|5.56|4.61|amalgamalg #1


