i_item_id|i_item_desc|i_current_price
AAAAAAAABMHKBAAA|Only english families push alone religious reasons. More than musical millions put photographs. Criticisms convey just sch|76.34
AAAAAAAACKEHCAAA|Ever alternative spirits disarm for instance with a proportions. Total policies ought to achieve too due neighbours. Separate|82.08
AAAAAAAADDLHBAAA|Sharply proposed tim|66.09
AAAAAAAADGEFBAAA|Real, common examples could check much aware, other rooms. Years say immediately ever short results. Certainly darling weeks slip back, white hands. Animal|86.30
AAAAAAAADNJHCAAA|Technically medical ci|63.76
AAAAAAAAECMCAAAA|Rather vast companies pose quiet, actual carers. Close times take only simple possibilities. Current events might say only on a foundation|67.28
AAAAAAAAFODHCAAA|Marine, small years prompt suddenly green materials. Violent buildings could act to no levels. Especially mediterranean proceedings might go meanwhile lengthy sets. Widespread, |82.29
AAAAAAAAFPCBCAAA|Far principles see gently green, mass assessments. Po|65.12
AAAAAAAAHCKOBAAA|British garden|87.85
AAAAAAAALIHCAAAA|Things select increased views. Tools imagine for example; ever likely developments live so scottish benefits. Soft, short-term services should give indeed good illu|86.90
AAAAAAAAMOBEBAAA|Standard improvements pay toget|64.56
AAAAAAAAOGKABAAA|Dry ministers help quite suggestions. Common times see hard silent tasks. Finally general words must care police. Disa|86.69
AAAAAAAAONLBCAAA|Too prot|62.68
AAAAAAAAOPOICAAA|Even wide respects would not go western points. Endlessly irish eyes must not identify a|85.31
