# name: test/sql/storage/reclaim_space/reclaim_space_drop_column_overflow_strings.test_slow
# description: Test that we reclaim space when dropping columns containing overflow strings
# group: [reclaim_space]

load __TEST_DIR__/reclaim_space_drop_column_overflow_strings.db

statement ok
PRAGMA force_checkpoint;

statement ok
CREATE TABLE strings AS SELECT i, repeat('X', case when i%17=0 then 5000 else i%7 end) AS s FROM generate_series(0,150000) tbl(i);

statement ok
CHECKPOINT;

statement ok
CHECKPOINT;

query IIIIII
SELECT AVG(STRLEN(s)), MIN(STRLEN(S)), MAX(STRLEN(S)), SUM(STRLEN(S)), MIN(S[1]), MAX(S[1]) FROM strings
----
296.955	0	5000	44543527	(empty)	X

loop i 0 10

statement ok
ALTER TABLE strings DROP COLUMN s;

statement ok
ALTER TABLE strings ADD COLUMN s VARCHAR;

statement ok
UPDATE strings SET s=repeat('X', case when i%17=0 then 5000 else i%7 end);

query IIIIII
SELECT AVG(STRLEN(s)), MIN(STRLEN(S)), MAX(STRLEN(S)), SUM(STRLEN(S)), MIN(S[1]), MAX(S[1]) FROM strings
----
296.955	0	5000	44543527	(empty)	X

statement ok
CHECKPOINT;

# ensure that the expected total storage size is the same as in the first iteration of the loop

query I nosort expected_blocks
SELECT total_blocks FROM pragma_database_size();

restart

query IIIIII
SELECT AVG(STRLEN(s)), MIN(STRLEN(S)), MAX(STRLEN(S)), SUM(STRLEN(S)), MIN(S[1]), MAX(S[1]) FROM strings
----
296.955	0	5000	44543527	(empty)	X

endloop
