# name: test/sql/storage/reclaim_space/test_reclaim_space_update.test_slow
# description: Test that we reclaim space when updating the values of a column
# group: [reclaim_space]

load __TEST_DIR__/test_reclaim_space.db

statement ok
PRAGMA force_checkpoint;

statement ok
CREATE TABLE integers AS SELECT i FROM range(1000000) tbl(i);

statement ok
CHECKPOINT;

statement ok
CHECKPOINT;

query III
SELECT MIN(i), MAX(i), COUNT(*) FROM integers
----
0	999999	1000000

loop i 0 10

statement ok
UPDATE integers SET i=i;

statement ok
CHECKPOINT;

query III
SELECT MIN(i), MAX(i), COUNT(*) FROM integers
----
0	999999	1000000

statement ok
UPDATE integers SET i=i;

statement ok
CHECKPOINT;

query III
SELECT MIN(i), MAX(i), COUNT(*) FROM integers
----
0	999999	1000000

statement ok
CHECKPOINT;

# ensure that the expected total storage size is the same as in the first iteration of the loop

query I nosort expected_blocks
SELECT total_blocks FROM pragma_database_size();

query III
SELECT MIN(i), MAX(i), COUNT(*) FROM integers
----
0	999999	1000000

endloop
