# name: test/sql/storage/reclaim_space/test_reclaim_space_drop_column.test_slow
# description: Test that we reclaim space when dropping and adding columns
# group: [reclaim_space]

load __TEST_DIR__/test_reclaim_space.db

statement ok
PRAGMA force_checkpoint;

statement ok
CREATE TABLE integers AS SELECT i, i j FROM range(1000000) tbl(i);

statement ok
CHECKPOINT;

statement ok
CHECKPOINT;

query III
SELECT MIN(j), MAX(j), COUNT(*) FROM integers
----
0	999999	1000000

loop i 0 10

statement ok
ALTER TABLE integers DROP COLUMN j;

statement ok
ALTER TABLE integers ADD COLUMN j INTEGER;

statement ok
UPDATE integers SET j=i;

query III
SELECT MIN(j), MAX(j), COUNT(*) FROM integers
----
0	999999	1000000

statement ok
CHECKPOINT;

query I nosort expected_blocks
select total_blocks from pragma_database_size();

query III
SELECT MIN(i), MAX(i), COUNT(*) FROM integers
----
0	999999	1000000

endloop
