# name: test/sql/copy/parquet/writer/parquet_write_enums.test
# description: ENUM tests
# group: [writer]

require parquet

# standard enum
statement ok
CREATE TYPE mood AS ENUM ('joy', 'ok', 'happy');

statement ok
CREATE TABLE enums(m mood);

statement ok
INSERT INTO enums VALUES
	('happy'), ('happy'), ('joy'), ('joy'),
	('happy'), ('happy'), ('joy'), ('joy'),
    ('happy'), ('happy'), ('joy'), ('joy'),
    ('happy'), ('happy'), ('joy'), ('joy'),
    ('happy'), ('happy'), ('joy'), ('joy'),
    ('happy'), ('happy'), ('joy'), ('joy'),
    ('happy'), ('happy'), ('joy'), ('joy'), ('joy')

statement ok
COPY enums TO '{TEST_DIR}/enums.parquet' (FORMAT PARQUET);

query I
SELECT * FROM '{TEST_DIR}/enums.parquet'
----
happy
happy
joy
joy
happy
happy
joy
joy
happy
happy
joy
joy
happy
happy
joy
joy
happy
happy
joy
joy
happy
happy
joy
joy
happy
happy
joy
joy
joy

# enum with null values
statement ok
UPDATE enums SET m=NULL WHERE m='joy'

statement ok
COPY enums TO '{TEST_DIR}/enums.parquet' (FORMAT PARQUET);

query I
SELECT * FROM '{TEST_DIR}/enums.parquet'
----
happy
happy
NULL
NULL
happy
happy
NULL
NULL
happy
happy
NULL
NULL
happy
happy
NULL
NULL
happy
happy
NULL
NULL
happy
happy
NULL
NULL
happy
happy
NULL
NULL
NULL

# all values are null
statement ok
UPDATE enums SET m=NULL

statement ok
COPY enums TO '{TEST_DIR}/enums.parquet' (FORMAT PARQUET);

query I
SELECT * FROM '{TEST_DIR}/enums.parquet'
----
NULL
NULL
NULL
NULL
NULL
NULL
NULL
NULL
NULL
NULL
NULL
NULL
NULL
NULL
NULL
NULL
NULL
NULL
NULL
NULL
NULL
NULL
NULL
NULL
NULL
NULL
NULL
NULL
NULL

# regression test for https://github.com/duckdb/duckdb/issues/22548
statement ok
CREATE TYPE myenum AS ENUM ('a', 'b', 'c');

statement ok
CREATE TABLE t1 AS SELECT 'a'::myenum AS m FROM range(10) t(i);

statement ok
COPY t1 TO '__TEST_DIR__/enum_stats_single.parquet' (FORMAT PARQUET);

query II
SELECT stats_min, stats_max FROM parquet_metadata('__TEST_DIR__/enum_stats_single.parquet')
----
a	a
