# name: test/sql/types/struct/struct_updates.test
# description: Test updates on struct tables
# group: [struct]

require skip_reload

statement ok
PRAGMA enable_verification

statement ok
CREATE TABLE a(b ROW(i INTEGER, j INTEGER));

statement ok
INSERT INTO a VALUES ({'i': 1, 'j': 2});

query I
SELECT * FROM a ORDER BY (b).i;
----
{'i': 1, 'j': 2}

# standard update
statement ok
UPDATE a SET b={'i': 3, 'j': 4}

query I
SELECT * FROM a ORDER BY (b).i;
----
{'i': 3, 'j': 4}

# NULL update
statement ok
UPDATE a SET b=NULL

query I
SELECT * FROM a ORDER BY (b).i;
----
NULL

statement ok
UPDATE a SET b={'i': NULL, 'j': 4}

query I
SELECT * FROM a ORDER BY (b).i;
----
{'i': NULL, 'j': 4}

statement ok
UPDATE a SET b={'i': 3, 'j': NULL}

query I
SELECT * FROM a ORDER BY (b).i;
----
{'i': 3, 'j': NULL}

# rollbacks
statement ok
BEGIN TRANSACTION;

statement ok
UPDATE a SET b={'i': 3, 'j': 4}

query I
SELECT * FROM a ORDER BY (b).i;
----
{'i': 3, 'j': 4}

statement ok
ROLLBACK;

query I
SELECT * FROM a ORDER BY (b).i;
----
{'i': 3, 'j': NULL}

# updates with a filter
statement ok
INSERT INTO a VALUES ({'i': 2, 'j': 3});

query I
SELECT * FROM a
----
{'i': 3, 'j': NULL}
{'i': 2, 'j': 3}

statement ok
INSERT INTO a VALUES ({'i': 3, 'j': 4});

query I
SELECT * FROM a
----
{'i': 3, 'j': NULL}
{'i': 2, 'j': 3}
{'i': 3, 'j': 4}

query I
UPDATE a SET b={'i': NULL, 'j': NULL} WHERE (b).j>=3
----
2

query I
SELECT * FROM a
----
{'i': 3, 'j': NULL}
{'i': NULL, 'j': NULL}
{'i': NULL, 'j': NULL}
