# name: test/sql/types/struct/struct_projection_pushdown.test
# description: Test struct projection pushdown
# group: [struct]

statement ok
PRAGMA enable_verification

statement ok
CREATE TABLE test_structs(id INT, s STRUCT(a integer, b bool));

statement ok
INSERT INTO test_structs VALUES (1, {'a': 42, 'b': true}), (2, NULL), (3, {'a': 84, 'b': NULL}), (4, {'a': NULL, 'b': false});

query I
SELECT s.b FROM test_structs
----
true
NULL
NULL
false

query I
SELECT s['b'] FROM test_structs
----
true
NULL
NULL
false

query II
SELECT s['b'], s FROM test_structs
----
true	{'a': 42, 'b': true}
NULL	NULL
NULL	{'a': 84, 'b': NULL}
false	{'a': NULL, 'b': false}

query II
SELECT s.b, s.a FROM test_structs
----
true	42
NULL	NULL
NULL	84
false	NULL

query I
SELECT s FROM test_structs WHERE s.b
----
{'a': 42, 'b': true}

query I
SELECT a FROM (SELECT UNNEST(s) FROM test_structs) WHERE b
----
42

query I
SELECT id FROM test_structs WHERE s.b
----
1

statement ok
UPDATE test_structs SET s={'a': 84, 'b': false} WHERE id=2

query II
SELECT s['b'], s.a FROM test_structs WHERE id=2
----
false	84
